AU,first_author,TI,SO,JI,AB,DE,ID,LA,DT,DT2,TC,C1,DI,PA,AR,FU,FX,SN,PN,PP,PU,VL,PY,UT,NR,SC,U2,WC,EM,GA,RP,DB,CR,AU_UN,AU1_UN,AU_UN_NR,SR_FULL,SR,SE,BO,BE,BN
BENELLI G;BENVENUTI S;DESNEUX N;CANALE A,BENELLI G,CEPHALARIA TRANSSYLVANICA-BASED FLOWER STRIPS AS POTENTIAL FOOD SOURCE FOR BEES DURING DRY PERIODS IN EUROPEAN MEDITERRANEAN BASIN COUNTRIES,PLOS ONE,PLOS ONE,"THE INTRODUCTION OF SOWN WILDFLOWER STRIPS FAVOURS THE ESTABLISHMENT OF POLLINATOR COMMUNITIES, WITH SPECIAL REFERENCE TO SOCIAL APOIDEA. HERE, WE EVALUATED THE LATE SUMMER FLOWERING CEPHALARIA TRANSSYLVANICA AS SUITABLE SPECIES FOR STRIPS PROVIDING FOOD FOR POLLINATORS IN PAUCITY PERIODS. C. TRANSSYLVANICA SHOWED NO PARTICULAR REQUIREMENTS IN TERMS OF SEED GERMINATION AND GROWTH DURING SUMMER. THIS PLANT HAD AN EXCELLENT POTENTIAL OF SELF-SEEDING AND COMPETITIVENESS TOWARDS WEED COMPETITORS. C. TRANSSYLVANICA PREVENTED FROM ENTOMOPHILOUS POLLINATION SHOWED INBREEDING DEPRESSION, WITH A DECREASE IN SEED-SET AND ACCUMULATION OF SEED ENERGY RESERVES. HOWEVER, C. TRANSSYLVANICA DID NOT APPEAR TO BE VULNERABLE IN TERMS OF POLLINATION BIOLOGY SINCE IT HAD A WIDE RANGE OF POLLINATORS INCLUDING BEES, HOVERFLIES AND LEPIDOPTERA. C. TRANSSYLVANICA WAS VISITED MAINLY BY HONEYBEES AND BUMBLEBEES AND THESE LATTER POLLINATORS INCREASED THEIR VISITS ON C. TRANSSYLVANICA FLOWERS DURING EARLY AUTUMN. THIS PLANT MAY BE USEFUL AS AN ABUNDANT SOURCE OF POLLEN DURING FOOD PAUCITY PERIODS, SUCH AS AUTUMN. WE PROPOSED C. TRANSSYLVANICA FOR INCORPORATION INTO FLOWER STRIPS TO BE PLANTED IN NON-CROPPED FARMLANDS IN INTENSIVELY MANAGED AGRICULTURAL AREAS AS WELL AS IN PROXIMITY OF BEEHIVES. THE LATTER OPTION MAY FACILITATE THE HONEYBEES COLLECTING POLLEN AND NECTAR FOR THE COLONY, THEREBY ENSURING ROBUSTNESS TO OVERCOME THE WINTER SEASON.",NA,SOWN WILDFLOWER STRIPS; SOIL TEXTURE; NATIVE BEES; POLLINATION; CONSERVATION; HABITAT; WEED; BIODIVERSITY; ENHANCEMENT; DIVERSITY,ENGLISH,ARTICLE,ARTICLE,17,"BENELLI, G (REPRINT AUTHOR), UNIV PISA, DEPT AGR FOOD \& ENVIRONM, INSECT BEHAV GRP, PISA, ITALY.;BENELLI, GIOVANNI, CANALE, ANGELO, UNIV PISA, DEPT AGR FOOD \& ENVIRONM, INSECT BEHAV GRP, PISA, ITALY.;BENVENUTI, STEFANO, UNIV PISA, DEPT AGR FOOD \& ENVIRONM, AGRON \& AGROECOSYST MANAGEMENT SECT, PISA, ITALY.;DESNEUX, NICOLAS, FRENCH NATL INST AGR RES INRA, SOPHIA ANTIPOLIS, FRANCE.",10.1371/JOURNAL.PONE.0093153,"1160 BATTERY STREET, STE 100, SAN FRANCISCO, CA 94111 USA",E93153,"ITALIAN MINISTRY OF EDUCATION, UNIVERSITY AND RESEARCH (MIUR)MINISTERO DELL' ISTRUZIONE, DELL' UNIVERSITA E DELLA RICERCA (MIUR)","FUNDS WERE ACHIEVED BY THE ITALIAN MINISTRY OF EDUCATION, UNIVERSITY AND RESEARCH (MIUR). THE FUNDER HAD NO ROLE IN STUDY DESIGN, DATA COLLECTION AND ANALYSIS, DECISION TO PUBLISH, OR PREPARATION OF THE MANUSCRIPT.",1932-6203,3,NA,PUBLIC LIBRARY SCIENCE,9,2014,ISI000333677500083,58,SCIENCE \& TECHNOLOGY - OTHER TOPICS,40,MULTIDISCIPLINARY SCIENCES,G.BENELLISSSUP.IT ANGELO.CANALEUNIPI.IT,AE0SW,"BENELLI, G (REPRINT AUTHOR), UNIV PISA, DEPT AGR FOOD \& ENVIRONM, INSECT BEHAV GRP, PISA, ITALY",ISI,none,UNIV PISA;UNIV PISA;FRENCH NATL INST AGR RES INRA,UNIV PISA,NA,"BENELLI G, 2014, PLOS ONE","BENELLI G, 2014, PLOS ONE",NA,NA,NA,NA
IRWIN RE;WARREN PS;CARPER AL;ADLER LS,IRWIN RE,PLANT-ANIMAL INTERACTIONS IN SUBURBAN ENVIRONMENTS: IMPLICATIONS FOR FLORAL EVOLUTION,OECOLOGIA,OECOLOGIA,"PLANT INTERACTIONS WITH MUTUALISTS AND ANTAGONISTS VARY REMARKABLY ACROSS SPACE, AND HAVE PLAYED KEY ROLES IN THE ECOLOGY AND EVOLUTION OF FLOWERING PLANTS. ONE DOMINANT FORM OF SPATIAL VARIATION IS HUMAN MODIFICATION OF THE LANDSCAPE, INCLUDING URBANIZATION AND SUBURBANIZATION. OUR GOAL WAS TO ASSESS HOW SUBURBANIZATION AFFECTED PLANT-ANIMAL INTERACTIONS IN GELSEMIUM SEMPERVIRENS IN THE SOUTHEASTERN UNITED STATES, INCLUDING INTERACTIONS WITH MUTUALISTS (POLLINATION) AND ANTAGONISTS (NECTAR ROBBING AND FLORIVORY). BASED ON DIFFERENCES IN PLANT-ANIMAL INTERACTIONS MEASURED IN MULTIPLE REPLICATE SITES, WE THEN DEVELOPED PREDICTIONS FOR HOW THESE DIFFERENCES WOULD AFFECT PATTERNS OF NATURAL SELECTION, AND WE EXPLORED THE PATTERNS USING MEASUREMENTS OF FLORAL AND DEFENSIVE TRAITS IN THE FIELD AND IN A COMMON GARDEN. WE FOUND THAT GELSEMIUM GROWING IN SUBURBAN SITES EXPERIENCED MORE ROBBING AND FLORIVORY AS WELL AS MORE HETEROSPECIFIC BUT NOT CONSPECIFIC POLLEN TRANSFER. FLORAL TRAITS, PARTICULARLY COROLLA LENGTH AND WIDTH, INFLUENCED THE SUSCEPTIBILITY OF PLANTS TO PARTICULAR INTERACTORS. OBSERVATIONAL DATA OF FLORAL TRAITS MEASURED IN THE FIELD AND IN A COMMON GARDEN PROVIDED SOME SUPPORTING BUT ALSO SOME CONFLICTING EVIDENCE FOR THE HYPOTHESIS THAT FLORAL TRAITS EVOLVED IN RESPONSE TO DIFFERENCES IN SPECIES INTERACTIONS IN SUBURBAN VS. WILD SITES. HOWEVER, THE DEGREE TO WHICH PLANTS CAN RESPOND TO ANY ONE INTERACTOR MAY BE CONSTRAINED BY CORRELATIONS AMONG FLORAL MORPHOLOGICAL TRAITS. TAKEN TOGETHER, CONSIDERATION OF THE BROADER GEOGRAPHIC CONTEXT IN WHICH ORGANISMS INTERACT, IN BOTH SUBURBAN AND WILD AREAS, IS FUNDAMENTAL TO OUR UNDERSTANDING OF THE FORCES THAT SHAPE CONTEMPORARY PLANT-ANIMAL INTERACTIONS AND SELECTION PRESSURES IN NATIVE SPECIES.",SUBURBANIZATION; FLORAL EVOLUTION; FLORIVORY; NECTAR ROBBING; GELSEMIUM SEMPERVIRENS,GELSEMIUM-SEMPERVIRENS LOGANIACEAE; URBAN-ENVIRONMENT; BEE COMMUNITIES; POLLINATION; HERBIVORY; NECTAR; LANDSCAPES; PATTERNS; ECOLOGY; CONSEQUENCES,ENGLISH,ARTICLE,ARTICLE,11,"IRWIN, RE (REPRINT AUTHOR), DARTMOUTH COLL, DEPT BIOL, HANOVER, NH 03755 USA.;IRWIN, REBECCA E., CARPER, ADRIAN L., DARTMOUTH COLL, DEPT BIOL, HANOVER, NH 03755 USA.;WARREN, PAIGE S., UNIV MASSACHUSETTS, DEPT ENVIRONM CONSERVAT, AMHERST, MA 01003 USA.;ADLER, LYNN S., UNIV MASSACHUSETTS, DEPT BIOL, AMHERST, MA 01003 USA.",10.1007/S00442-013-2797-2,"233 SPRING ST, NEW YORK, NY 10013 USA",NA,"NATIONAL SCIENCE FOUNDATIONNATIONAL SCIENCE FOUNDATION (NSF) [DEB-0743535/0742923, DEB-0841862]; ROCKEFELLER FOUNDATION AT DARTMOUTH COLLEGE","WE THANK J. ANDICOECHEA, J. BENNING, L. DIBICCARI, J. POST, L. ROLFE, AND J. STEVENS FOR HELP IN THE FIELD, LAB, AND/OR GREENHOUSE, T. BARRY AND K. DELONG FOR HELP WITH THE GREENHOUSE GELSEMIUM, R. AND B. WARREN FOR PROVIDING HOUSING DURING FIELD RESEARCH, AND J. ANDICOECHEA, L. RICHARDSON, R. SCHAEFFER, C. URBANOWICZ, AND TWO ANONYMOUS REVIEWERS FOR COMMENTS ON THE MANUSCRIPT. ACCESS TO FIELD SITES WAS MADE POSSIBLE BY COOPERATION FROM LANDOWNERS, HOMEOWNERS' ASSOCIATIONS, AND PRIVATE CITIZENS, THE NORTH CAROLINA DIVISION OF PARKS AND RECREATION, THE WAKE COUNTY DEPARTMENT OF PARKS, RECREATION, AND OPEN SPACE, AND NORTH CAROLINA STATE UNIVERSITY. RESEARCH WAS FUNDED BY THE NATIONAL SCIENCE FOUNDATION (DEB-0743535/0742923 AND DEB-0841862) AND A FACULTY RESEARCH GRANT FROM THE ROCKEFELLER FOUNDATION AT DARTMOUTH COLLEGE. ANY OPINIONS, FINDINGS, AND CONCLUSIONS OR RECOMMENDATIONS EXPRESSED IN THIS MATERIAL ARE THOSE OF THE AUTHORS AND DO NOT NECESSARILY REFLECT THE VIEWS OF THE FUNDING SOURCES.",0029-8549,3,803-815,SPRINGER,174,2014,ISI000332002300018,59,ENVIRONMENTAL SCIENCES \& ECOLOGY,130,ECOLOGY,REBECCA.IRWINDARTMOUTH.EDU,AB7WS,"IRWIN, RE (REPRINT AUTHOR), DARTMOUTH COLL, DEPT BIOL, HANOVER, NH 03755 USA",ISI,none,DARTMOUTH COLL;UNIV MASSACHUSETTS;UNIV MASSACHUSETTS,DARTMOUTH COLL,NA,"IRWIN RE, 2014, OECOLOGIA","IRWIN RE, 2014, OECOLOGIA",NA,NA,NA,NA
DYER AG;DORIN A;REINHARDT V;GARCIA JE;ROSA MGP,DYER AG,BEE REVERSE-LEARNING BEHAVIOR AND INTRA-COLONY DIFFERENCES: SIMULATIONS BASED ON BEHAVIORAL EXPERIMENTS REVEAL BENEFITS OF DIVERSITY,ECOLOGICAL MODELLING,ECOL. MODEL.,"FORAGING BEES USE COLOR CUES TO HELP IDENTIFY REWARDING FROM UNREWARDING FLOWERS. AS ENVIRONMENTAL CONDITIONS CHANGE, BEES MAY REQUIRE BEHAVIORAL FLEXIBILITY TO REVERSE THEIR LEARNT PREFERENCES. LEARNING TO DISCRIMINATE PERCEPTUALLY SIMILAR COLORS TAKES BEES A LONG TIME, AND THUS POTENTIALLY POSES A DIFFICULT TASK TO REVERSE-LEARN. WE TRAINED FREE-FLYING HONEYBEES TO LEARN A FINE COLOR DISCRIMINATION TASK THAT COULD ONLY BE RESOLVED (WITH ABOUT 70\% ACCURACY) FOLLOWING EXTENDED DIFFERENTIAL CONDITIONING. THE BEES WERE THEN TESTED FOR THEIR ABILITY TO REVERSE-LEARN THIS VISUAL PROBLEM. SUBSEQUENT ANALYSES POTENTIALLY IDENTIFIED INDIVIDUAL BEHAVIORAL DIFFERENCES THAT COULD BE BROADLY CLASSIFIED AS: `DELIBERATIVE-DECISIVE' BEES THAT COULD, AFTER SEVERAL FLOWER VISITS, DECISIVELY MAKE A LARGE CHANGE TO LEARNT PREFERENCES, `FICKLE-CIRCUMSPECT' BEES THAT CHANGED THEIR PREFERENCES BY A SMALL AMOUNT EVERY TIME THEY RECEIVED A REWARD, OR FAILED TO RECEIVE ONE, ON A PARTICULAR COLOR, AND `STAY' BEES THAT DID NOT CHANGE FROM THEIR INITIALLY LEARNT PREFERENCE. TO UNDERSTAND THE ECOLOGICAL IMPLICATIONS OF THE OBSERVED BEHAVIORAL DIVERSITY, AGENT-BASED COMPUTER SIMULATIONS WERE CONDUCTED BY SYSTEMATICALLY VARYING PARAMETERS DESCRIBING FLOWER REWARD SWITCH OSCILLATION FREQUENCY, FLOWER HANDLING TIME, AND FRACTION OF DEFECTIVE `TARGET' STIMULI THAT CONTAINED NO REWARD. THESE SIMULATIONS REVEALED THAT WHEN THE FREQUENCY OF REWARD REVERSALS IS HIGH, FICKLE-CIRCUMSPECT BEES ARE MORE EFFICIENT AT NECTAR COLLECTION, BUT AS REWARD REVERSAL FREQUENCY DECREASES, THE PERFORMANCE OF DELIBERATIVE-DECISIVE BEES BECOMES MOST EFFICIENT. AS THE REVERSAL FREQUENCY CONTINUES TO FALL, FICKLE-CIRCUMSPECT AND DELIBERATIVE-DECISIVE STRATEGIES APPROACH ONE ANOTHER IN EFFICIENCY. IN NO TESTED CONDITION DID STAY BEES OUTPERFORM THE OTHER GROUPS. THESE FINDINGS INDICATE THERE IS A FITNESS BENEFIT FOR HONEYBEE COLONIES CONTAINING INDIVIDUALS EXHIBITING DIFFERENT STRATEGIES FOR MANAGING CHANGING RESOURCE CONDITIONS. (C) 2014 ELSEVIER B.V. ALL RIGHTS RESERVED.",INDIVIDUAL BEHAVIOR; LEARNING; FLOWER; POLLINATOR; VISUAL ECOLOGY; HONEYBEE; INDIVIDUAL-BASED SIMULATION,BUMBLEBEES BOMBUS-TERRESTRIS; HONEY-BEES; RECOGNIZE IMAGES; FLOWER CONSTANCY; FORAGING SPEED; DISCRIMINATION; PSYCHOPHYSICS; PREFERENCES; INFORMATION; DYNAMICS,ENGLISH,ARTICLE,ARTICLE,19,"DORIN, A (REPRINT AUTHOR), MONASH UNIV, FAC IT, BLDG 63,WELLINGTON RD, CLAYTON, VIC 3800, AUSTRALIA.;DYER, A. G., GARCIA, J. E., RMIT UNIV, MELBOURNE, VIC 3001, AUSTRALIA.;DYER, A. G., ROSA, M. G. P., MONASH UNIV, DEPT PHYSIOL, CLAYTON, VIC 3800, AUSTRALIA.;DYER, A. G., REINHARDT, V., JOHANNES GUTENBERG UNIV MAINZ, D-55099 MAINZ, GERMANY.;DORIN, A., MONASH UNIV, FAC IT, CLAYTON, VIC 3800, AUSTRALIA.;GARCIA, J. E., RMIT UNIV, SCH APPL SCI, MELBOURNE, VIC 3001, AUSTRALIA.",10.1016/J.ECOLMODEL.2014.01.009,"PO BOX 211, 1000 AE AMSTERDAM, NETHERLANDS",NA,"ALEXANDER VON HUMBOLDT FOUNDATIONALEXANDER VON HUMBOLDT FOUNDATION; ARCFONDATION ARC POUR LA RECHERCHE SUR LE CANCERAUSTRALIAN RESEARCH COUNCIL [DP0878968/0987989/130100015, DP1094064/130100015]",WE THANK KEVIN KORB AND DAVID ALBRECHT FOR DISCUSSIONS. A.G.D. IS GRATEFUL TO THE ALEXANDER VON HUMBOLDT FOUNDATION AND THE ARC DP0878968/0987989/130100015 FOR FUNDING SUPPORT. A.D. IS GRATEFUL TO ARC DP1094064/130100015 FOR FUNDING SUPPORT.,0304-3800,NA,119-131,ELSEVIER SCIENCE BV,277,2014,ISI000333775800011,78,ENVIRONMENTAL SCIENCES \& ECOLOGY,67,ECOLOGY,ALAN.DORINMONASH.EDU,AE2AN,"DORIN, A (REPRINT AUTHOR), MONASH UNIV, FAC IT, BLDG 63,WELLINGTON RD, CLAYTON, VIC 3800, AUSTRALIA",ISI,none,RMIT UNIV;MONASH UNIV;JOHANNES GUTENBERG UNIV MAINZ;MONASH UNIV;RMIT UNIV,MONASH UNIV,NA,"DYER AG, 2014, ECOL MODEL","DYER AG, 2014, ECOL MODEL",NA,NA,NA,NA
KAHNT B;SORO A;KUHLMANN M;GERTH M;PAXTON RJ,KAHNT B,"INSIGHTS INTO THE BIODIVERSITY OF THE SUCCULENT KAROO HOTSPOT OF SOUTH AFRICA: THE POPULATION GENETICS OF A RARE AND ENDEMIC HALICTID BEE, PATELLAPIS DOLERITICA",CONSERVATION GENETICS,CONSERV. GENET.,"POPULATION GENETIC ANALYSES ARE ESPECIALLY RELEVANT FOR SPECIES CONSIDERED THREATENED OR HIGHLY ENDEMIC AND FOR WHICH OTHER FORMS OF BIOLOGICAL INFORMATION ARE LACKING. PATELLAPIS DOLERITICA IS A RECENTLY DESCRIBED COMMUNALLY NESTING HALICTID BEE OF CONSERVATION CONCERN BECAUSE IT IS RARE AND ENDEMIC TO THE SUCCULENT KAROO OF SOUTH AFRICA. MOREOVER, ITS DISPERSAL IS CONSIDERED TO BE RESTRICTED BY ITS SPECIALISED NESTING REQUIREMENTS AND INCLEMENT WEATHER CONDITIONS DURING ITS LIMITED ANNUAL FLIGHT PERIOD, TRAITS WHICH MAY BE COMMON TO OTHER BEE SPECIES OF THE REGION. WE HYPOTHESISED THAT GENE FLOW IN P. DOLERITICA WAS LOW, LEADING TO MARKED GENETIC DIFFERENTIATION. USING 7 MICROSATELLITES, WE INVESTIGATED ITS MATING AND POPULATION GENETIC STRUCTURE IN 258 INDIVIDUALS (171 FEMALES AND 87 MALES) FROM 7 POPULATIONS SPANNING MOST OF ITS KNOWN RANGE. DEVIATION FROM HARDY-WEINBERG EQUILIBRIUM (F-IS=+ 0.254) SUGGESTED P. DOLERITICA TO BE INBRED, AS IN MANY OTHER COMMUNAL NESTING BEE SPECIES. GLOBAL F-ST (0.028) AND GLOBAL G'(ST) (0.216) REVEALED MODEST BUT SIGNIFICANT DIFFERENTIATION BETWEEN MOST POPULATIONS, EVEN ACROSS THE VERY LIMITED RANGE OF THE SPECIES (CA. 25 KM), WITH ONE GENETICALLY EXTREME OUTLIER POPULATION. DESPITE INBREEDING, WE DETECTED A SURPRISINGLY LOW FREQUENCY OF DIPLOID MALES (2 \%). PATELLAPIS DOLERITICA NEVERTHELESS DESERVES SPECIAL CONSERVATION ATTENTION SINCE IT IS AN ENDEMIC SPECIES WITH A LOW OVERALL ABUNDANCE AND THEREFORE POSSIBLY PRONE TO ENVIRONMENTAL CHANGE AND LOCAL EXTINCTION.",GENETIC DIFFERENTIATION; GENE FLOW; HALICTIDAE; MICROSATELLITE; INBREEDING; DIPLOID MALE; TRIPLOID FEMALE,EUSOCIAL SWEAT BEE; SEX DETERMINATION; COMMUNAL BEE; RUBICUNDUS HYMENOPTERA; MICROSATELLITE LOCI; GENOTYPING ERRORS; F-STATISTICS; DIVERSITY; CONSERVATION; POLLINATORS,ENGLISH,ARTICLE,ARTICLE,1,"KAHNT, B (REPRINT AUTHOR), UNIV HALLE WITTENBERG, INST BIOL, HOHER WEG 8, D-06120 HALLE, GERMANY.;KAHNT, BELINDA, GERTH, MICHAEL, UNIV LEIPZIG, INST BIOL, D-04103 LEIPZIG, GERMANY.;KAHNT, BELINDA, SORO, ANTONELLA, PAXTON, ROBERT J., UNIV HALLE WITTENBERG, INST BIOL, D-06120 HALLE, GERMANY.;KUHLMANN, MICHAEL, NAT HIST MUSEUM, DEPT LIFE SCI, LONDON SW7 5BD, ENGLAND.;PAXTON, ROBERT J., GERMAN CTR INTEGRAT BIODIVERS RES IDIV, D-04103 LEIPZIG, GERMANY.",10.1007/S10592-014-0633-9,"VAN GODEWIJCKSTRAAT 30, 3311 GZ DORDRECHT, NETHERLANDS",NA,NA,NA,1566-0621,6,1491-1502,SPRINGER,15,2014,ISI000344777500019,77,"BIODIVERSITY \& CONSERVATION, GENETICS \& HEREDITY",27,"BIODIVERSITY CONSERVATION, GENETICS \& HEREDITY",BELINDA-KGMX.DE,AT2PU,"KAHNT, B (REPRINT AUTHOR), UNIV HALLE WITTENBERG, INST BIOL, HOHER WEG 8, D-06120 HALLE, GERMANY",ISI,none,UNIV LEIPZIG;UNIV HALLE WITTENBERG;DEPT LIFE SCI;GERMAN CTR INTEGRAT BIODIVERS RES IDIV,UNIV HALLE WITTENBERG,NA,"KAHNT B, 2014, CONSERV GENET","KAHNT B, 2014, CONSERV GENET",NA,NA,NA,NA
LUCIA M;ALVAREZ LJ;ABRAHAMOVICH AH,LUCIA M,LARGE CARPENTER BEES IN ARGENTINA: SYSTEMATICS AND NOTES ON THE BIOLOGY OF XYLOCOPA SUBGENUS NEOXYLOCOPA (HYMENOPTERA: APIDAE),ZOOTAXA,ZOOTAXA,"A SYSTEMATIC REVISION OF THE SPECIES OF THE GENUS XYLOCOPA SUBGENUS NEOXYLOCOPA IN ARGENTINA IS PROVIDED. SEVEN SPECIES ARE INCLUDED: X. ATAMISQUENSIS LUCIA \& ABRAHAMOVICH, X. AUGUSTI LEPELETIER, X. EXIMIA PEREZ, X. FRONTALIS (OLIVIER), X. MENDOZANA ENDERLEIN, X. NIGROCINCTA SMITH AND X. TACANENSIS MOURE. THE MALES OF X. EXIMIA AND X. NIGROCINCTA ARE DESCRIBED FOR THE FIRST TIME. XYLOCOPA JUJUYENSIS BRETHES IS A NEW JUNIOR SYNONYM OF X. NIGROCINCTA. PHOTOGRAPHS, OCCURRENCE MAPS, AND IDENTIFICATION KEYS FOR THE SPECIES ARE PRESENTED. INFORMATION ON THE NEST ARCHITECTURE AND SUBSTRATUM PREFERENCE ARE ALSO GIVEN.",ANTHOPHILA; NESTING BEHAVIOR; POLLINATORS; SOUTH AMERICA; TAXONOMY,MOURE HYMENOPTERA; ABBREVIATA HURD; GENUS XYLOCOPA; BRAZIL,ENGLISH,ARTICLE,ARTICLE,5,"LUCIA, M (REPRINT AUTHOR), UNIV NACL LA PLATA, MUSEO LA PLATA, DIV ENTOMOL, PASEO DEL BOSQUE S-N,1900FWA, LA PLATA, BUENOS AIRES, ARGENTINA.;LUCIA, MARIANO, UNIV NACL LA PLATA, MUSEO LA PLATA, DIV ENTOMOL, LA PLATA, BUENOS AIRES, ARGENTINA.;CONSEJO NACL INVEST CIENT \& TECN, RA-1033 BUENOS AIRES, DF, ARGENTINA.",10.11646/ZOOTAXA.3754.3.1,"PO BOX 41383, AUCKLAND, ST LUKES 1030, NEW ZEALAND",NA,"CONSEJO NACIONAL DE INVESTIGACIONES CIENTIFICAS Y TECNICAS, ARGENTINA (CONICET)CONSEJO NACIONAL DE INVESTIGACIONES CIENTIFICAS Y TECNICAS (CONICET)","WE ARE GRATEFUL THE CURATORS AND MANAGERS LISTED IN THE MATERIAL AND METHODS SECTION FOR THE LOANS OF SPECIMENS. THANKS TO VICTOR GONZALEZ, IGNACIO ARETA, CLAUS RASMUSSEN AND TO TWO ANONYMOUS REVIEWERS FOR COMMENTS AND SUGGESTIONS THAT IMPROVED THE MANUSCRIPT. I ALSO THANK TO HECTOR JOSE ORTEGA AND DAVID NOTTON CURATORS TO IFML AND BMNH RESPECTIVELY FOR THEIR HELP IN THIS STUDY. M.L, L.J.A AND A.H.A ARE SUPPORT BY CONSEJO NACIONAL DE INVESTIGACIONES CIENTIFICAS Y TECNICAS, ARGENTINA (CONICET).",1175-5326,3,201-238,MAGNOLIA PRESS, 3754,2014,ISI000329695000001,61,ZOOLOGY,7,ZOOLOGY,MLUCIAFCNYM.UNLP.EDU.AR,289PR,"LUCIA, M (REPRINT AUTHOR), UNIV NACL LA PLATA, MUSEO LA PLATA, DIV ENTOMOL, PASEO DEL BOSQUE S-N,1900FWA, LA PLATA, BUENOS AIRES, ARGENTINA",ISI,none,UNIV NACL LA PLATA;,UNIV NACL LA PLATA,NA,"LUCIA M, 2014, ZOOTAXA","LUCIA M, 2014, ZOOTAXA",NA,NA,NA,NA
MUELLER A;TRUNZ V,MUELLER A,"PALAEARCTIC OSMIINE BEES OF THE GENERA HOFFERIA AND STENOHERIADES (MEGACHILIDAE, OSMIINI): BIOLOGY, TAXONOMY AND KEY TO SPECIES",ZOOTAXA,ZOOTAXA,"HOFFERIA AND STENOHERIADES ARE CLOSELY RELATED, SPECIES-POOR GENERA OF THE OSMIINE BEES (MEGACHILIDAE). ANALYSIS OF FEMALE POLLEN LOADS AND FIELD OBSERVATIONS INDICATE THAT SPECIES OF BOTH GENERA HAVE A STRONG AFFINITY TO ASTERACEAE AS POLLEN HOSTS. BOTH GENERA USE INSECT BURROWS IN DEAD WOOD AS NESTING SITE, AND HOFFERIA SCHMIEDEKNECHTI WAS FOUND TO BUILD CELL WALLS AND NEST PLUG WITH RESIN PARTLY MIXED WITH SMALL PEBBLES. THE TAXONOMIC REVISION OF THE PALAEARCTIC HOFFERIA AND STENOHERIADES SPECIES REVEALED THE EXISTENCE OF A STILL UNDESCRIBED SPECIES IN THE LEVANT, STENOHERIADES LEVANTICA SPEC. NOV.. STENOHERIADES HOFFERI (TKALCU, 1984) IS SYNONYMIZED WITH S. COELOSTOMA (BENOIST, 1935), WHICH IS DISTINCT FROM S. ASIATICA (FRIESE, 1921), AND HERIADES INTEGRA BENOIST, 1934, FORMERLY CONSIDERED A STENOHERIADES SPECIES, IS SYNONYMIZED WITH OSMIA (HOPLOSMIA) SCUTELLARIS MORAWITZ, 1868. KEYS FOR THE DELIMITATION OF HOFFERIA AND STENOHERIADES FROM THE OTHER PALAEARCTIC OSMIINE BEE GENERA AND FOR THE IDENTIFICATION OF THE PALAEARCTIC SPECIES ARE GIVEN.",APIFORMES; HOST-PLANT CHOICE; HYMENOPTERA; NESTING BEHAVIOUR,HYMENOPTERA; APOIDEA; CATALOG,ENGLISH,ARTICLE,ARTICLE,5,"MULLER, A (REPRINT AUTHOR), ETH, INST AGR SCI BIOCOMMUN \& ENTOMOL, SCHMELZBERGSTR 9-LFO, CH-8092 ZURICH, SWITZERLAND.;MUELLER, ANDREAS, ETH, INST AGR SCI BIOCOMMUN \& ENTOMOL, CH-8092 ZURICH, SWITZERLAND.;TRUNZ, VINCENT, UNIV NEUCHATEL, INST BIOL, LAB EVOLUT ENTOMOL, CH-2000 NEUCHATEL, SWITZERLAND.",NA,"PO BOX 41383, AUCKLAND, ST LUKES 1030, NEW ZEALAND",NA,NA,NA,1175-5326,2,175-186,MAGNOLIA PRESS, 3765,2014,ISI000331167600005,23,ZOOLOGY,5,ZOOLOGY,ANDREAS.MUELLERUSYS.ETHZ.CH VINCENT.TRUNZUNINE.CH,AA5VL,"MULLER, A (REPRINT AUTHOR), ETH, INST AGR SCI BIOCOMMUN \& ENTOMOL, SCHMELZBERGSTR 9-LFO, CH-8092 ZURICH, SWITZERLAND",ISI,none,INST AGR SCI BIOCOMMUN AND ENTOMOL;UNIV NEUCHATEL,NOTDECLARED,NA,"MUELLER A, 2014, ZOOTAXA","MUELLER A, 2014, ZOOTAXA",NA,NA,NA,NA
SPLAWSKI CE;REGNIER EE;HARRISON SK;GOODELL K;BENNETT MA;METZGER JD,SPLAWSKI CE,"MULCH EFFECTS ON FLORAL RESOURCES AND FRUIT PRODUCTION OF SQUASH, AND ON POLLINATION AND NESTING BY SQUASH BEES",HORTTECHNOLOGY,HORTTECHNOLOGY,"ZUCCHINI SQUASH (CUCURBITAPEPO) HAS A HIGH POLLINATION DEMAND, AND THE NATIVE, GROUND-NESTING SQUASH BEE (PEPONAPIS PRUINOSA) PROVIDES THE MAJORITY OF THE CROP'S POLLINATION REQUIREMENT IN SOME ENVIRONMENTS. SQUASH BEES NEST DIRECTLY IN CROP FIELDS, AND NESTS CAN BE DISTURBED BY TILLAGE AND OTHER MANAGEMENT OPERATIONS. MULCHES THAT USE MUNICIPAL WASTE MATERIALS MAY PROVIDE A WEED CONTROL STRATEGY FOR SQUASH PLANTINGS THAT IS MORE BENIGN TO SQUASH BEES THAN CULTIVATION. FIELD AND GREENHOUSE STUDIES WERE CONDUCTED IN 2011 AND 2012 TO COMPARE THE EFFECTS OF NONTILLAGE WEED CONTROL METHODS INCLUDING POLYETHYLENE BLACK PLASTIC, WOODCHIPS, SHREDDED NEWSPAPER, A COMBINATION OF SHREDDED NEWSPAPER PLUS GRASS CLIPPINGS (NP + GRASS), AND BARE SOIL (CONTROL) ON SOIL CHARACTERISTICS, SQUASH POLLINATION AND FRUIT PRODUCTION, AND SQUASH BEE NESTING. WOODCHIPS, SHREDDED NEWSPAPER, AND NP + GRASS MULCH DECREASED SOIL TEMPERATURE, WHILE SOILS BENEATH NEWSPAPER MULCH RETAINED MORE MOISTURE. UNMARKETABLE, MISSHAPEN FRUIT OCCURRED MORE FREQUENTLY IN PLASTIC THAN IN THE OTHER MULCH TREATMENTS. NO MEASURABLE DIFFERENCES IN FLORAL RESOURCE PRODUCTION OR CROP POLLINATION WERE FOUND AMONG TREATMENTS, SUGGESTING THAT MISSHAPEN FRUIT RESULTED FROM HIGH SOIL TEMPERATURES IN BLACK PLASTIC PLOTS RATHER THAN POOR POLLINATOR ATTRACTION. SQUASH BEE NESTS WERE LOCATED WITHIN BARE SOIL, NEWSPAPER, AND NP + GRASS PLOTS, INDICATING THAT THESE MULCHES DID NOT PREVENT NESTING. NP + GRASS MULCH HAD A POSITIVE EFFECT ON PLANT GROWTH AND FRUIT PRODUCTION, POSSIBLY FROM AN ADDITION OF PLANT-AVAILABLE NITROGEN OR THE PRESENCE OF PREFERABLE NESTING GROUND. SHREDDED NEWSPAPER WHEN COMBINED WITH GRASS CLIPPINGS PERFORMED AS AN EFFECTIVE MULCH MATERIAL THAT IMPROVED CROP PERFORMANCE WITH NO APPARENT NEGATIVE IMPACTS ON SQUASH BEE NESTING OR ON SQUASH FLORAL RESOURCES AND POLLINATION.",CUCURBITA PEPO; PAPER MULCH; PEPONAPIS PRUINOSA; POLLINATION,POLLEN PERFORMANCE; PEPONAPIS-PRUINOSA; NECTAR PRODUCTION; SECRETION; CROP,ENGLISH,ARTICLE,ARTICLE,2,"SPLAWSKI, CE (REPRINT AUTHOR), OHIO STATE UNIV, DEPT HORT \& CROP SCI, 202 KOTTMAN HALL,2021 COFFEY RD, COLUMBUS, OH 43210 USA.;SPLAWSKI, CAITLIN E., REGNIER, EMILIE E., HARRISON, S. KENT, BENNETT, MARK A., METZGER, JAMES D., OHIO STATE UNIV, DEPT HORT \& CROP SCI, COLUMBUS, OH 43210 USA.;GOODELL, KAREN, OHIO STATE UNIV, DEPT ECOL EVOLUT \& ORGANISMAL BIOL, NEWARK, OH 43055 USA.",10.21273/HORTTECH.24.5.535,"113 S WEST ST, STE 200, ALEXANDRIA, VA 22314-2851 USA",NA,"USDA NORTH CENTRAL INTEGRATED PEST MANAGEMENT (NCIPM) PROGRAM; OHIO AGRICULTURAL RESEARCH AND DEVELOPMENT CENTER, OHIO STATE UNIVERSITYOHIO STATE UNIVERSITY [HCS 13-06]","THIS PROJECT WAS FUNDED BY THE USDA NORTH CENTRAL INTEGRATED PEST MANAGEMENT (NCIPM) PROGRAM. SALARIES AND ADDITIONAL RESEARCH SUPPORT WERE PROVIDED BY STATE AND FEDERAL FUNDS APPROPRIATED TO THE OHIO AGRICULTURAL RESEARCH AND DEVELOPMENT CENTER, OHIO STATE UNIVERSITY JOURNAL ARTICLE NO. HCS 13-06.",1063-0198,5,535-545,AMER SOC HORTICULTURAL SCIENCE,24,2014,ISI000349741400005,36,AGRICULTURE,39,HORTICULTURE,CSPLAWSKIGMAIL.COM,CB6MP,"SPLAWSKI, CE (REPRINT AUTHOR), OHIO STATE UNIV, DEPT HORT \& CROP SCI, 202 KOTTMAN HALL,2021 COFFEY RD, COLUMBUS, OH 43210 USA",ISI,none,OHIO STATE UNIV;OHIO STATE UNIV,OHIO STATE UNIV,NA,"SPLAWSKI CE, 2014, HORTTECHNOLOGY","SPLAWSKI CE, 2014, HORTTECHNOLOGY",NA,NA,NA,NA
RUNDLOF M;PERSSON AS;SMITH HG;BOMMARCO R,RUNDLOF M,LATE-SEASON MASS-FLOWERING RED CLOVER INCREASES BUMBLE BEE QUEEN AND MALE DENSITIES,BIOLOGICAL CONSERVATION,BIOL. CONSERV.,"SPATIOTEMPORAL RESOURCE CONTINUITY PROMOTES PERSISTENCE OF MOBILE ANIMAL POPULATIONS. CURRENT AGRICULTURAL LANDSCAPES ARE POOR IN FLOWERS RESOURCES FOR BUMBLE BEES. AVAILABLE FORAGE CROPS ARE PREDOMINANTLY EARLY-SEASON MASS-FLOWERING CROPS (MFC). IT HAS BEEN SUGGESTED, BUT NOT TESTED, THAT SCARCITY OF LATE-SEASON FLOWER RESOURCES ARE LIMITING BUMBLE BEE POPULATIONS. WE EXAMINED WHETHER ADDITION OF LATE-SEASON FLOWERING RED CLOVER AFFECTED WORKER, QUEEN AND MALE BUMBLE BEE DENSITIES. BUMBLE BEES WERE SURVEYED IN FLOWER-RICH UNCULTIVATED FIELD BORDERS ACROSS 24 LANDSCAPES (RADIUS 2 KM) WITH OR WITHOUT A CLOVER FIELD IN THE CENTRE, VARYING IN SEMI-NATURAL GRASSLAND (SNG) AND EARLY MFC AVAILABILITY. CLOVER FIELDS HAD OVER TEN TIMES HIGHER WORKER DENSITIES COMPARED TO FIELD BORDERS, SUGGESTING RED CLOVER AS FAVOURED FORAGE. FIVE TIMES MORE QUEENS AND 71\% MORE MALES WERE FOUND IN LANDSCAPES WITH CLOVER FIELDS COMPARED TO CONTROL LANDSCAPES, DESPITE THESE FIELDS CONSTITUTING LESS THAN 0.2\% OF THE LANDSCAPE AREA. BOTH MFC AND SNG INCREASED THE DENSITY OF MALES, BUT ONLY IN THE PRESENCE OF CLOVER FIELDS. OUR RESULTS SUGGEST THAT LATE-FLOWERING RED CLOVER POSITIVELY AFFECTS BUMBLE BEE REPRODUCTION, LIKELY BY INCREASING TEMPORAL RESOURCE CONTINUITY. INTERVENTIONS SUCH AS FLOWER STRIPS CAN THUS HAVE MITIGATING EFFECTS IF THEY RELEASE POPULATION REGULATION BY LATE-SEASON RESOURCE BOTTLE-NECKS. (C) 2014 ELSEVIER LTD. ALL RIGHTS RESERVED.",BOMBUS; FLOWER RESOURCES; MITIGATION MEASURE; POLLINATOR; REPRODUCTIVE SUCCESS; TRIFOLIUM PRATENSE,DIFFERENT SPATIAL SCALES; LANDSCAPE CONTEXT; AGRICULTURAL LANDSCAPES; SPECIES RESPONSES; WILD POLLINATORS; COLONY GROWTH; SEX-RATIOS; CONSERVATION; DISTANCES; ABUNDANCE,ENGLISH,ARTICLE,ARTICLE,77,"RUNDLOF, M (REPRINT AUTHOR), LUND UNIV, DEPT BIOL, SE-22362 LUND, SWEDEN.;RUNDLOF, MAJ, BOMMARCO, RICCARDO, SWEDISH UNIV AGR SCI, DEPT ECOL, SE-75007 UPPSALA, SWEDEN.;RUNDLOF, MAJ, PERSSON, ANNA S., SMITH, HENRIK G., LUND UNIV, DEPT BIOL, SE-22362 LUND, SWEDEN.;SMITH, HENRIK G., LUND UNIV, CTR ENVIRONM \& CLIMATE RES, SE-22362 LUND, SWEDEN.",10.1016/J.BIOCON.2014.02.027,"THE BOULEVARD, LANGFORD LANE, KIDLINGTON, OXFORD OX5 1GB, OXON, ENGLAND",NA,SWEDISH RESEARCH COUNCIL FORMASSWEDISH RESEARCH COUNCILSWEDISH RESEARCH COUNCIL FORMAS; EU IN THE FP7 PROJECT STEP - STATUS AND TRENDS OF EUROPEAN POLLINATORS [244090],"WE THANK THE FARMERS FOR ALLOWING US WORK IN THEIR CLOVER FIELDS, M. JOHANSSON, F. MARTENSSON AND H. SANDBERG FOR ASSISTING IN FIELDWORK AND N.E. SJODIN FOR BUMBLE BEE SPECIES DETERMINATION. FUNDING WAS PROVIDED TO R.B. AND H.G.S. BY THE SWEDISH RESEARCH COUNCIL FORMAS AND BY EU IN THE FP7 PROJECT ``STEP - STATUS AND TRENDS OF EUROPEAN POLLINATORS (GRANT AGREEMENT NO. 244090).",0006-3207,NA,138-145,ELSEVIER SCI LTD,172,2014,ISI000336337800017,46,"BIODIVERSITY \& CONSERVATION, ENVIRONMENTAL SCIENCES \& ECOLOGY",119,"BIODIVERSITY CONSERVATION, ECOLOGY, ENVIRONMENTAL SCIENCES",MAJ.RUNDLOFBIOL.LU.SE ANNA.PERSSONBIOL.LU.SE HENRIK.SMITHBIOL.LU.SE RICCARDO.BOMMARCOSLU.SE,AH7TK,"RUNDLOF, M (REPRINT AUTHOR), LUND UNIV, DEPT BIOL, SE-22362 LUND, SWEDEN",ISI,none,SWEDISH UNIV AGR SCI;LUND UNIV;LUND UNIV,LUND UNIV,NA,"RUNDLOF M, 2014, BIOL CONSERV","RUNDLOF M, 2014, BIOL CONSERV",NA,NA,NA,NA
