AU,first_author,TI,SO,JI,AB,DE,ID,LA,DT,DT2,TC,C1,DI,PA,AR,FU,FX,SN,PN,PP,PU,VL,PY,UT,NR,SC,U2,WC,EM,GA,RP,DB,CR,AU_UN,AU1_UN,AU_UN_NR,SR_FULL,SR,SE,BO,BE,BN
DAVIS JD;HENDRIX SD;DEBINSKI DM;HEMSLEY CJ,DAVIS JD,"BUTTERFLY, BEE AND FORB COMMUNITY COMPOSITION AND CROSS-TAXON INCONGRUENCE IN TALLGRASS PRAIRIE FRAGMENTS",JOURNAL OF INSECT CONSERVATION,J. INSECT CONSERV.,"POLLINATORS PROVIDE AN IMPORTANT CLASS OF ECOLOGICAL SERVICES FOR CROP PLANTS AND NATIVE SPECIES IN MANY ECOSYSTEMS, INCLUDING THE TALLGRASS PRAIRIE, AND THEIR CONSERVATION IS ESSENTIAL TO SUSTAINING PRAIRIE REMNANTS. IN IOWA THESE REMNANTS ARE TYPICALLY EITHER BLOCK-SHAPED OR LONG, LINEAR STRIPS ALONG TRANSPORTATION ROUTES. IN THIS STUDY WE EXAMINED DIFFERENCES IN THE BUTTERFLY, BEE, AND FORB COMMUNITY COMPOSITION IN LINEAR AND BLOCK PRAIRIE REMNANTS, DETERMINED CORRELATIONS BETWEEN SPECIES DIVERSITY AMONG BUTTERFLIES, BEES AND FORBS IN THE 20 PRAIRIE REMNANTS SAMPLED, AND EXAMINED CORRELATIONS OF COMMUNITY SIMILARITY AMONG BUTTERFLIES, BEES AND FORBS. CORRESPONDENCE ANALYSIS SHOWED THAT DISTINCT COMMUNITIES EXIST FOR BUTTERFLIES AND FORBS IN BLOCK VERSUS LINEAR SITES AND DISCRIMINANT ANALYSIS SHOWED THAT THE BEE AND FORB COMMUNITIES IN BLOCK AND LINEAR SITES CAN BE DISTINGUISHED ON THE BASIS OF A FEW SPECIES. DIVERSITY OF ONE GROUP WAS A POOR PREDICTOR OF DIVERSITY IN ANOTHER, EXCEPT FOR A SIGNIFICANT INVERSE RELATIONSHIP BETWEEN BEES AND BUTTERFLIES. THESE TWO POLLINATOR TAXA MAY BE RESPONDING VERY DIFFERENTLY TO MICROHABITAT COMPONENTS WITHIN FRAGMENTED ECOSYSTEMS. OUR STUDIES SHOW THAT THERE NEED TO BE DIFFERENCES IN CONSERVATION STRATEGIES FOR BEES AND BUTTERFLIES TO MAINTAIN BOTH POLLINATOR COMMUNITIES.",BEES; BUTTERFLIES; CORRESPONDENCE ANALYSIS; CROSS-TAXON CONGRUENCE; PRAIRIES,HABITAT FRAGMENTATION; POLLINATOR COMMUNITIES; INDICATOR GROUPS; CONSERVATION; LEPIDOPTERA; BIODIVERSITY; HYMENOPTERA; DIVERSITY; RESPONSES; PLANT,ENGLISH,ARTICLE,ARTICLE,35,"DEBINSKI, DM (REPRINT AUTHOR), IOWA STATE UNIV, DEPT ECOL EVOLUT \& ORGANISMAL BIOL, 253 BESSEY HALL, AMES, IA 50011 USA.;DAVIS, JESSICA D., DEBINSKI, DIANE M., IOWA STATE UNIV, DEPT ECOL EVOLUT \& ORGANISMAL BIOL, AMES, IA 50011 USA.;HENDRIX, STEPHEN D., HEMSLEY, CHIARA J., UNIV IOWA, DEPT BIOL SCI, IOWA CITY, IA 52242 USA.",10.1007/S10841-006-9063-4,"VAN GODEWIJCKSTRAAT 30, 3311 GZ DORDRECHT, NETHERLANDS",NA,NA,NA,1366-638X,1,69-79,SPRINGER,12,2008,ISI000251844100007,65,"BIODIVERSITY \& CONSERVATION, ENTOMOLOGY",47,"BIODIVERSITY CONSERVATION, ENTOMOLOGY",STEPHEN-HENDRIXUIOWA.EDU DEBINSKIIASTATE.EDU,244CR,"DEBINSKI, DM (REPRINT AUTHOR), IOWA STATE UNIV, DEPT ECOL EVOLUT \& ORGANISMAL BIOL, 253 BESSEY HALL, AMES, IA 50011 USA",ISI,none,IOWA STATE UNIV;UNIV IOWA,IOWA STATE UNIV,NA,"DAVIS JD, 2008, J INSECT CONSERV","DAVIS JD, 2008, J INSECT CONSERV",NA,NA,NA,NA
HOPWOOD JL,HOPWOOD JL,THE CONTRIBUTION OF ROADSIDE GRASSLAND RESTORATIONS TO NATIVE BEE CONSERVATION,BIOLOGICAL CONSERVATION,BIOL. CONSERV.,"MARGINAL HABITATS SUCH AS HEDGEROWS OR ROADSIDES BECOME ESPECIALLY IMPORTANT FOR THE CONSERVATION OF BIODIVERSITY IN HIGHLY MODIFIED LANDSCAPES. WITH CONCERNS OF A GLOBAL POLLINATION CRISIS, THERE IS A NEED. FOR IMPROVING POLLINATOR HABITAT. ROADSIDES RESTORED TO NATIVE PRAIRIE VEGETATION MAY PROVIDE VALUABLE HABITAT TO BEES, THE MOST IMPORTANT GROUP OF POLLINATORS. SUCH ROADSIDES SUPPORT A VARIETY OF POLLEN AND NECTAR SOURCES AND UNLIKE AGRICULTURAL FIELDS, ARE UNPLOWED, AND THEREFORE CAN PROVIDE POTENTIAL NESTING SITES FOR GROUND-NESTING BEES. TO EXAMINE POTENTIAL EFFECTS OF ROADSIDE RESTORATION, BEE COMMUNITIES WERE SAMPLED VIA AERIAL NETTING AND PAN TRAPPING ALONG ROADSIDE PRAIRIE RESTORATIONS AS WELL AS ROADSIDES DOMINATED BY NON-NATIVE PLANTS. MANAGEMENT OF ROADSIDE VEGETATION VIA THE PLANTING OF NATIVE SPECIES PROFOUNDLY AFFECTED BEE COMMUNITIES. RESTORED ROADSIDES SUPPORTED SIGNIFICANTLY GREATER BEE ABUNDANCES AS WELL AS HIGHER SPECIES RICHNESS COMPARED TO WEEDY ROADSIDES. FLORAL SPECIES RICHNESS, FLORAL ABUNDANCE, AND PERCENTAGE OF BARE GROUND WERE THE FACTORS THAT LED TO GREATER BEE ABUNDANCE AND BEE SPECIES RICHNESS ALONG RESTORED ROADSIDES. TRAFFIC AND WIDTH OF ROADSIDE DID NOT SIGNIFICANTLY INFLUENCE BEES, SUGGESTING THAT EVEN RELATIVELY NARROW VERGES NEAR HEAVY TRAFFIC COULD PROVIDE VALUABLE HABITAT TO BEES. RESTORED AND WEEDY ROADSIDE BEE COMMUNITIES WERE SIMILAR TO THE PRAIRIE REMNANT, BUT THE PRAIRIE REMNANT WAS MORE SIMILAR IN BEE RICHNESS AND ABUNDANCE TO RESTORED ROADSIDES. RESTORING ADDITIONAL ROADSIDES TO NATIVE VEGETATION COULD BENEFIT POLLINATOR CONSERVATION EFFORTS BY IMPROVING HABITAT ON THE MILLIONS OF ACRES OF LAND DEVOTED TO ROADSIDES WORLDWIDE, LAND THAT IS ALREADY SET ASIDE FROM FURTHER DEVELOPMENT. (C) 2008 ELSEVIER LTD. ALL RIGHTS RESERVED.",APOIDEA; ECOSYSTEM SERVICES; POLLINATORS; PRAIRIE PLANTS; VEGETATION MANAGEMENT,PLANT-POLLINATOR INTERACTIONS; CROP POLLINATION; BOMBUS SPP.; VERGES; BUMBLEBEES; DIVERSITY; COMMUNITIES; MANAGEMENT; ABUNDANCE; DECLINES,ENGLISH,ARTICLE,ARTICLE,113,"HOPWOOD, JL (REPRINT AUTHOR), IOWA STATE UNIV, 33 BESSEY HALL, AMES, IA 50011 USA.;HOPWOOD, JENNIFER L., UNIV KANSAS, LAWRENCE, KS 66045 USA.",10.1016/J.BIOCON.2008.07.026,"THE BOULEVARD, LANGFORD LANE, KIDLINGTON, OXFORD OX5 1GB, OXON, ENGLAND",NA,NATIONAL FISH AND WILDLIFE FOUNDATION; THE NATURE CONSERVANCY; UNIVERSITY OF KANSAS ENTOMOLOGY PROGRAM; GRASSLAND HERITAGE FOUNDATION; KANSAS ACADEMY OF SCIENCES,"I THANK F. MARKHAM, G. WEISENBERGER, C. DUNN AND KDOT FOR ACCESS TO RIGHTS-OF-WAY, H. JOHNSON FOR FIELD ASSISTANCE, C.D. MICHENER, S. DROEGE, AND V. GONZALEZ FOR CONFIRMING OR CORRECTING BEE IDENTIFICATIONS, M. ENGEL AND J. ASCHER FOR PROOFREADING MY SPECIES LIST, T. DICKSON FOR STATISTICAL ASSISTANCE, AND O. TAYLOR, B. HAGEN, A. CARLSON, AND TWO ANONYMOUS REVIEWERS FOR COMMENTS ON THE MANUSCRIPT. I WAS SUPPORTED BY GRANTS FROM THE NATIONAL FISH AND WILDLIFE FOUNDATION, THE NATURE CONSERVANCY, THE UNIVERSITY OF KANSAS ENTOMOLOGY PROGRAM, THE GRASSLAND HERITAGE FOUNDATION AND THE KANSAS ACADEMY OF SCIENCES.",0006-3207,10,2632-2640,ELSEVIER SCI LTD,141,2008,ISI000260568300020,54,"BIODIVERSITY \& CONSERVATION, ENVIRONMENTAL SCIENCES \& ECOLOGY",233,"BIODIVERSITY CONSERVATION, ECOLOGY, ENVIRONMENTAL SCIENCES",JHOPWOODIASTATE.EDU,367QW,"HOPWOOD, JL (REPRINT AUTHOR), IOWA STATE UNIV, 33 BESSEY HALL, AMES, IA 50011 USA",ISI,none,UNIV KANSAS,IOWA STATE UNIV,NA,"HOPWOOD JL, 2008, BIOL CONSERV","HOPWOOD JL, 2008, BIOL CONSERV",NA,NA,NA,NA
OGILVIE JE;ZALUCKI JM;BOULTER SL,OGILVIE JE,"POLLINATION BIOLOGY OF THE SCLEROPHYLLOUS SHRUB PULTENAEA VILLOSA WILLD. (FABACEAE) IN SOUTHEAST QUEENSLAND, AUSTRALIA",PLANT SPECIES BIOLOGY,PLANT SPEC. BIOL.,"THE POLLINATION BIOLOGY OF THE COMMON SHRUB PULTENAEA VILLOSA WILLD. WAS EXAMINED IN A SUBTROPICAL DRY SCLEROPHYLL FOREST IN EASTERN AUSTRALIA. WE DETERMINED FLORAL PHENOLOGY AND MORPHOLOGY, THE TIMING OF STIGMA RECEPTIVITY AND ANTHER DEHISCENCE, NECTAR AVAILABILITY, THE PLANT BREEDING SYSTEM, AND FLOWER VISITORS. THE SHRUB'S FLOWERS ARE TYPICAL ZYGOMORPHIC PEA FLOWERS WITH HIDDEN FLORAL REWARDS AND REPRODUCTIVE STRUCTURES. THESE FLOWERS REQUIRE SPECIAL MANIPULATION FOR INSECT ACCESS. A RANGE OF INSECTS VISITED THE FLOWERS, ALTHOUGH BEES ARE PREDICTED TO BE THE PRINCIPLE POLLINATORS BASED ON THEIR FREQUENCY ON THE FLOWERS AND THEIR EXCLUSIVE ABILITY TO OPERATE THE WING AND KEEL PETALS TO ACCESS THE REPRODUCTIVE STRUCTURES. NECTAR AND POLLEN ARE OFFERED AS REWARDS AND WERE ACTIVELY COLLECTED BY BEES. NECTAR IS OFFERED TO VISITORS IN MINUTE AMOUNTS AT THE BASE OF THE COROLLA. IN TOOHEY FOREST, A VILLOSA FLOWERS IN SPRING AND IS THE MOST ABUNDANT FLORAL RESOURCE IN THE UNDERSTORY OF THE FOREST AT THIS TIME. THE BREEDING SYSTEM EXPERIMENT REVEALED THAT P. VILLOSA REQUIRES OUTCROSSING FOR HIGH LEVELS OF SEED SET AND THAT THE OVERLAP OF STIGMA RECEPTIVITY AND POLLEN DEHISCENCE WITHIN THE FLOWER SUGGESTS THE POTENTIAL FOR SELF-INCOMPATIBILITY.",BEES; DRY SCLEROPHYLL FOREST; MELITTOPHILY; MIRBELIEAE; SELF-INCOMPATIBLE,BEE FLOWERS; LEGUMES; CONSTANCY; DAVIESIA; WOODLAND; ECOLOGY; NECTAR; SYSTEM,ENGLISH,ARTICLE,ARTICLE,2,"OGILVIE, JE (REPRINT AUTHOR), UNIV TORONTO, DEPT ECOL \& EVOLUTIONARY BIOL, 25 HARBORD ST, TORONTO, ON M5S 3G5, CANADA.;OGILVIE, JANE E., ZALUCKI, JACINTA M., BOULTER, SARAH L., GRIFFITH UNIV, CTR INNOVAT CONSERVAT STRATEGIES, NATHAN, QLD 4111, AUSTRALIA.",10.1111/J.1442-1984.2009.00235.X,"COMMERCE PLACE, 350 MAIN ST, MALDEN 02148, MA USA",NA,"CENTRE FOR INNOVATIVE CONSERVATION STRATEGIES; GRIFFITH SCHOOL OF ENVIRONMENT, GRIFFITH UNIVERSITYGRIFFITH UNIVERSITY","THE AUTHORS THANK THE CENTRE FOR INNOVATIVE CONSERVATION STRATEGIES AND THE GRIFFITH SCHOOL OF ENVIRONMENT, GRIFFITH UNIVERSITY, FOR FINANCIAL SUPPORT. THIS STUD), WAS COMPLETED AS PART OF J. E. OGILVIE'S HONORS PROGRAM. THE AUTHORS THANK YVONNE BUCKLEY AND JANET CHASELING FOR ADVICE ON STATISTICAL ANALYSIS AND ROGER KITCHING FOR HIS ADVICE AND COMMENTS ON EARLIER DRAFTS OF THIS MANUSCRIPT. WE ARE ALSO GRATEFUL TO CHRIS BURWELL AT THE QUEENSLAND MUSEUM AND KEN WALKER AT MUSEUM VICTORIA FOR IDENTIFYING THE BEES AND BRETT HARRIS FOR HIS HELP PREPARING THE FIGURES.",0913-557X,1,11-19,"WILEY-BLACKWELL PUBLISHING, INC",24,2009,ISI000266560100003,38,"PLANT SCIENCES, ENVIRONMENTAL SCIENCES \& ECOLOGY",14,"PLANT SCIENCES, ECOLOGY",JANE.OGILVIEUTORONTO.CA,452RY,"OGILVIE, JE (REPRINT AUTHOR), UNIV TORONTO, DEPT ECOL \& EVOLUTIONARY BIOL, 25 HARBORD ST, TORONTO, ON M5S 3G5, CANADA",ISI,none,GRIFFITH UNIV,UNIV TORONTO,NA,"OGILVIE JE, 2009, PLANT SPEC BIOL","OGILVIE JE, 2009, PLANT SPEC BIOL",NA,NA,NA,NA
SANTOS MESQUITA TM;GUIMARAES FERNANDES VILHENA AM;AUGUSTO SC,SANTOS MESQUITA TM,"TRAP-NESTS OCCUPATION BY CENTRIS (HEMISIELLA) TARSATA SMITH, 1874 E CENTRIS (HEMISIELLA) VITTATA LEPELETIER, 1841 (HYMENOPTERA: APIDAE: CENTRIDINI) IN CERRADO AREAS",BIOSCIENCE JOURNAL,BIOSCI. J.,"CENTRIS SPECIES ARE THE MOST FREQUENT BRAZILIAN SOLITARY BEES THAT NESTING IN TRAP-NESTS. THESE ONES ARE IMPORTANT POLLINATORS OF WILD AND CULTIVATED PLANTS. STUDIES ABOUT THE NESTING BIOLOGY OF THESE POLLINATORS ARE ESSENTIAL IN ORDER TO TRACE MANAGEMENT ALTERNATIVES OF THESE BEES. THE PRESENT WORK AIMED TO VERIFY THE PERCENTAGE OF OCCUPATION AND STRUCTURE OF THE TRAP-NESTS USED BY CENTRIS (HEMISIELLA) TARSATA AND CENTRIS ( HEMISIELLA) VITTATA. THE STUDY WAS CARRIED OUT IN TWO AREAS OF THE TRIANGULO MINEIRO, WHERE BAMBOO CANES HAD BEEN USED AS TRAP-NESTS. THEY WERE INSPECTED MONTHLY, FROM JANUARY TO OCTOBER 2006. IT WAS VERIFIED 35 NESTS OF C. TARSATA AND 12 OF C. VITTATA. THE LENGTH AND DIAMETER MEASUREMENTS OF TRAP-NEST OCCUPIED BY C. TARSATA VARIED FROM 1.5 TO 11.4 CM AND 0.54 TO 1.69 CM, RESPECTIVELY AND THE NUMBER OF CELLS CONSTRUCTED RANGED FROM ONE TO TEN. FOR C. VITTATA, THE LENGTH AND DIAMETER MEASUREMENTS RANGED FROM 4.7 TO 20.5 CM AND 1.06 TO 1.87 CM, RESPECTIVELY, AND THE NUMBER OF CELLS RANGED FROM TWO TO NINE. THESE SPECIES CONSTRUCT THEIR CELLS LINEARLY WITH A MIXTURE OF SAND AND OIL. THEREFORE, C. TARSATA CAN ALSO CONSTRUCTED THEIR NESTS WITH TWO PARALLEL ROWS OF CELLS. SINCE THESE TWO SPECIES ARE THE WEST INDIAN CHERRY'S POLLINATORS, THE INTRODUCTION OF TRAP-NESTS NEAR TO THE CULTURE AREAS, COULD INCREASE THESE POLLINATORS POPULATIONS AND THE NATURAL POLLINATION RATES.",SOLITARY BEES; WEST INDIAN CHERRY; MANAGEMENT; APPLIED POLLINATION,RICAN DRY FOREST; BEES HYMENOPTERA; HABITAT PREFERENCES; COMMUNITY STRUCTURE; BRAZIL HYMENOPTERA; SOUTHERN BRAZIL; SOLITARY WASPS; NE BRAZIL; BIOLOGY; POLLINATORS,PORTUGUESE,ARTICLE,ARTICLE,7,"MESQUITA, TMD (REPRINT AUTHOR), UNIV FED UBERLANDIA, INST BIOL, AV ENGENHEIRO DINZ 1178,CP 593, BR-38400 UBERLANDIA, MG, BRAZIL.;SANTOS MESQUITA, THATIANA MARTINS DOS, GUIMARAES FERNANDES VILHENA, ALICE MARIA, AUGUSTO, SOLANGE CRISTINA, UNIV FED UBERLANDIA, INST BIOL, BR-38400 UBERLANDIA, MG, BRAZIL.",NA,"AV PARA, 1720 CAMPUS UMUARAMA, UBERLANDIA, 38400-902, BRAZIL",NA,NA,NA,1516-3725,5,124-132,UNIV FEDERAL UBERLANDIA,25,2009,ISI000271373300018,38,"AGRICULTURE, LIFE SCIENCES \& BIOMEDICINE - OTHER TOPICS",8,"AGRICULTURE, MULTIDISCIPLINARY, AGRONOMY, BIOLOGY",SCAUGUSTOUMUARAMA.UFU.BR,514DB,"MESQUITA, TMD (REPRINT AUTHOR), UNIV FED UBERLANDIA, INST BIOL, AV ENGENHEIRO DINZ 1178,CP 593, BR-38400 UBERLANDIA, MG, BRAZIL",ISI,none,UNIV FED UBERLANDIA,UNIV FED UBERLANDIA,NA,"SANTOS MESQUITA TM, 2009, BIOSCI J","SANTOS MESQUITA TM, 2009, BIOSCI J",NA,NA,NA,NA
SHEFFIELD CS;HEBERT PDN;KEVAN PG;PACKER L,SHEFFIELD CS,DNA BARCODING A REGIONAL BEE (HYMENOPTERA: APOIDEA) FAUNA AND ITS POTENTIAL FOR ECOLOGICAL STUDIES,MOLECULAR ECOLOGY RESOURCES,MOL. ECOL. RESOUR.,"DNA BARCODING HAS BEEN EVALUATED FOR MANY ANIMAL TAXA AND IS NOW ADVOCATED AS A RELIABLE AND RAPID MEANS FOR SPECIES-LEVEL IDENTIFICATION. THE COMING-TO-LIGHT OF THIS IDENTIFICATION TOOL IS TIMELY AS WE ARE NOW FACING PERHAPS THE GREATEST RATE OF SPECIES LOSS IN RECENT MILLENNIA. THIS STUDY CONTRIBUTES TO AN EVER-INCREASING NUMBER OF PUBLISHED ACCOUNTS OF DNA BARCODING SUCCESSFULLY AND ACCURATELY DISTINGUISHING ANIMAL TAXA, IN THIS INSTANCE, THE BEE FAUNA OF NOVA SCOTIA, CANADA. MOST MEMBERS OF THIS WELL-KNOWN FAUNA WERE RESOLVED WITH PARTICULAR CLARITY, THE AVERAGE INTRASPECIFIC DIVERGENCE WAS LESS THAN 0.5\%, AND COI SEQUENCES FROM OVER 75\% OF THE PROVINCE'S SPECIES ARE NOW IN THE BARCODES OF LIFE DATA SYSTEM. DNA BARCODING ALSO REVEALED SOME SURPRISES WITHIN THIS FAUNA, INCLUDING THE POSSIBLE RECOGNITION OF TWO UNDESCRIBED GENETICALLY UNIQUE SPECIES, ONE IN THE GENUS CERATINA (SUBGENUS ZADONTOMERUS), THE SECOND IN THE GENUS ANDRENA (SUBGENUS LARANDRENA), BOTH ARE PRESENTLY RECEIVING FURTHER TAXONOMIC STUDY. IN ADDITION, DNA BARCODING HAS ALLOWED SEX-ASSOCIATIONS AMONG TWO PAIRS OF CLEPTOPARASITIC SPECIES. THE RESULTING UTILITY OF DNA BARCODING FOR ECOLOGICAL STUDIES OF BEE COMMUNITIES IS DISCUSSED.",APOIDEA; BEES; CRYPTIC SPECIES; DNA BARCODING; NOVA SCOTIA; SEX ASSOCIATIONS,MITOCHONDRIAL-DNA; NOVA-SCOTIA; SEX DETERMINATION; SWEAT BEE; IDENTIFICATION; BIODIVERSITY; POLLINATORS; TAXONOMY; DIFFERENTIATION; PHYLOGENY,ENGLISH,ARTICLE,ARTICLE,89,"SHEFFIELD, CS (REPRINT AUTHOR), YORK UNIV, DEPT BIOL, 4700 KEELE ST, TORONTO, ON M3J 1P3, CANADA.;SHEFFIELD, CORY S., PACKER, LAURENCE, YORK UNIV, DEPT BIOL, TORONTO, ON M3J 1P3, CANADA.;HEBERT, PAUL D. N., UNIV GUELPH, CANADIAN CTR DNA BARCODING, BIODIVERS INST ONTARIO, GUELPH, ON N1G 2W1, CANADA.;KEVAN, PETER G., UNIV GUELPH, DEPT ENVIRONM BIOL, GUELPH, ON N1G 2W1, CANADA.",10.1111/J.1755-0998.2009.02645.X,"111 RIVER ST, HOBOKEN 07030-5774, NJ USA",NA,CANADIAN BARCODE OF LIFE NETWORK FROM GENOME CANADA (THROUGH THE ONTARIO GENOMICS INSTITUTE)GENOME CANADA; NSERC (NATURAL SCIENCES AND ENGINEERING RESEARCH COUNCIL OF CANADA)NATURAL SCIENCES AND ENGINEERING RESEARCH COUNCIL OF CANADA,"THE MAJORITY OF THIS RESEARCH WAS CONDUCTED BY THE SENIOR AUTHOR (CS) WHILE A GRADUATE STUDENT AT THE UNIVERSITY OF GUELPH, ON; THE RESEARCH WAS BASED IN NOVA SCOTIA WHILE EMPLOYED AT AGRICULTURE AND AGRI-FOOD CANADA (AAFC), KENTVILLE, NS. THANKS TO DR ROBERT F. SMITH (AAFC) FOR PROVIDING FINANCIAL SUPPORT AND LAB FACILITIES DURING THIS PERIOD. WE ALSO THANK SUE WESBY, KIM JANSEN AND MEG HAINSTOCK (ALL FORMERLY OF AAFC) FOR ASSISTANCE IN COLLECTING AND PREPARING MATERIAL FOR DNA BARCODING; DR JOHN ASCHER (AMERICAN MUSEUM OF NATURAL HISTORY, NY) FOR ASSISTANCE WITH SPECIMEN IDENTIFICATION, AND ERIN FENTON (FORMERLY OF THE UNIVERSITY OF GUELPH) FOR TISSUE SAMPLE PREPARATION AND ALL LAB WORK ASSOCIATED WITH DNA BARCODING. FINAL PREPARATION OF THIS MANUSCRIPT WAS COMPLETED BY THE SENIOR AUTHOR AT YORK UNIVERSITY, TORONTO, ON, DURING A POST DOCTORAL FELLOWSHIP WITH LAURENCE PACKER SUPPORTED THROUGH FUNDING TO THE CANADIAN BARCODE OF LIFE NETWORK FROM GENOME CANADA (THROUGH THE ONTARIO GENOMICS INSTITUTE), NSERC (NATURAL SCIENCES AND ENGINEERING RESEARCH COUNCIL OF CANADA) AND OTHER SPONSORS LISTED AT WWW.BOLNET.CA.",1755-098X,1,196-207,WILEY,9,2009,ISI000265227700020,72,"BIOCHEMISTRY \& MOLECULAR BIOLOGY, ENVIRONMENTAL SCIENCES \& ECOLOGY, EVOLUTIONARY BIOLOGY",63,"BIOCHEMISTRY \& MOLECULAR BIOLOGY, ECOLOGY, EVOLUTIONARY BIOLOGY",CORYSYORKU.CA,433TC,"SHEFFIELD, CS (REPRINT AUTHOR), YORK UNIV, DEPT BIOL, 4700 KEELE ST, TORONTO, ON M3J 1P3, CANADA",ISI,none,YORK UNIV;UNIV GUELPH;UNIV GUELPH,YORK UNIV,NA,"SHEFFIELD CS, 2009, MOL ECOL RESOUR","SHEFFIELD CS, 2009, MOL ECOL RESOUR",NA,NA,NA,NA
CHOI YH;KANG NJ;PARK KS;CHUN H;CHO MW;UM YC;YOU HY,CHOI YH,INFLUENCE OF FRUITING METHODS ON FRUIT CHARACTERISTICS IN CHERRY TOMATO,KOREAN JOURNAL OF HORTICULTURAL SCIENCE \& TECHNOLOGY,KOREAN J. HORTIC. SCI. TECHNOL.,"THIS STUDY WAS CONDUCTED TO INVESTIGATE THE EFFECTS OF FRUITING METHODS ON GROWTH, YIELD AND QUALITY OF `KOKO' AND `SUNCHERRY' (GRAFTED `SPECIAL' STOCK) TOMATO (LYCOPERSICON ESCULENTUM VAR. CERASIFORME ALEF.). METHODS OF FRUITING WERE BEE (BOMBUS TERRESTRIS), VIBRATION, AND 4-CPA TREATMENT. THERE WERE NOT SIGNIFICANT DIFFERENCES AMONG FRUITING METHODS IN GROWTH AND YIELD OF `KOKO' AND `SUNCHERRY/SPECIAL' TOMATO. NUMBER OF SEEDS, FLESH AND JUICE RATIO OF FRUIT WERE DIFFERENT SIGNIFICANTLY, WHEREAS, HARDNESS AND COMPRESSIVE STRENGTH OF PERICARP WERE NOT DIFFERENT SIGNIFICANTLY AMONG FRUITING METHODS. THERE WERE NOT SIGNIFICANT DIFFERENCES AMONG FRUITING METHODS ON SOLUBLE SOLIDS, ACIDITY CONTENT, RATIO OF FRUIT REDUCTION, AND OCCURRENCE RATIO OF UNMARKETABLE FRUIT OF INVESTIGATED TORNATOES ON THE 7TH DAY AFTER HARVEST. IT IS NOT EASY TO DISTINGUISH THE DIFFERENCE OF PERICARP COLOR WITH NAKED EYE AMONG THE FRUITING METHODS OR BETWEEN VARIETIES BECAUSE, L* VALUE IS LOW AND A* B* VALUE IS CLOSED TOGETHER AT THE SAME",LYCOPERSICON ESCULENTUM VAR. CERASIFORME; 4-CPA; BEE; L*A*B* COLOR,HONEY-BEE HYMENOPTERA; POLLINATION,KOREAN,ARTICLE,ARTICLE,2,"CHOI, YH (REPRINT AUTHOR), NATL INST HORT \& HERBAL SCI, NAMHAE SUBSTN, NAMHAE 668812, SOUTH KOREA.;CHOI, YOUNG HAH, NATL INST HORT \& HERBAL SCI, NAMHAE SUBSTN, NAMHAE 668812, SOUTH KOREA.;KANG, NAM JUN, PARK, KYOUNG SUB, CHO, MYEONG WHAN, UM, YEONG CHEOL, YOU, HEE YONG, NATL INST HORT \& HERBAL SCI, PROTECTED HORT EXPT STN, PUSAN 618300, SOUTH KOREA.;CHUN, HEE, NATL INST HORT \& HERBAL SCI, RES PLANNING \& COORDINAT DIV, SUWON 440310, SOUTH KOREA.",NA,"C/O NATL HORTICULTURAL RES INST, IMOK-DONG 475, JANGAN-GU, SUWON, 440-706, SOUTH KOREA",NA,NA,NA,1226-8763,1,62-66,KOREAN SOC HORTICULTURAL SCIENCE,27,2009,ISI000265340500011,19,AGRICULTURE,8,HORTICULTURE,YHCHOIRDA.GO.KR,435JP,"CHOI, YH (REPRINT AUTHOR), NATL INST HORT \& HERBAL SCI, NAMHAE SUBSTN, NAMHAE 668812, SOUTH KOREA",ISI,none,NATL INST HORT AND HERBAL SCI;NATL INST HORT AND HERBAL SCI;NATL INST HORT AND HERBAL SCI,NATL INST HORT AND HERBAL SCI,NA,"CHOI YH, 2009, KOREAN J HORTIC SCI TECHNOL","CHOI YH, 2009, KOREAN J HORTIC SCI TECHNOL",NA,NA,NA,NA
NAUTIYAL BP;NAUTIYAL MC;KHANDURI VP;RAWAT N,NAUTIYAL BP,"FLORAL BIOLOGY OF ACONITUM HETEROPHYLLUM WALL.: A CRITICALLY ENDANGERED ALPINE MEDICINAL PLANT OF HIMALAYA, INDIA",TURKISH JOURNAL OF BOTANY,TURK. J. BOT.,"ACONITUM HETEROPHYLLUM WALL. IS A CRITICALLY ENDANGERED WILD MEDICINAL HERB OF ALPINE HIMALAYA AND CULTIVATION IS RECOMMENDED OWING TO ITS LARGE DEMAND IN THE HERBAL MARKET AND TO ENSURE THE CONSERVATION OF WILD HABITATS. THEREFORE, OBSERVATIONS ON FLORAL BIOLOGY, POLLEN GERMINATION, POLLINATION, AND FRUIT AND SEED SETTING AFTER IMPLYING DIFFERENT BREEDING SYSTEMS WERE CARR ED OUT FOR ITS SUCCESSFUL DOMESTICATION AND IMPROVEMENT IN CULTIVATION PRACTICES. THE STUDY REVEALS THAT THE PLANTS GROWN IN HOTHOUSE CONDITIONS SHOWED CONSIDERABLE VARIATION IN THE PRODUCTION OF FLOWERS AND SEEDS. FLOWERING OCCURS FROM THE SECOND WEEK OF SEPTEMBER TO LATE OCTOBER, WITH 20 DAYS OF PEAK FLOWERING. ANTHERS DEHISCED LONGITUDINALLY BETWEEN 7:30 AND 11:00 AM, STRONGLY DEPENDENT ON HIGHER TEMPERATURE. THE POLLEN GRAINS PER ANTHER VARIED BETWEEN 2000 AND 6000, WHICH MEANS AN AVERAGE OF 80,000 POLLEN GRAINS PER FLOWER. NECTAR PRODUCTION BEGINS AT ANTHER DEHISCENCE AND COINCIDES WITH MAXIMUM STIGMATIC RECEPTIVITY. BEES WERE OBSERVED AS POLLINATORS. POLLEN GERMINATION AND POLLEN TUBE ELONGATION WERE MAXIMUM IN 5\% SUCROSE. CONTROLLED POLLINATION REVEALED THAT THIS SPECIES IS SELF-IN COMPATIBLE, ALTHOUGH FEW FRUITS DEVELOPED FROM SELFING. SUCH FRUITS WERE SMALLER THAN THE FRUITS PRODUCED BY OPEN POLLINATED AND FROM HAND-CROSSED FLOWERS AND MOST ABORTED EARLY IN DEVELOPMENT.",ACONITUM HETEROPHYLLUM; RANUNCULACEAE; CRITICALLY ENDANGERED; ANTHER DEHISCENCE; POLLINATION; POLLEN GERMINATION,SELF-INCOMPATIBILITY; POLLEN GERMINATION; TUBE GROWTH; FERTILIZATION; ASTERACEAE; VIABILITY,ENGLISH,ARTICLE,ARTICLE,15,"NAUTIYAL, BP (REPRINT AUTHOR), MIZORAM UNIV, SCH ES\&NRM, DEPT HORT AROMAT \& MED PLANTS, AIZAWL 790001, INDIA.;NAUTIYAL, BHAGWATI P., MIZORAM UNIV, SCH ES\&NRM, DEPT HORT AROMAT \& MED PLANTS, AIZAWL 790001, INDIA.;NAUTIYAL, MOHAN C., RAWAT, NEELUM, HNB GARHWAL UNIV, HIGH ALTITUDE PLANT PHYSIOL RES CTR, SRINAGAR 246174, GARHWAL, INDIA.;KHANDURI, VINOD P., MIZORAM UNIV, SCH ES\&NRM, DEPT FORESTRY, AIZAWL 790001, INDIA.",NA,"ATATURK BULVARI NO 221, KAVAKLIDERE, ANKARA, 00000, TURKEY",NA,"DSTDEPARTMENT OF SCIENCE \& TECHNOLOGY (INDIA) [SR/FTP/L-16/2004]; GOI, NEW DELHI","THE AUTHORS ACKNOWLEDGE THE HELP RENDERED BY RESEARCHERS DR. RAJEEV K. VASHISTHA, GUNJAN, POONUM, ANURAG DHYANI, AND KARAN SINGH DURING THE OBSERVATIONS. THE AUTHOR BPN GRATEFULLY ACKNOWLEDGE DIRECTOR, HAPPRC FOR INFRASTRUCTURAL FACILITIES AND THE SERC DIVISION, DST, GOI, NEW DELHI FOR FINANCIAL SUPPORT (DST NO SR/FTP/L-16/2004).",1300-008X,1,13-20,TUBITAK SCIENTIFIC \& TECHNICAL RESEARCH COUNCIL TURKEY,33,2009,ISI000264939600002,34,PLANT SCIENCES,5,PLANT SCIENCES,BHAGWATINAUTIYALGMAIL.COM,429SE,"NAUTIYAL, BP (REPRINT AUTHOR), MIZORAM UNIV, SCH ES\&NRM, DEPT HORT AROMAT \& MED PLANTS, AIZAWL 790001, INDIA",ISI,none,MIZORAM UNIV;HNB GARHWAL UNIV;MIZORAM UNIV,MIZORAM UNIV,NA,"NAUTIYAL BP, 2009, TURK J BOT","NAUTIYAL BP, 2009, TURK J BOT",NA,NA,NA,NA
