AU,first_author,TI,SO,JI,AB,DE,ID,LA,DT,DT2,TC,C1,DI,PA,AR,FU,FX,SN,PN,PP,PU,VL,PY,UT,NR,SC,U2,WC,EM,GA,RP,DB,CR,AU_UN,AU1_UN,AU_UN_NR,SR_FULL,SR,SE,BO,BE,BN
DAVIS AY;LONSDORF EV;SHIERK CR;MATTESON KC;TAYLOR JR;LOVELL ST;MINOR ES,DAVIS AY,ENHANCING POLLINATION SUPPLY IN AN URBAN ECOSYSTEM THROUGH LANDSCAPE MODIFICATIONS,LANDSCAPE AND URBAN PLANNING,LANDSC. URBAN PLAN.,"ALTHOUGH URBAN AGRICULTURE IS GROWING IN POPULARITY, LITTLE IS KNOWN ABOUT THE DISTRIBUTION OF INSECT POLLINATORS ACROSS URBANIZED LANDSCAPES. WE USED THE POLLINATION MODULE OF INVEST (A SUITE OF SOFTWARE MODELS USED TO MAP AND VALUE ECOSYSTEM SERVICES), ALONG WITH FINE-SCALE LAND COVER DATA AND EMPIRICAL DATA ON BEE DISTRIBUTIONS, TO ASSESS DIFFERENT SCENARIOS OF URBAN POLLINATOR MANAGEMENT IN CHICAGO, ILLINOIS (USA). SPECIFICALLY, WE SIMULATED THE PARTIAL CONVERSION OF LAWN/TURF-GRASS TO FLORAL RESOURCES IN CITY PARKS ONLY, IN GARDENS MANAGED BY INDIVIDUAL HOUSEHOLDS ONLY, AND IN ANY AVAILABLE TURF GRASS WITHIN BUFFER DISTANCES OF 250-1000 M OF URBAN FARMS, COMMUNITY GARDENS, AND HOME GARDENS ACROSS CHICAGO. WE FOUND THAT THE OUTPUT OF INVEST'S POLLINATION MODEL WAS SIGNIFICANTLY RELATED TO EMPIRICAL MEASURES OF BEE RICHNESS (EXPLAINING 46\% OF THE VARIATION) BUT NOT BEE ABUNDANCE IN CHICAGO. TO INCREASE POLLINATION SUPPLY AT URBAN FARMS AND COMMUNITY GARDENS, OUR RESULTS INDICATE THAT, OUT OF THE SCENARIOS PRESENTED HERE, THE BEST STRATEGY FOR THE CITY OF CHICAGO WOULD BE TO CONCENTRATE FLORAL RESOURCES NEARBY (WITHIN A 250 M BUFFER RATHER THAN WITHIN A 1 KM BUFFER). IN CONTRAST, FOR HOME GARDENS, THE MODEL INDICATES THAT IT MAY BE BETTER TO INCREASE FLORAL RESOURCES THROUGHOUT THE CITY. THIS DISCREPANCY MAY BE DUE TO THE SMALLER SIZE OF HOME GARDENS AND THEIR MORE DISPERSED SPATIAL ARRANGEMENT THROUGHOUT THE CITY. GENERALLY, OUR RESULTS INDICATE THAT CONVERTING TURF GRASS TO A MORE FLORALLY-RICH LAND COVER WOULD SUPPORT INCREASED SUPPLY OF POLLINATORS AND URBAN AGRICULTURE. (C) 2017 ELSEVIER B.V. ALL RIGHTS RESERVED.",HOME GARDEN; BEE; ECOSYSTEM SERVICE; LAWN; LANDSCAPE MANIPULATION; URBAN AGRICULTURE; POLLINATION SERVICE,FRUIT-SET; SERVICES; BEES; CITY; DIVERSITY; COMMUNITIES; HYMENOPTERA; RESOURCES; ABUNDANCE; FLOWERS,ENGLISH,ARTICLE,ARTICLE,9,"DAVIS, AY (REPRINT AUTHOR), MIAMI UNIV, DEPT GEOG, 601 E SPRING ST, OXFORD, OH 45056 USA.;DAVIS, AMELIE Y., MIAMI UNIV, DEPT GEOG, 601 E SPRING ST, OXFORD, OH 45056 USA.;DAVIS, AMELIE Y., MIAMI UNIV, INST ENVIRONM \& SUSTAINABIL, 601 E SPRING ST, OXFORD, OH 45056 USA.;DAVIS, AMELIE Y., MINOR, EMILY S., UNIV ILLINOIS, INST ENVIRONM SCI \& POLICY, 2121 WEST TAYLOR ST MC 673, CHICAGO, IL 60612 USA.;LONSDORF, ERIC V., UNIV MINNESOTA, INST ENVIRONM, 1954 BUFORD AVE, ST PAUL, MN 55108 USA.;SHIERK, CLIFF R., MINOR, EMILY S., UNIV ILLINOIS, BIOL SCI, 845 W TAYLOR ST MC 066, CHICAGO, IL 60607 USA.;MATTESON, KEVIN C., MIAMI UNIV, DEPT BIOL, 13 PEABODY HALL, OXFORD, OH 45056 USA.;TAYLOR, JOHN R., UNIV RHODE ISL, DEPT PLANT SCI \& ENTOMOL, 234 WOODWARD HALL, KINGSTON, RI 02881 USA.;LOVELL, SARAH T., UNIV ILLINOIS, DEPT CROP SCI, PLANT SCI LAB 1009, 1201 S DORNER DR, URBANA, IL 61801 USA.",10.1016/J.LANDURBPLAN.2017.02.011,"RADARWEG 29, 1043 NX AMSTERDAM, NETHERLANDS",NA,NATIONAL SCIENCE FOUNDATIONNATIONAL SCIENCE FOUNDATION (NSF); U.S. FOREST SERVICE UNDER THE ULTRA-EX PROGRAM [0948484],"THIS RESEARCH WAS SUPPORTED BY THE NATIONAL SCIENCE FOUNDATION AND THE U.S. FOREST SERVICE UNDER THE ULTRA-EX PROGRAM (GRANT NUMBER 0948484). THE AUTHORS WISH TO THANK THE CITY OF CHICAGO FOR PROVIDING THEM WITH THE LAND COVER DATASET, BRANDON FLESSNER FOR DEVELOPING FIG. 1 AND RUNNING SOME OF THE SCENARIOS, AND TWO ANONYMOUS REVIEWERS FOR THEIR CONSTRUCTIVE FEEDBACK.",0169-2046,NA,157-166,ELSEVIER,162,2017,ISI000399627800015,42,"ENVIRONMENTAL SCIENCES \& ECOLOGY, GEOGRAPHY, PHYSICAL GEOGRAPHY, PUBLIC ADMINISTRATION, URBAN STUDIES",149,"ECOLOGY, ENVIRONMENTAL STUDIES, GEOGRAPHY, GEOGRAPHY, PHYSICAL, REGIONAL \& URBAN PLANNING, URBAN STUDIES",DAVIS.AMELIEMIAMIOH.EDU,ES6AH,"DAVIS, AY (REPRINT AUTHOR), MIAMI UNIV, DEPT GEOG, 601 E SPRING ST, OXFORD, OH 45056 USA",ISI,none,MIAMI UNIV;MIAMI UNIV;UNIV ILLINOIS;UNIV MINNESOTA;UNIV ILLINOIS;MIAMI UNIV;UNIV RHODE ISL;UNIV ILLINOIS,MIAMI UNIV,NA,"DAVIS AY, 2017, LANDSC URBAN PLAN","DAVIS AY, 2017, LANDSC URBAN PLAN",NA,NA,NA,NA
FLACHER F;HANSART A;MOTARD E;FOFANA AM;VINCENT O;GESLIN B;DAJOZ I;RAYNAUD X,FLACHER F,DOES COMPETITION WITH WIND-POLLINATED SPECIES ALTER ECHIUM PLANTAGINEUM'S ATTRACTIVENESS TO A COMMON POLLINATOR BOMBUS TERRESTRIS?,ECOLOGICAL ENTOMOLOGY,ECOL. ENTOMOL.,"1. IN INSECT-POLLINATED PLANTS, POLLINATOR ATTRACTION IS INFLUENCED BY FLOWERS (E.G. NUMBER, SIZE) AND THEIR ASSOCIATED REWARDS (E.G. POLLEN, NECTAR). THESE TRAITS CAN DEPEND ON PLANT INTERACTIONS. INDEED, BELOW-GROUND COMPETITION BETWEEN PLANTS CAN LEAD TO A DECREASE IN FLOWER OR REWARD PRODUCTION IN INSECT-POLLINATED SPECIES. 2. WIND-POLLINATED PLANTS, IN PARTICULAR, WHICH ARE ALMOST NEVER STUDIED IN PLANT POLLINATOR NETWORKS, CAN ALTER INSECT-POLLINATED PLANTS' ATTRACTIVENESS THROUGH COMPETITION FOR NUTRIENTS. THE RESPONSE OF POLLINATORS TO SUCH CHANGES HAS NEVER BEEN INVESTIGATED. 3. A POT EXPERIMENT WAS CARRIED OUT IN WHICH AN INSECT-POLLINATED SPECIES, ECHIUM PLANTAGINEUM, WAS GROWN IN BINARY MIXTURE WITH THREE WIND-POLLINATED SPECIES SELECTED TO EXERT A PANEL OF COMPETITIVE INTERACTIONS. BELOW-GROUND COMPETITION WAS CONTROLLED USING DIVIDERS LIMITING INTERSPECIFIC ROOT COMPETITION. FLORAL TRAITS OF E. PLANTUGINEUM (I.E. FLOWER PRODUCTION, FLORAL DISPLAY SIZE, FLOWER SIZE AND NECTAR PRODUCTION) WERE MEASURED. FOR EACH SPECIES MIXTURE, THE VISITS (I.E. FIRST VISIT, NUMBER OF VISITS, 10-MIN SEQUENCES) OF BOMBUS TERRESTRIS INDIVIDUALS RELEASED IN A FLIGHT CAGE CONTAINING TWO POTS WERE FOLLOWED, ONE WITH AND ONE WITHOUT BELOW-GROUND COMPETITION. 4. BELOW-GROUND COMPETITION SIGNIFICANTLY AFFECTED NECTAR'S SUCROSE CONCENTRATION BUT DID NOT INFLUENCE FLOWER AND NECTAR PRODUCTION. LIKEWISE, POLLINATOR VISITS WERE NOT INFLUENCED BY BELOW-GROUND COMPETITION. COMPETITOR IDENTITY SIGNIFICANTLY INFLUENCED FLOWER AND REWARD PRODUCTION OF E. PLANTAGINEUM, WITH A DECREASE IN THE PRESENCE OF THE MOST COMPETITIVE WIND-POLLINATED SPECIES. A TENDENCY FOR FASTER FLOWER VISITATION EVENTS WAS ALSO DETECTED IN THE PRESENCE OF THE LEAST COMPETITIVE COMPETITOR. THIS STUDY RAISES NEW QUESTIONS REGARDING THE INFLUENCE OF WIND-POLLINATED PLANTS ON PLANT POLLINATOR INTERACTIONS.",ATTRACTIVENESS; COMPETITION; NECTAR; PLANT COMMUNITIES; POLLINATION,FLORAL DISPLAY SIZE; CUCURBITA-PEPO CUCURBITACEAE; AMINO-ACID-COMPOSITION; FORAGING BUMBLEBEES; NECTAR PRODUCTION; PLANT COMPETITION; CHENOPODIUM-ALBUM; POLLEN PRODUCTION; MIMULUS-RINGENS; FLOWER SIZE,ENGLISH,ARTICLE,ARTICLE,0,"FLACHER, F (REPRINT AUTHOR), UPMC UNIV PARIS 6, UNIV PARIS DIDEROT, INST ECOL \& SCI ENVIRONM PARIS IEES PARIS, CNRS,INRA,IRD,UPEC, 4 PL JUSSIEU, F-75252 PARIS 05, FRANCE.;FLACHER, FLORIANE, RAYNAUD, XAVIER, UPMC UNIV PARIS 6, UNIV PARIS DIDEROT, INST ECOL \& SCI ENVIRONM PARIS IEES PARIS, CNRS,INRA,IRD,UPEC, 4 PL JUSSIEU, F-75252 PARIS 05, FRANCE.;HANSART, AMANDINE, CNRS, UMS CEREEP ECOTRON ILE DE FRANCE 3194, ST PIERRE LES NEMOURS, FRANCE.;FOFANA, ABDOU MOUTALAB, MEM UNIV NEWFOUNDLAND, DEPT BIOL, ST JOHN, NF, CANADA.;VINCENT, OCEANE, UPMC UNIV PARIS 6, SORBONNE UNIV, PARIS 05, FRANCE.;GESLIN, BENOIT, AIX MARSEILLE UNIV, UNIV AVIGNON, CNRS, IMBE,IRD, MARSEILLE, FRANCE.;FLACHER, FLORIANE, MOTARD, ERIC, DAJOZ, ISABELLE, UPMC UNIV PARIS 6, UNIV PARIS DIDEROT, INST ECOL \& SCI ENVIRONM PARIS IEES PARIS, CNRS,INRA,IRD,UPEC, PARIS 05, FRANCE.",10.1111/EEN.12426,"111 RIVER ST, HOBOKEN 07030-5774, NJ USA",NA,ILE-DE-FRANCE REGION THROUGH THE DIM R2DS PROGRAMME,"THIS WORK WAS SUPPORTED BY A GRANT FROM THE ILE-DE-FRANCE REGION THROUGH THE DIM R2DS PROGRAMME. WE ARE GRATEFUL TO ALL THE MEMBERS OF THE CEREEP ECOTRON ILE-DE-FRANCE FOR THEIR HELP ON THE FIELD. A SPECIAL THANK YOU TO MARTIN PERRIGAULT WHO GAVE US PRECIOUS ADVICE FOR THE MAINTENANCE OF BUMBLEBEE COLONIES. FF, ID AND XR DESIGNED THE EXPERIMENT. FF, AH, EM, AF, OV AND XR COLLECTED DATA. FF, BG AND XR PERFORMED STATISTICAL ANALYSIS. FF WROTE THE FIRST DRAFT OF THE MANUSCRIPT AND FF, AH, BG, ID, AND XR CONTRIBUTED TO REVISIONS. THE AUTHORS DECLARE NO CONFLICT OF INTEREST.",0307-6946,5,617-628,WILEY,42,2017,ISI000409093100010,64,ENTOMOLOGY,19,ENTOMOLOGY,FLORIANE.FLACHERGMAIL.COM,FF6DA,"FLACHER, F (REPRINT AUTHOR), UPMC UNIV PARIS 6, UNIV PARIS DIDEROT, INST ECOL \& SCI ENVIRONM PARIS IEES PARIS, CNRS,INRA,IRD,UPEC, 4 PL JUSSIEU, F-75252 PARIS 05, FRANCE",ISI,none,INST ECOL AND SCI ENVIRONM PARIS IEES PARIS;CNRS;MEM UNIV NEWFOUNDLAND;FRANCE.;AIX MARSEILLE UNIV;INST ECOL AND SCI ENVIRONM PARIS IEES PARIS,NOTDECLARED,NA,"FLACHER F, 2017, ECOL ENTOMOL","FLACHER F, 2017, ECOL ENTOMOL",NA,NA,NA,NA
MEYER S;UNTERNAHRER D;ARLETTAZ R;HUMBERT JY;MENZ MHM,MEYER S,PROMOTING DIVERSE COMMUNITIES OF WILD BEES AND HOVERFLIES REQUIRES A LANDSCAPE APPROACH TO MANAGING MEADOWS,AGRICULTURE ECOSYSTEMS \& ENVIRONMENT,AGRIC. ECOSYST. ENVIRON.,"THERE IS ONGOING CONCERN REGARDING THE OBSERVED DECLINE IN POLLINATOR POPULATIONS. MANAGING AGRICULTURAL LANDSCAPES THROUGH AGRI-ENVIRONMENT SCHEMES (AES) SUPPORTS BIODIVERSITY AND COULD COUNTERACT POLLINATOR POPULATION DECLINES. WE INVESTIGATED WHETHER ALTERATIONS TO CURRENT AES GRASSLAND MOWING REGIMES WOULD INCREASE THE ABUNDANCE AND SPECIES RICHNESS OF WILD BEES AND HOVERFLIES. FURTHERMORE, WE INVESTIGATED THE RESPONSE OF DIFFERENT NESTING AND FEEDING GUILDS OF WILD BEES AND HOVERFIIES, RESPECTIVELY, TO THESE REGIMES. THE THREE EXPERIMENTAL MOWING REGIMES WERE: (I) FIRST CUT NOT BEFORE 15 JUNE, BEFORE THE BEGINNING OF SUMMER (SWISS AES MANAGEMENT, CONTROL MEADOWS), (II) FIRST CUT DELAYED UNTIL 15 JULY (DELAYED MEADOWS), (III) AS FOR CONTROL MEADOWS BUT LEAVING 10-20\% UNCUT AS A REFUGE (REFUGE MEADOWS). THE RATIONALE BEHIND THE DELAYED AND REFUGE MOWING REGIMES WAS EXTENDING THE AVAILABILITY OF FLORAL RESOURCES FOR POLLINATORS, WHILE ALSO PROVIDING REFUGIA FOR SPECIES THAT MAY BE DIRECTLY IMPACTED BY MOWING. HOVERFLIES AND WILD BEES WERE COLLECTED IN 2014 AND 2015, RESPECTIVELY, USING PAN-TRAPPING AND SWEEP-NETTING, ONCE BEFORE AND ONCE AFTER THE FIRST CUT. THE TWO COLLECTING METHODS SHOWED CONTRASTING RESULTS. WHILE THERE WAS NO DIFFERENCE IN THE ABUNDANCE OR RICHNESS OF WILD BEES BETWEEN THE MEADOWS WHEN USING PAN TRAPS, FOLLOWING THE FIRST CUT, SWEEP-NETTING RESULTED IN A HIGHER ABUNDANCE AND RICHNESS OF WILD BEES IN DELAYED AND REFUGE MEADOWS COMPARED TO CONTROL MEADOWS. PAN-TRAPPING DETECTED A HIGHER ABUNDANCE OF HOVERFLIES IN DELAYED COMPARED TO REFUGE MEADOWS, WHEREAS SWEEP-NETTING DETECTED A HIGHER ABUNDANCE IN DELAYED AND REFUGE COMPARED TO CONTROL MEADOWS, AFTER THE FIRST CUT. SAPROPHAGOUS HOVERFLIES WERE MORE ABUNDANT IN THE CONTROL AND DELAYED THAN REFUGE MEADOWS FOLLOWING THE FIRST CUT, WHEN SAMPLED WITH PAN TRAPS. PREDATORY HOVERFIIES WERE MORE ABUNDANT AND SPECIES RICH IN DELAYED AND REFUGE COMPARED TO CONTROL MEADOWS FOLLOWING THE FIRST CUT, WHEN SAMPLED BY SWEEP NETTING. OUR STUDY DEMONSTRATES THAT SIMPLE ALTERATIONS TO A COMMON AES GRASSLAND MOWING REGIME CAN ENHANCE POPULATIONS OF POLLINATORS AND NATURAL ENEMIES OF CROP PESTS. FURTHERMORE, THE CONTRASTING RESPONSE OF THE LIFE-HISTORY GUILDS INDICATES THAT PROMOTING HETEROGENEOUS MANAGEMENT PRACTICES WITHIN THE LANDSCAPE IS IMPORTANT FOR SUPPORTING DIVERSE COMMUNITIES, AND MAINTAINING KEY ECOSYSTEM SERVICES SUCH AS POLLINATION AND BIOCONTROL. (C) 2017 ELSEVIER B.V. ALL RIGHTS RESERVED.",AGRI-ENVIRONMENT SCHEMES; BIODIVERSITY; ECOSYSTEM SERVICES; LIFE-HISTORY TRAITS; MOWING; POLLINATORS; SEMI-NATURAL GRASSLAND,AGRI-ENVIRONMENT SCHEMES; SOWN FLOWER STRIPS; FORAGING RANGES; BIODIVERSITY; POLLINATORS; BUTTERFLIES; SYRPHIDAE; RESPONSES; DENSITY; DIPTERA,ENGLISH,ARTICLE,ARTICLE,11,"MENZ, MHM (REPRINT AUTHOR), UNIV BERN, INST ECOL \& EVOLUT, DIV COMMUNITY ECOL, BALTZERSTR 6, CH-3012 BERN, SWITZERLAND.;MEYER, SANDRO, MENZ, MYLES H. M., UNIV BERN, INST ECOL \& EVOLUT, DIV COMMUNITY ECOL, BALTZERSTR 6, CH-3012 BERN, SWITZERLAND.;UNTERNAHRER, DEBORA, ARLETTAZ, RAPHAEL, HUMBERT, JEAN-YVES, UNIV BERN, INST ECOL \& EVOLUT, DIV CONSERVAT BIOL, BALTZERSTR 6, CH-3012 BERN, SWITZERLAND.;ARLETTAZ, RAPHAEL, SWISS ORNITHOL INST, VALAIS FIELD STN, RUE RHONE 11, CH-1950 SION, SWITZERLAND.;MENZ, MYLES H. M., UNIV WESTERN AUSTRALIA, SCH PLANT BIOL, CRAWLEY, WA 6009, AUSTRALIA.",10.1016/J.AGEE.2017.01.037,"RADARWEG 29, 1043 NX AMSTERDAM, NETHERLANDS",NA,"FEDERAL OFFICE FOR AGRICULTURE; FEDERAL OFFICE FOR ENVIRONMENT; SWISS NATIONAL SCIENCE FOUNDATIONSWISS NATIONAL SCIENCE FOUNDATION (SNSF) [31003A\_125398, 31003A\_149656]; CANTONAL OFFICE OF ENVIRONMENT AND/OR AGRICULTURE OF BERN; CANTONAL OFFICE OF ENVIRONMENT AND/OR AGRICULTURE OF VAUD; CANTONAL OFFICE OF ENVIRONMENT AND/OR AGRICULTURE OF BASEL-LANDSCHAFT; CANTONAL OFFICE OF ENVIRONMENT AND/OR AGRICULTURE OF AARGAU; CANTONAL OFFICE OF ENVIRONMENT AND/OR AGRICULTURE OF NEUCHATEL; CANTONAL OFFICE OF ENVIRONMENT AND/OR AGRICULTURE OF FRIBOURG; CANTONAL OFFICE OF ENVIRONMENT AND/OR AGRICULTURE OF VALAIS; CANTONAL OFFICE OF ENVIRONMENT AND/OR AGRICULTURE OF GRAUBUNDEN","WE WOULD LIKE TO THANK THE FARMERS FOR THEIR COLLABORATION. CLAUDIA BLUMENSTEIN ASSISTED WITH FIELD WORK, SABINE OERTLI ASSISTED WITH WILD BEE IDENTIFICATION, EVA KNOP PROVIDED STATISTICAL ADVICE, AND WOLFGANG NENTWIG PROVIDED USEFUL COMMENTS ON THE MANUSCRIPT. FUNDING WAS PROVIDED BY THE FEDERAL OFFICES FOR AGRICULTURE AND ENVIRONMENT, AND THE SWISS NATIONAL SCIENCE FOUNDATION (GRANT NUMBERS: 31003A\_125398 AND 31003A\_149656 TO R. ARLETTAZ), AND THE CANTONAL OFFICES OF ENVIRONMENT AND/OR AGRICULTURE OF BERN, VAUD, BASEL-LANDSCHAFT, AARGAU, NEUCHATEL, FRIBOURG, VALAIS AND GRAUBUNDEN.",0167-8809,NA,376-384,ELSEVIER,239,2017,ISI000397550100039,67,"AGRICULTURE, ENVIRONMENTAL SCIENCES \& ECOLOGY",99,"AGRICULTURE, MULTIDISCIPLINARY, ECOLOGY, ENVIRONMENTAL SCIENCES",MYLES.MENZIEE.UNIBE.CH,EP7HY,"MENZ, MHM (REPRINT AUTHOR), UNIV BERN, INST ECOL \& EVOLUT, DIV COMMUNITY ECOL, BALTZERSTR 6, CH-3012 BERN, SWITZERLAND",ISI,none,UNIV BERN;UNIV BERN;SWISS ORNITHOL INST;UNIV WESTERN AUSTRALIA,UNIV BERN,NA,"MEYER S, 2017, AGRIC ECOSYST ENVIRON","MEYER S, 2017, AGRIC ECOSYST ENVIRON",NA,NA,NA,NA
NAVARRO-PEREZ ML;LOPEZ J;RODRIGUEZ-RIANO T;BACCHETTA G;DE MIGUEL GORDILLO C;ORTEGA-OLIVENCIA A,NAVARRO-PEREZ ML,"CONFIRMED MIXED BIRD-INSECT POLLINATION SYSTEM OF SCROPHULARIA TRIFOLIATA L., A TYRRHENIAN SPECIES WITH COROLLA SPOTS",PLANT BIOLOGY,PLANT BIOL.,"BOTH BIRD AND MIXED VERTEBRATE-INSECT (MVI) POLLINATION SYSTEMS ARE VERY RARE IN EUROPE AND THE MEDITERRANEAN REGION. BECAUSE MVI CAN ENSURE REPRODUCTION OVER A WIDER RANGE OF ENVIRONMENTAL CONDITIONS THAN WHEN INSECTS ARE THE SOLE POLLINATORS, UNDER CERTAIN CIRCUMSTANCES SUCH SYSTEMS ARE HIGHLY ADVANTAGEOUS TO PLANTS. HERE, WE INVESTIGATED THE POLLINATION AND SOME REPRODUCTIVE TRAITS OF THE TYRRHENIAN SCROPHULARIA TRIFOLIATA, THE ONLY SPECIES OF THE GENUS POSSESSING TWO SHOWY DARK SPOTS INSIDE THE COROLLA, FOR WHICH MVI POLLINATION SYSTEM HAD BEEN INFERRED ON THE BASIS OF LIMITED CENSUSES. WE CONDUCTED FIELD EXPERIMENTS TO STUDY MVI POLLINATION AND SOME REPRODUCTIVE TRAITS AND ELUCIDATE THE ROLE OF COROLLA SPOTS, ANALYSING THEIR ULTRAVIOLET PATTERN, HISTOLOGY AND PIGMENTS VERSUS THE REST OF THE COROLLA. THE PRIMARY POLLINATORS WERE WASPS AND PASSERINE BIRDS. COROLLA SPOTS ABSORB UV LIGHT, PRESENT ABUNDANT ANTHOCYANINS AND ARE HISTOLOGICALLY IDENTICAL TO THE REST OF THE COROLLA. CONTROL FLOWERS HAD HIGHER VISITATION FREQUENCY THAN FLOWERS WITHOUT SPOTS. S.TRIFOLIATA IS SELF-COMPATIBLE, WITH EFFICIENT INTRAFLORAL PROTOGYNY AND HERKOGAMY THAT PREVENT SELF-POLLINATION BUT NOT GEITONOGAMY. WE CONFIRMED THE EXISTENCE OF A MIXED BIRD-INSECT POLLINATION SYSTEM IN S.TRIFOLIATA. THIS SYSTEM IS FOUND IN THREE OTHER SCROPHULARIA SPECIES WITH LARGE, SHOWY FLOWERS - TWO MEDITERRANEAN (S.GRANDIFLORA AND S.SAMBUCIFOLIA) AND ONE MACARONESIAN (S.CALLIANTHA). UNLIKE THOSE SPECIES, S.TRIFOLIATA HAS TWO LARGE SPOTS INSIDE THE COROLLA. THESE LIKELY OPERATE AS NECTAR GUIDES AND THEIR DARK COLOURATION IS RELATED TO ABUNDANT ANTHOCYANIN CONTENT.",BIRDS; COROLLA PIGMENTS; ISLAND PLANTS; NECTAR GUIDES; PROTOGYNY; VERTICAL INFLORESCENCES; WASPS,FRITILLARIA-IMPERIALIS; CROWN IMPERIAL; BEHAVIOR; NECTAR; HUMMINGBIRDS; FLOWER; PLANT; BEES; EVOLUTION; TITS,ENGLISH,ARTICLE,ARTICLE,1,"ORTEGA-OLIVENCIA, A (REPRINT AUTHOR), UNIV EXTREMADURA, AREA BOTAN, FAC CIENCIAS, AVDA. ELVAS S-N, BADAJOZ 06006, SPAIN.;NAVARRO-PEREZ, M. L., LOPEZ, J., RODRIGUEZ-RIANO, T., ORTEGA-OLIVENCIA, A., UNIV EXTREMADURA, AREA BOTAN, FAC CIENCIAS, AVDA. ELVAS S-N, BADAJOZ 06006, SPAIN.;BACCHETTA, G., UNIV CAGLIARI, DIPARTIMENTO SCI VITAE AMBIENTE, CCB, CAGLIARI, ITALY.;DE MIGUEL GORDILLO, C., UNIV EXTREMADURA, AREA EDAFOL \& QUIM AGR, ESCUELA INGN AGRARIAS, BADAJOZ, SPAIN.",10.1111/PLB.12548,"111 RIVER ST, HOBOKEN 07030-5774, NJ USA",NA,"SPANISH MINISTRY OF SCIENCE AND INNOVATION - EUROPEAN REGIONAL DEVELOPMENT FUND [CGL2008-00123/BOS, CGL2011-24140]; ECONOMY AND INFRASTRUCTURE COUNCIL OF EXTREMADURA [GR15062]; SPANISH MINISTRY OF SCIENCE AND INNOVATIONSPANISH GOVERNMENT [BES-2009-011957, EEBB-I-13-06058]","THIS RESEARCH WAS SUPPORTED BY THE SPANISH MINISTRY OF SCIENCE AND INNOVATION THROUGH PROJECTS CGL2008-00123/BOS AND CGL2011-24140 CO-FINANCED BY THE EUROPEAN REGIONAL DEVELOPMENT FUND. FUNDING WAS ALSO PROVIDED IN PART BY THE ECONOMY AND INFRASTRUCTURE COUNCIL OF EXTREMADURA (GR15062). AN FPI FELLOWSHIP (BES-2009-011957) AND A SHORT STAY AT THE UNIVERSITA DEGLI STUDI DI CAGLIARI (SARDINIA, ITALY) (EEBB-I-13-06058) TO MLN-P BY THE SPANISH MINISTRY OF SCIENCE AND INNOVATION ARE GREATLY APPRECIATED. SPECIAL THANKS TO C. DESSI AND C. COSSU FOR PROVIDING INFORMATION ABOUT LACONI POPULATIONS AND OBTAINING PERMISSION FOR FIELDWORK TO BE CONDUCTED AT THAT SITE, J.P. CARRASCO FOR ADVISING AND HELPING WITH UV PHOTOGRAPHY AND THE ANONYMOUS REVIEWERS FOR THEIR SUGGESTIONS AND COMMENTS. THE ENGLISH TEXT WAS EDITED AND IMPROVED BY B. GOODSON (EDANZ EDITING).",1435-8603,3,460-468,WILEY,19,2017,ISI000398738700018,49,PLANT SCIENCES,32,PLANT SCIENCES,AORTEGAUNEX.ES,ER3ZL,"ORTEGA-OLIVENCIA, A (REPRINT AUTHOR), UNIV EXTREMADURA, AREA BOTAN, FAC CIENCIAS, AVDA",ISI,none,UNIV EXTREMADURA;UNIV CAGLIARI;UNIV EXTREMADURA,UNIV EXTREMADURA,NA,"NAVARRO-PEREZ ML, 2017, PLANT BIOL","NAVARRO-PEREZ ML, 2017, PLANT BIOL",NA,NA,NA,NA
CABALLERO-VILLALOBOS L;SILVA-ARIAS GA;BUZATTO CR;NERVO MH;SINGER RB,CABALLERO-VILLALOBOS L,GENERALIZED FOOD-DECEPTIVE POLLINATION IN FOUR CATTLEYA (ORCHIDACEAE: LAELIINAE) SPECIES FROM SOUTHERN BRAZIL,FLORA,FLORA,"WE STUDIED THE BREEDING SYSTEM AND POLLINATION BIOLOGY OF CATTLEYA COCCINEA, C. INTERMEDIA, C. PURPURATA AND C. TIGRINA IN NATIVE POPULATIONS FROM RIO GRANDE DO SUL, SOUTHERN BRAZIL. AT THE STATE LEVEL, THE THREE LATTER SPECIES ARE CONSIDERED UNDER RISK OF EXTINCTION AND THIS WORK IS INTENDED TO BE A CONTRIBUTION TOWARDS THEIR CONSERVATION AND MANAGEMENT. TO DATE, THEIR POLLINATION NEEDS AND BREEDING SYSTEM REMAIN UNKNOWN. BREEDING SYSTEM WAS ELUCIDATED THROUGH CONTROLLED POLLINATIONS APPLIED TO ISOLATED PLANTS. POLLINATION WAS STUDIED IN THE FIELD, BY MEANS OF PHOTOGRAPHIC AND FILMIC RECORDS. CATTLEYA PURPURATA, C. INTERMEDIA AND C. TIGRINA ARE POLLINATED BY LARGE NATIVE APIDAE BEES OF THE GENERA BOMBUS, XYLOCOPA AND EPICHARIS THAT BEAR THE POLLINARIA ON THE SCUTELLUM AND MESONOTUM. IN SPITE OF THEIR DIFFERENCES IN COLOUR AND PERIANTH SIZE, BEE-POLLINATED SPECIES SHARE A NUMBER OF FLOWER FEATURES WHICH ARE ABSENT IN C. COCCINEA. THE LATTER SPECIES IS POLLINATED BY THE HUMMINGBIRD CHLOROSTILBON LUCIDUS (TROCHILIDAE). IN AGREEMENT, FLOWERS OF C. COCCINEA PRESENT A SET OF FLOWER FEATURES NORMALLY ASSOCIATED TO ORNITHOPHILY. ALL STUDIED SPECIES LACK REWARDS AND DECEIVE THEIR FOOD-SEEKING POLLINATORS. ALL SPECIES ARE SELF-COMPATIBLE BUT POLLINATOR DEPENDENT. FRUITING SUCCESS FOLLOWING MANUAL SELF-POLLINATION AND CROSS-POLLINATION DID NOT DIFFER, EXCEPT IN C. COCCINEA. HOWEVER, IN ALL SPECIES FRUIT FROM CROSS-POLLINATIONS YIELDED SIGNIFICANTLY HIGHER NUMBERS OF VIABLE SEED. ALL STUDIED SPECIES DISPLAYED LOW VISITATION RATES, LOW NATURAL FRUIT SET (RANGING FROM 0.5 TO 14\%) AND NILSSON'S MALE EFFICIENCY FACTOR OF LESS THAN ONE, INDICATING THAT LESS THAN ONE FLOWER WAS POLLINATED PER POLLINARIUM REMOVED. ALL THESE FEATURES ARE CONSISTENT WITH THOSE OF OTHER ORCHID GROUPS POLLINATED THROUGH GENERALIZED FOOD-DECEPTION. (C) 2017 ELSEVIER GMBH. ALL RIGHTS RESERVED.",ATLANTIC RAIN FOREST; BOMBUS; CHLOROSTILBON; HUMMINGBIRDS; NON-REWARDING ORCHIDS; XYLOCOPA,REPRODUCTIVE-BIOLOGY; BEE POLLINATION; FRUIT-SET; MECHANISMS; EPIDENDROIDEAE; EVOLUTION; PATTERN; MIMICRY; REWARD; SEEDS,ENGLISH,ARTICLE,ARTICLE,6,"SINGER, RB (REPRINT AUTHOR), UNIV FED RIO GRANDE DO SUL, PROGRAMA POSGRAD BOT, DEPT BOT, PORTO ALEGRE, RS, BRAZIL.;CABALLERO-VILLALOBOS, LINA, UNIV FED RIO GRANDE DO SUL, PROGRAMA POSGRAD GENET \& BIOL MOL, PORTO ALEGRE, RS, BRAZIL.;SILVA-ARIAS, GUSTAVO A., TECH UNIV MUNICH, CTR LIFE \& FOOD SCI, SECT POPULAT GENET, FREISING WEIHENSTEPHAN, GERMANY.;BUZATTO, CRISTIANO ROBERTO, UNIV PASSO FUNDO, PROGRAMA POSGRAD CIENCIAS AMBIENTAIS, INST CIENCIAS BIOL, PASSO FUNDO, RS, BRAZIL.;NERVO, MICHELLE HELENA, SINGER, RODRIGO B., UNIV FED RIO GRANDE DO SUL, PROGRAMA POSGRAD BOT, DEPT BOT, PORTO ALEGRE, RS, BRAZIL.",10.1016/J.FLORA.2017.07.014,"HACKERBRUCKE 6, 80335 MUNICH, GERMANY",NA,CAPES GRANT; SISBIO [40448-2],"THIS CONTRIBUTION IS PART OF FIRST AUTHOR'S M.SC. DISSERTATION AT PPGBOT-UFRGS, UNDER THE SUPERVISION OF RBS AND MADE POSSIBLE THROUGH A CAPES GRANT AND TO A FACILITY BY THE OEA-GCUB BRAZIL PROGRAM THAT ARE GREATLY ACKNOWLEDGED. SISBIO IS THANKED FOR COLLECTING PERMITS (NUMBER 40448-2) AND LOGISTIC SUPPORT. TANGELA PERLEBERG (EMBRAPA) IS THANKED FOR VALUABLE HELP DURING FIELDWORK. DR. FELIPE VIVALLO (MUSEU NACIONAL/UFRJ) AND DR. VICTOR H. GONZALEZ BETANCOURT (UNIVERSITY OF KANSAS, LAWRENCE, KS) ARE THANKED FOR INSECT IDENTIFICATION. THE COMMENTS AND SUGGESTIONS OF PROF. DR. EDUARDO BORBA LEITE (UFMG, MINAS GERAIS, BRAZIL) AND DR. AMOTS DAFNI (HAIFA UNIVERSITY) GREATLY IMPROVED THE EARLIER VERSION OF THIS TEXT AND ARE GRATEFULLY ACKNOWLEDGED. DR. LORETA BRANDAO DE FREITAS (UFRGS) AND DANIELE MUNARETO ARE THANKED FOR THE LOAN OF CAMCORDERS AND LOGISTIC SUPPORT. KEVIN DAVIES (CARDIFF UNIV., UK) IS THANKED FOR ENGLISH IMPROVEMENT.",0367-2530,NA,195-206,ELSEVIER GMBH,234,2017,ISI000416738300021,54,"PLANT SCIENCES, ENVIRONMENTAL SCIENCES \& ECOLOGY",12,"PLANT SCIENCES, ECOLOGY",LINA.CABALLEROVGMAIL.COM GUSTAVO.SILVATUM.DE CRBUZATTOGMAIL.COM MHNERVOGMAIL.COM RBSINGER1YAHOO.COM,FO3NO,"SINGER, RB (REPRINT AUTHOR), UNIV FED RIO GRANDE DO SUL, PROGRAMA POSGRAD BOT, DEPT BOT, PORTO ALEGRE, RS, BRAZIL",ISI,none,UNIV FED RIO GRANDE DO SUL;TECH UNIV MUNICH;UNIV PASSO FUNDO;UNIV FED RIO GRANDE DO SUL,UNIV FED RIO GRANDE DO SUL,NA,"CABALLERO-VILLALOBOS L, 2017, FLORA","CABALLERO-VILLALOBOS L, 2017, FLORA",NA,NA,NA,NA
