AU,first_author,TI,SO,JI,AB,DE,ID,LA,DT,DT2,TC,C1,DI,PA,AR,FU,FX,SN,PN,PP,PU,VL,PY,UT,NR,SC,U2,WC,EM,GA,RP,DB,CR,AU_UN,AU1_UN,AU_UN_NR,SR_FULL,SR,SE,BO,BE,BN
VARIS AL;BRAX R,VARIS AL,EFFECT OF BEE POLLINATION ON YIELD AND YIELD COMPONENTS OF FIELD BEAN (VICIA-FABA L),JOURNAL OF AGRICULTURAL SCIENCE IN FINLAND,JOURNAL OF AGRICULTURAL SCIENCE IN FINLAND,NA,NA,NA,ENGLISH,ARTICLE,ARTICLE,5,"VARIS, AL (REPRINT AUTHOR), UNIV HELSINKI,DEPT AGR \& FOREST ZOOL,SF-00710 HELSINKI,FINLAND.",NA,"HELSINGIN YLIOPISTON MAATALOUS KIRJASTO BIIKKI, SF-00710 HELSINKI 71, FINLAND",NA,NA,NA,0782-4386,1,45-49,SUOMEN MAATALOUSTIETEELLINEN,62,1990,ISIA1990DL84800006,0,AGRICULTURE,5,"AGRICULTURE, DAIRY \& ANIMAL SCIENCE, AGRONOMY",NA,DL848,"VARIS, AL (REPRINT AUTHOR), UNIV HELSINKI,DEPT AGR \& FOREST ZOOL,SF-00710 HELSINKI,FINLAND",ISI,none,NA,UNIV HELSINKI,NA,"VARIS AL, 1990, JOURNAL OF AGRICULTURAL SCIENCE IN FINLAND","VARIS AL, 1990, JOURNAL OF AGRICULTURAL SCIENCE IN FINLAND",NA,NA,NA,NA
GERLACH G;SCHILL R,GERLACH G,COMPOSITION OF ORCHID SCENTS ATTRACTING EUGLOSSINE BEES,BOTANICA ACTA,BOT. ACTA,"FRAGRANCE COMPOSITION OF FLOWERS FROM 101 PLANT SPECIES, ESPECIALLY ORCHIDS, WERE ANALYZED. SEVERAL COMPOUNDS, INCLUDING ALLO-AROMADENDRENE, BETA-BOURBONENE, ALPHA-COPAENE, ALPHA-CUBEBENE, 1,2-DIMETHOXYBENZENE, 1,3,5-TRIMETHOXYBENZENE, EPOXYGERANYL ACETATE, 7,11-EPOXYMEGASTIGMA-5(6)-EN-9-ONE, TWO GAMMA-LACTONES, GERMACRADIENOL, GERMACRENE D, HUMULENE, METHOXYPHENYL-ETHYL ACETATE, MYRCENE EPOXIDE, SABINENE, STYRENE, AND UNDECATRIENE WERE DETECTED FOR THE FIRST TIME IN ORCHIDS. FRAGRANCE COMPOSITION OF FLOWERS POLLINATED BY MALE EUGLOSSINE BEE SPECIES (PERFUME FLOWERS) OF FOUR PLANT FAMILIES ARE COMPARED AND CONTRASTED WITH THOSE OF ORCHID SPECIES WITH OTHER POLLINATION SYSTEMS. MELITTOPHILOUS, BUT HIGHLY SPECIALIZED ORCHIDS, PRODUCE FRAGRANCES RICH IN DIFFERENT SESQUITERPENES AND OTHER RARE COMPOUNDS. IN THE SPECIES THAT ARE EXCLUSIVELY POLLINATED BY FRAGRANCE-COLLECTING MALE EUGLOSSINE BEES, THE FRAGRANCES ARE PRIMARY ATTRACTANTS THAT SERVE BOTH AS AN ATTRACTANT AND AS A REWARD. THE UNUSUALLY INTENSELY SMELLING FLOWERS MOSTLY PRODUCE ESTERS AND MONOTERPENES. THE FRAGRANCES OF EUGLOSSOPHILOUS FLOWERS OF THE THREE PLANT FAMILIES INVESTIGATED ARE COMPOSED OF NEARLY THE SAME SETS OF CHEMICAL COMPOUNDS, SUGGESTING CONVERGENT EVOLUTION. TYPICALLY, EUGLOSSOPHILOUS PLANT SPECIES PRODUCE LARGE AMOUNTS OF FEW FRAGRANT SUBSTANCES WHILE MELITTOPHILOUS SPECIES OFTEN PRODUCE RARE COMPOUNDS IN SMALL AMOUNTS.",NEOTROPICS; FRAGRANCE PATTERNS; POLLINATION SYSTEMS; EUGLOSSOPHILY; ORCHIDACEAE; ARACEAE; GESNERIACEAE; BROMELIACEAE,POLLINATION; EVOLUTION; BIOLOGY; ARACEAE; APIDAE; PLANTS,ENGLISH,ARTICLE,ARTICLE,64,"GERLACH, G (REPRINT AUTHOR), UNIV HEIDELBERG,INST SYSTEMAT BOT \& PFLANZENGEOG,NEUENHEIMER FELD 345,W-6900 HEIDELBERG 1,GERMANY.",10.1111/J.1438-8677.1991.TB00245.X,"P O BOX 30 11 20, D-70451 STUTTGART, GERMANY",NA,NA,NA,0932-8629,5,379-391,GEORG THIEME VERLAG,104,1991,ISIA1991GW24100006,35,PLANT SCIENCES,28,PLANT SCIENCES,NA,GW241,"GERLACH, G (REPRINT AUTHOR), UNIV HEIDELBERG,INST SYSTEMAT BOT \& PFLANZENGEOG,NEUENHEIMER FELD 345,W-6900 HEIDELBERG 1,GERMANY",ISI,none,NA,UNIV HEIDELBERG,NA,"GERLACH G, 1991, BOT ACTA","GERLACH G, 1991, BOT ACTA",NA,NA,NA,NA
WEBSTER GL;ARMBRUSTER WS,WEBSTER GL,A SYNOPSIS OF THE NEOTROPICAL SPECIES OF DALECHAMPIA (EUPHORBIACEAE),BOTANICAL JOURNAL OF THE LINNEAN SOCIETY,BOT. J. LINNEAN SOC.,NA,PHYLOGENETIC RELATIONSHIP; TERMINOLOGY; INFRAGENERIC CLASSIFICATION,SCANDENS EUPHORBIACEAE; EUGLOSSINE BEES; POLLINATION; MORPHOLOGY; EVOLUTION; PATTERNS,ENGLISH,ARTICLE,ARTICLE,31,"WEBSTER, GL (REPRINT AUTHOR), UNIV CALIF DAVIS, DEPT BOT, DAVIS, CA 95616 USA.;UNIV ALASKA, INST ARCTIC BIOL, FAIRBANKS, AK 99701 USA.;UNIV ALASKA, DEPT BIOL \& WILDLIFE, FAIRBANKS, AK 99701 USA.",10.1111/J.1095-8339.1991.TB00202.X,"COMMERCE PLACE, 350 MAIN ST, MALDEN 02148, MA USA",NA,NA,NA,0024-4074,2,137-177,WILEY-BLACKWELL,105,1991,ISIA1991FD30900002,39,PLANT SCIENCES,7,PLANT SCIENCES,NA,FD309,"WEBSTER, GL (REPRINT AUTHOR), UNIV CALIF DAVIS, DEPT BOT, DAVIS, CA 95616 USA",ISI,none,UNIV ALASKA;UNIV ALASKA,UNIV CALIF DAVIS,NA,"WEBSTER GL, 1991, BOT J LINNEAN SOC","WEBSTER GL, 1991, BOT J LINNEAN SOC",NA,NA,NA,NA
SEDGLEY M;HARBARD J;SMITH RMM;WICKNESWARI R;GRIFFIN AR,SEDGLEY M,"REPRODUCTIVE-BIOLOGY AND INTERSPECIFIC HYBRIDIZATION OF ACACIA-MANGIUM AND ACACIA-AURICULIFORMIS CUNN,A EX BENTH (LEGUMINOSAE, MIMOSOIDEAE)",AUSTRALIAN JOURNAL OF BOTANY,AUST. J. BOT.,"ACACIA MANGIUM AND A. AURICULIFORMIS FLOWERED BETWEEN FEBRUARY AND MAY, PRODUCING MATURE PODS BETWEEN OCTOBER AND APRIL. THE FLOWERS OF BOTH SPECIES WERE SIMILAR IN STRUCTURE AND SHOWED WEAK PROTOGYNY AND VARIABLE LEVELS OF ANDROMONOECY. MALE FLOWERS EITHER LACKED PISTILS COMPLETELY OR HAD SMALL STERILE PISTILS. CONTROLLED HAND POLLINATION RESULTED IN POLLEN TUBES IN THE PISTIL AND PENETRATION OF THE OVULES FOLLOWING SELF AND CROSS INTRASPECIFIC AND INTERSPECIFIC POLLINATION. THE CROSS A. AURICULIFORMIS X A. MANGIUM WAS MORE SUCCESSFUL THAN THE RECIPROCAL, BUT FERTILE SEED WAS PRODUCED FOLLOWING INTERSPECIFIC POLLINATION IN BOTH DIRECTIONS AND ALL SEEDLINGS WERE SHOWN TO BE HYBRID BY ISOZYME ANALYSIS OF PARENTS AND SEEDLINGS. THERE WERE RELATIVELY FEW INSECT VISITORS TO THE FLOWERING BRANCHES, BUT THE SAME SUITE OF INSECTS WAS OBSERVED FORAGING FOR POLLEN ON BOTH SPECIES. NATIVE BEES BELONGING TO THE HALICTIDAE CARRIED MOST POLYADS ON THEIR HAIRY BODIES AND MAY ACT AS POLLINATING AGENTS. THERE APPEARED TO BE NO MAJOR FERTILITY BARRIERS TO INTERSPECIFIC HYBRIDISATION BETWEEN ACACIA MANGIUM AND A. AURICULIFORMIS, AND HYBRIDS COULD OCCUR SPONTANEOUSLY VIA SYNCHRONOUS FLOWERING AND COMMON INSECT VISITORS.",NA,SELF-INCOMPATIBILITY; GENETIC DIVERSITY; RETINODES; AUSTRALIA; TREE,ENGLISH,ARTICLE,ARTICLE,60,"SEDGLEY, M (REPRINT AUTHOR), UNIV ADELAIDE,WAITE AGR RES INST,DEPT HORT VITICULTURE \& OENOL,GLEN OSMOND,SA 5064,AUSTRALIA.;FOREST RES INST MALAYSIA,52109 KUALA LUMPUR,MALAYSIA.;CSIRO,DIV FORESTRY,QUEEN VICTORIA TER,ACT 2601,AUSTRALIA.",10.1071/BT9920037,"150 OXFORD ST, PO BOX 1139, COLLINGWOOD VICTORIA 3066, AUSTRALIA",NA,NA,NA,0067-1924,1,37-48,C S I R O PUBLICATIONS,40,1992,ISIA1992JE30000004,32,PLANT SCIENCES,12,PLANT SCIENCES,NA,JE300,"SEDGLEY, M (REPRINT AUTHOR), UNIV ADELAIDE,WAITE AGR RES INST,DEPT HORT VITICULTURE \& OENOL,GLEN OSMOND,SA 5064,AUSTRALIA",ISI,none,FOREST RES INST MALAYSIA;DIV FORESTRY,UNIV ADELAIDE,NA,"SEDGLEY M, 1992, AUST J BOT","SEDGLEY M, 1992, AUST J BOT",NA,NA,NA,NA
JOHNSTON MO,JOHNSTON MO,EFFECTS OF CROSS AND SELF-FERTILIZATION ON PROGENY FITNESS IN LOBELIA-CARDINALIS AND L-SIPHILITICA,EVOLUTION,EVOLUTION,"INBREEDING DEPRESSION, OR THE DECREASED FITNESS OF PROGENY DERIVED FROM SELF-FERTILIZATION AS COMPARED TO OUTCROSSING, IS THOUGHT TO BE THE MOST GENERAL FACTOR AFFECTING THE EVOLUTION OF SELF-FERTILIZATION IN PLANTS. NEVERTHELESS, DATA ON INBREEDING DEPRESSION IN FITNESS CHARACTERS ARE ALMOST NONEXISTENT FOR PERENNIALS OBSERVED IN THEIR NATURAL ENVIRONMENTS. IN THIS STUDY I MEASURED INBREEDING DEPRESSION IN BOTH SURVIVAL AND FERTILITY IN TWO SYMPATRIC, SHORT-LIVED, PERENNIAL HERBS: HUMMINGBIRD-POLLINATED LOBELIA CARDINALIS (TWO POPULATIONS) AND BUMBLEBEE-POLLINATED L. SIPHILITICA (ONE POPULATION). CROSSES WERE PERFORMED BY HAND IN THE FIELD, AND SEEDLINGS GERMINATED IN THE GREENHOUSE. LEVELS OF INBREEDING DEPRESSION WERE DETERMINED FOR ONE YEAR IN THE GREENHOUSE AND FOR TWO TO THREE YEARS FOR SEEDLINGS TRANSPLANTED BACK TO THE NATURAL ENVIRONMENT. FERTILITY WAS MEASURED AS FLOWER NUMBER, WHICH IS HIGHLY CORRELATED WITH SEED PRODUCTION UNDER NATURAL CONDITIONS IN THESE POPULATIONS. INBREEDING DEPRESSION WAS ASSESSED IN THREE WAYS: 1) SURVIVAL AND FERTILITY WITHIN THE DIFFERENT AGE INTERVALS, 2) CUMULATIVE SURVIVAL FROM THE SEED STAGE THROUGH EACH AGE INTERVAL, AND 3) NET FERTILITY, OR THE EXPECTED FERTILITY OF A SEED AT DIFFERENT AGES. NET FERTILITY IS A COMPREHENSIVE MEASURE OF FITNESS COMBINING SURVIVAL AND FLOWER NUMBER. IN ALL THREE POPULATIONS, SELFING HAD NONSIGNIFICANT EFFECTS ON THE NUMBER AND SIZE OF SEEDS. LOBELIA SIPHILITICA AND ONE POPULATION OF L. CARDINALIS EXHIBITED SIGNIFICANT LEVELS OF INBREEDING DEPRESSION BETWEEN SEED MATURATION AND GERMINATION, EXCLUDING THE CONSIDERATION OF POSSIBLE DIFFERENCES IN DORMANCY OR LONGTERM VIABILITY IN THE SOIL. THERE WAS NO INBREEDING DEPRESSION IN SUBSEQUENT SURVIVAL IN THE GREENHOUSE IN ANY POPULATION. IN THE FIELD, SIGNIFICANT SURVIVAL DIFFERENCES BETWEEN SELFED AND OUTCROSSED PROGENY OCCURRED ONLY IN TWO YEARS AND IN ONLY ONE POPULATION OF L. CARDINALIS. FOR BOTH SURVIVAL AND FERTILITY THERE WAS LITTLE EVIDENCE FOR THE EXPECTED DIFFERENCES AMONG FAMILIES IN INBREEDING DEPRESSION. COMPARED TO SURVIVAL, INBREEDING DEPRESSION IN FERTILITY (FLOWER NUMBER) TENDED TO BE MUCH HIGHER. BY FIRST-YEAR FLOWER PRODUCTION, THE COMBINED EFFECTS ON SURVIVAL AND FLOWER NUMBER CAUSED INBREEDING DEPRESSION IN NET FERTILITY TO REACH 54\%, 34\% AND 71\% FOR L. SIPHILITICA AND THE TWO POPULATIONS OF L. CARDINALIS. BY THE END OF THE SECOND YEAR OF FLOWERING IN THE FIELD, INBREEDING DEPRESSION IN NET FERTILITY WAS 53\% FOR L. SIPHILITICA AND 54\% FOR ONE POPULATION OF L. CARDINALIS. FOR THE OTHER POPULATION OF L. CARDINALIS, THESE VALUES WERE 76\% THROUGH THE SECOND YEAR OF FLOWERING AND 83\% THROUGH THE THIRD YEAR. SUCH HIGH LEVELS OF INBREEDING DEPRESSION SHOULD STRONGLY INFLUENCE SELECTION ON THOSE CHARACTERS AFFECTING SELF-FERTILIZATION RATES IN THESE TWO SPECIES.",BUMBLEBEE; FLOWER NUMBER; HUMMINGBIRD; INBREEDING DEPRESSION; LOBELIA-CARDINALIS; LOBELIA-SIPHILITICA; MICHIGAN; PERENNIAL; SEED SIZE; SELF FERTILIZATION; SURVIVAL,NA,ENGLISH,ARTICLE,ARTICLE,139,"UNIV CHICAGO, COMM EVOLUT BIOL, CHICAGO, IL 60637 USA.",10.2307/2409638,"111 RIVER ST, HOBOKEN 07030-5774, NJ USA",NA,NA,NA,0014-3820,3,688-702,WILEY,46,1992,ISIA1992JB06700010,93,"ENVIRONMENTAL SCIENCES \& ECOLOGY, EVOLUTIONARY BIOLOGY, GENETICS \& HEREDITY",27,"ECOLOGY, EVOLUTIONARY BIOLOGY, GENETICS \& HEREDITY",NA,JB067,"UNIV CHICAGO, COMM EVOLUT BIOL, CHICAGO, IL 60637 USA",ISI,none,UNIV CHICAGO,UNIV CHICAGO,NA,"JOHNSTON MO, 1992, EVOLUTION","JOHNSTON MO, 1992, EVOLUTION",NA,NA,NA,NA
FAY JM,FAY JM,ICACINA-OLIVIFORMIS (ICACINACEAE) - A CLOSE LOOK AT AN UNDEREXPLOITED FOOD PLANT .3. ECOLOGY AND PRODUCTION,ECONOMIC BOTANY,ECON. BOT.,"DATA ARE PRESENTED ON THE ECOLOGY AND PRODUCTION OF ICACINA OLIVIFORMIS (POIRET) RAYNAL IN NATURAL STANDS IN NORTHERN CENTRAL AFRICAN REPUBLIC. THE SPECIES GROWS ON A VARIETY OF SOILS AND IN NUMEROUS PLANT COMMUNITIES. IT IS FIRE ADAPTED, AND THRIVES WHEN BURNED IN THE EARLY DRY SEASON. THE PLANT IS PRIMARILY BEE POLLINATED AND HAS A NUMBER OF PESTS THAT INFEST THE STEMS AND YOUNG FRUITS. PLANT DENSITIES ARE HIGH, WITH A MAXIMUM OF CA. 5345 PLANTS/HA IN THE STUDY SITES. STANDING TUBEROUS ROOT BIOMASS CAN BE CONSIDERABLE, WITH A MAXIMUM OF CA. 19 904 KG/HA FOR THE STUDY SITES. SEED YIELD IN THE SAMPLE SITES WAS RELATIVELY LOW WITH A MAXIMUM OF CA. 214 KG/HA. WITH PROPER MANAGEMENT, YIELDS OF BOTH SEED AND TUBEROUS ROOTS COULD BE SUBSTANTIALLY INCREASED.",ICACINA-OLIVIFORMIS; UNDEREXPLOITED; FOOD; ECOLOGY; PRODUCTION; CENTRAL AFRICA,AFRICA,ENGLISH,ARTICLE,ARTICLE,2,"FAY, JM (REPRINT AUTHOR), WASHINGTON UNIV,BOX 299,ST LOUIS,MO 63166, USA.;MISSOURI BOT GARDEN,ST LOUIS,MO 63166.",10.1007/BF02862019,"PUBLICATIONS DEPT, BRONX, NY 10458",NA,NA,NA,0013-0001,2,163-170,NEW YORK BOTANICAL GARDEN,47,1993,ISIA1993LJ71900005,30,PLANT SCIENCES,5,PLANT SCIENCES,NA,LJ719,"FAY, JM (REPRINT AUTHOR), WASHINGTON UNIV,BOX 299,ST LOUIS,MO 63166, USA",ISI,none,NA,WASHINGTON UNIV,NA,"FAY JM, 1993, ECON BOT","FAY JM, 1993, ECON BOT",NA,NA,NA,NA
WINDUS JL;SNOW AA,WINDUS JL,FRUIT-SET AND SEED PREDATION IN AN OHIO POPULATION OF GENTIANA-SAPONARIA,AMERICAN MIDLAND NATURALIST,AM. MIDL. NAT.,"THE SOAPWORT GENTIAN GENTIANA SAPONARIA (GENTIANACEAE) OCCURS AT ONLY THREE SITES IN OHIO, INCLUDING A POPULATION AT THE LOUIS W. CAMPBELL STATE NATURE PRESERVE IN LUCAS COUNTY. SEED PRODUCTION AT THIS POPULATION WAS MONITORED DURING 5 GROWING SEASONS BETWEEN 1984 AND 1991. A BAGGING EXPERIMENT DEMONSTRATED THAT POLLINATORS WERE REQUIRED FOR EFFECTIVE POLLINATION. IN 1984-1985 AND 1990-1991, MORE THAN 90\% OF THE FLOWERS SET FRUIT, INDICATING THAT POLLINATOR VISITATION (PRIMARILY BY BUMBLEBEES) DID NOT LIMIT FRUIT SET. FRUIT SET WAS UNUSUALLY LOW IN 1988 (37\%), PERHAPS DUE TO EFFECTS OF DROUGHT STRESS ON THE PLANTS AND/OR THEIR POLLINATORS. LEVELS OF FRUIT DAMAGE FROM INSECT LARVAE RANGED FROM >90\% IN 1984-1985 TO A LOW OF 37\% IN 1990. SEED PREDATORS CONSUMED THE SMALL, WINGED SEEDS AND ALSO PREVENTED NORMAL FRUIT DEVELOPMENT. UNEATEN SEEDS WITHIN DAMAGED FRUITS OFTEN APPEARED MOLDY, AND DISPERSAL BY WIND WAS UNLIKELY. THESE RESULTS SUGGEST THAT SEED PREDATORS HAD A GREATER ROLE IN REGULATING SEED PRODUCTION THAN DID POLLINATORS, AND THAT THIS CAUSE OF MORTALITY COULD CONTRIBUTE TO A DECLINE IN THE ABUNDANCE OF G. SAPONARIA.",NA,LIMITATION; ECOLOGY,ENGLISH,ARTICLE,ARTICLE,12,"WINDUS, JL (REPRINT AUTHOR), OHIO DEPT NAT RESOURCES,DIV NAT AREAS \& PRESERVES,1889 FOUNTAIN SQ,COLUMBUS,OH 43224, USA.;OHIO STATE UNIV,DEPT PLANT BIOL,COLUMBUS,OH 43210.",10.2307/2426515,"UNIV NOTRE DAME, BOX 369, ROOM 295 GLSC, NOTRE DAME, IN 46556",NA,NA,NA,0003-0031,2,346-351,AMER MIDLAND NATURALIST,129,1993,ISIA1993LA69200015,27,"BIODIVERSITY \& CONSERVATION, ENVIRONMENTAL SCIENCES \& ECOLOGY",6,"BIODIVERSITY CONSERVATION, ECOLOGY",NA,LA692,"WINDUS, JL (REPRINT AUTHOR), OHIO DEPT NAT RESOURCES,DIV NAT AREAS \& PRESERVES,1889 FOUNTAIN SQ,COLUMBUS,OH 43224, USA",ISI,none,OHIO STATE UNIV,OHIO DEPT NAT RESOURCES,NA,"WINDUS JL, 1993, AM MIDL NAT","WINDUS JL, 1993, AM MIDL NAT",NA,NA,NA,NA
PETANIDOU T;VOKOU D,PETANIDOU T,POLLINATION ECOLOGY OF LABIATAE IN A PHRYGANIC (EAST MEDITERRANEAN) ECOSYSTEM,AMERICAN JOURNAL OF BOTANY,AM. J. BOT.,"THIS STUDY WAS CONDUCTED IN A PHRYGANIC (EAST MEDITERRANEAN) ECOSYSTEM AT DAPHNI, NEAR ATHENS, GREECE. THE LABIATAE, REPRESENTED BY TEN SPECIES BELONGING TO NINE GENERA, DOMINATE IN THIS ECOSYSTEM TYPE. THEY FLOWER FROM FEBRUARY TO JULY. BOTH FLOWERING TIME AND NECTAR QUANTITY ARE RELATED TO THE SPECIES ABILITY TO TOLERATE INTENSE WATER STRESS. LABIATAE ARE VISITED BY 201 INSECT SPECIES. OF THESE, 43 ARE EXCLUSIVELY SUPPORTED BY THE FAMILY AND 37 ARE MONOTROPOUS. SOLITARY BEES (MAINLY ANTHOPHORIDAE, MEGACHILIDAE, HALICTIDAE) CONSTITUTE 47.3\% OF POLLINATORS. THE FAMILY IS IMPORTANT IN HOSTING SPECIALIZED BEES (15 SPECIES) IN PHRYGANA, PARTICULARLY LATE IN THE FLOWERING SEASON. LABIATAE SPECIES FORM TWO EQUALLY REPRESENTED GROUPS IN THIS SYSTEM, NAMELY, THE LATE WINTER-EARLY SPRING (EARLY) FLOWERING, VISITED BY RELATIVELY FEW POLLINATOR SPECIES, AND THE LATE SPRING-SUMMER (LATE) FLOWERING SPECIES, VISITED BY NUMEROUS POLLINATORS. THIS TEMPORAL DISTINCTION IS ACCOMPANIED BY DIFFERENT POLLINATION PROFILES THAT INCLUDE DURATION OF ANTHESIS, REWARD TO POLLINATORS, FLORAL ATTRACTIVENESS, AND FLOWER CHARACTER DIFFERENTIATION. ALL OF THESE ATTRIBUTES ARE MAXIMIZED IN THE EARLY FLOWERING PERIOD. THIS STRATEGY SUGGESTS A MECHANISM FOR RESOURCE PARTITIONING AT A TIME WHEN THE POLLINATOR RESOURCE IS LIMITED AND COMPETITION FOR THE SERVICES OF POLLINATORS IS EXPECTED TO BE INTENSE. CONTRARY TO THE CURRENT THEORY CONCERNING CORNUCOPIAN SPECIES, THE COPIOUSLY REWARDING FLOWERS OF LABIATAE IN PHRYGANA ARE NOT THOSE ABUNDANTLY SERVICED BY POLLINATORS.",NA,BEES,ENGLISH,ARTICLE,ARTICLE,41,"ARISTOTELIAN UNIV SALONIKA,SCH BIOL,DEPT ECOL,UPB 119,GR-54006 SALONIKA,GREECE.",10.2307/2445509,"OHIO STATE UNIV-DEPT BOTANY 1735 NEIL AVE, COLUMBUS, OH 43210",NA,NA,NA,0002-9122,8,892-899,BOTANICAL SOC AMER INC,80,1993,ISIA1993LU94500006,29,PLANT SCIENCES,28,PLANT SCIENCES,NA,LU945,"ARISTOTELIAN UNIV SALONIKA,SCH BIOL,DEPT ECOL,UPB 119,GR-54006 SALONIKA,GREECE",ISI,none,ARISTOTELIAN UNIV SALONIKA,ARISTOTELIAN UNIV SALONIKA,NA,"PETANIDOU T, 1993, AM J BOT","PETANIDOU T, 1993, AM J BOT",NA,NA,NA,NA
GRANT V,GRANT V,MECHANICAL AND ETHOLOGICAL ISOLATION BETWEEN PEDICULARIS-GROENLANDICA AND P-ATTOLLENS (SCROPHULARIACEAE),BIOLOGISCHES ZENTRALBLATT,BIOL. ZENTR.BL.,"PEDICULARIS GROENLANDICA AND P. ATTOLENS ARE SYMPATRIC IN THE SIERRA NEVADA OF CALIFORNIA. THEY BLOOM AT THE SAME TIME AND ARE POLLINATED BY THE SAME SPECIES OF BUMBLEBEES, MAINLY WORKERS OF BOMBUS BIFARIUS AND B. FLAVIFRONS. NO NATURAL HYBRIDS BETWEEN THESE PEDICULARIS SPECIES ARE KNOWN. STRONG MECHANICAL AND ETHOLOGICAL ISOLATION OCCURS BETWEEN THE SPECIES. THE STIGMA OF THE FLOWERS IS POSITIONED DIFFERENTLY IN THE TWO SPECIES SO THAT IT MAKES CONTACT WITH AND PICKS UP POLLEN FROM DIFFERENT BODY PARTS OF THE BEES. THE FLOWERS OF THE TWO SPECIES ALSO DIFFER IN MARKINGS, SIZE AND SHAPE OF FLORAL PARTS, AND FLORAL SCENT. INDIVIDUAL BUMBLEBEES ARE GUIDED BY THESE VISUAL AND OLFACTORY CUES DURING FORAGING AND EXHIBIT STRONG FLOWER CONSTANCY TO ONE PEDICULARIS SPECIES OR THE OTHER, RESULTING IN STRONG ETHOLOGICAL ISOLATION. THE PEDICULARIS CASE AFFORDS ONE OF THE BEST EXAMPLES KNOWN OF STRONG ETHOLOGICAL ISOLATION IN PLANTS BASED ON FLOWER CONSTANCY BY WILD BEES.",PEDICULARIS-BOMBUS BUMBLEBEE POLLINATION; FLOWER CONSTANCY; FLORAL ISOLATION,POLLINATION ECOLOGY; FORAGING BUMBLEBEES,ENGLISH,ARTICLE,ARTICLE,20,"GRANT, V (REPRINT AUTHOR), UNIV TEXAS,DEPT BOT,AUSTIN,TX 78713, USA.",NA,"VILLENGANG 2, D-07745 JENA, GERMANY",NA,NA,NA,0006-3304,1,43-51,GUSTAV FISCHER VERLAG JENA,113,1994,ISIA1994ND71000005,38,LIFE SCIENCES \& BIOMEDICINE - OTHER TOPICS,13,BIOLOGY,NA,ND710,"GRANT, V (REPRINT AUTHOR), UNIV TEXAS,DEPT BOT,AUSTIN,TX 78713, USA",ISI,none,NA,UNIV TEXAS,NA,"GRANT V, 1994, BIOL ZENTR BL","GRANT V, 1994, BIOL ZENTR BL",NA,NA,NA,NA
MUENCHOW G;DELESALLE V,MUENCHOW G,POLLINATOR RESPONSE TO MALE FLORAL DISPLAY SIZE IN 2 SAGITTARIA (ALISMATACEAE) SPECIES,AMERICAN JOURNAL OF BOTANY,AM. J. BOT.,"ONE HYPOTHESIS FOR THE EVOLUTION OF MALENESS IN PLANTS POSTULATES THE FOLLOWING: MALE PLANTS APPEAR THAT HAVE RE-ALLOCATED RESOURCES FROM FEMALE PARTS INTO A LARGER NUMBER OF MALE HEWERS, CREATING A LARGER FLORAL DISPLAY. POLLINATORS RESPOND `'DRAMATICALLY'' TO THE INCREASED DISPLAY, DRIVING THE SPREAD OF MALES IN THE POPULATION (BAWA, K.S., 1980, ANNUAL REVIEW OF ECOLOGY AND SYSTEMATICS 11: 15-40). TO TEST THIS, WE MEASURED THE TOTAL NUMBER OF HEWERS AND THE SIZE OF MALE DISPLAYS IN DIOECIOUS SAGITTARIA LATIFOLIA AND MONOECIOUS S. AUSTRALIS. WE ALSO MEASURED HOW FAST VISITORS ARRIVED AT `'TARGET'' FLOWERS IN THE DISPLAYS. THEN WE USED THE COX MODEL, A FAILURE TIME ANALYSIS PROCEDURE, TO ANALYZE THE RELATIONSHIP BETWEEN VISITOR ARRIVAL AND DISPLAY SIZE. WE FOUND THAT MALE DISPLAY SIZES WERE SOMEWHAT LARGER IN THE DIOECIOUS THAN THE MONOECIOUS PLANTS, BUT THIS WAS DUE TO MORE COMPRESSED BLOOMING RATHER THAN TO A LARGER TOTAL NUMBER OF FLOWERS. THE VISITORS TO BATH PLANTS WERE SIMILAR ARRAYS OF GENERALIST BEES. VISITORS DID NOT SHOW THE PREDICTED `'DRAMATIC'' RESPONSE, HOWEVER, BUT RATHER A PLATEAUING RESPONSE TO LARGER DISPLAY SIZES, SO OUR RESULTS DO NOT SUPPORT THE HYPOTHESIS. REVIEWING THE LITERATURE, WE FOUND NO REPORTS OF THE `'DRAMATIC'' RESPONSE THE HYPOTHESIS ASSERTS. INSTEAD, RELATIVE INSENSITIVITY TO DISPLAY SIZE IS THE RULE.",NA,INFLORESCENCE SIZE; FRUIT PRODUCTION; EVOLUTION; PATTERNS; LIMITATIONS; ORCHIDACEAE; CONSTRAINTS; HYPOTHESIS; LATIFOLIA; DIOECY,ENGLISH,ARTICLE,ARTICLE,22,"MUENCHOW, G (REPRINT AUTHOR), FLORIDA STATE UNIV,DEPT BIOL SCI,B-157,TALLAHASSEE,FL 32306, USA.;EMORY UNIV,DEPT BIOL,ATLANTA,GA 30322.",10.2307/2445731,"OHIO STATE UNIV-DEPT BOTANY 1735 NEIL AVE, COLUMBUS, OH 43210",NA,NA,NA,0002-9122,5,568-573,BOTANICAL SOC AMER INC,81,1994,ISIA1994NM60100007,27,PLANT SCIENCES,8,PLANT SCIENCES,NA,NM601,"MUENCHOW, G (REPRINT AUTHOR), FLORIDA STATE UNIV,DEPT BIOL SCI,B-157,TALLAHASSEE,FL 32306, USA",ISI,none,EMORY UNIV,FLORIDA STATE UNIV,NA,"MUENCHOW G, 1994, AM J BOT","MUENCHOW G, 1994, AM J BOT",NA,NA,NA,NA
BRADSHAW HD;WILBERT SM;OTTO KG;SCHEMSKE DW,BRADSHAW HD,GENETIC-MAPPING OF FLORAL TRAITS ASSOCIATED WITH REPRODUCTIVE ISOLATION IN MONKEYFLOWERS (MIMULUS),NATURE,NATURE,"SPECIATION IS THE PROCESS WHEREBY POPULATIONS ACQUIRE SUFFICIENT GENETIC DIFFERENCES TO BECOME REPRODUCTIVELY ISOLATED(1). SINCE DARWIN IT HAS BEEN RECOGNIZED THAT THE TEMPO AND MODE OF SPECIATION ARE GREATLY INFLUENCED BY THE NUMBER AND MAGNITUDE OF GENETIC CHANGES REQUIRED FOR REPRODUCTIVE ISOLATION(2-6), BUT DETAILED GENETIC STUDIES HAVE BEEN LIMITED TO A FEW TAXA SUCH AS DROSOPHILA(7). GENOME MAPPING TECHNIQUES NOW WIDELY ADOPTED IN PLANT(8,9) AND ANIMAL(10,11) BREEDING MAKE IT POSSIBLE TO INVESTIGATE THE GENETIC BASIS OF REPRODUCTIVE ISOLATING MECHANISMS IN NATURAL POPULATIONS. HERE WE USE THIS APPROACH TO MAP EIGHT FLORAL TRAITS IN TWO SYMPATRIC MONKEYFLOWER SPECIES THAT ARE REPRODUCTIVELY ISOLATED OWING TO POLLINATOR PREFERENCE BY BUMBLEBEES OR HUMMINGBIRDS. FOR EACH TRAIT WE FOUND AT LEAST ONE QUANTITATIVE TRAIT LOCUS ACCOUNTING FOR MORE THAN 25\% OF THE PHENOTYPIC VARIANCE. THIS SUGGESTS THAT GENES OF LARGE EFFECT CAN CONTRIBUTE TO SPECIATION.",NA,FRAGMENT LENGTH POLYMORPHISMS; QUANTITATIVE TRAITS; MENDELIAN FACTORS; SPECIATION; MARKERS,ENGLISH,ARTICLE,ARTICLE,297,"BRADSHAW, HD (REPRINT AUTHOR), UNIV WASHINGTON,CTR URBAN HORT,BOX 354115,SEATTLE,WA 98195, USA.;UNIV WASHINGTON,DEPT BIOCHEM,SEATTLE,WA 98195.;UNIV WASHINGTON,DEPT BOT,SEATTLE,WA 98195.",10.1038/376762A0,"4 LITTLE ESSEX STREET, LONDON, ENGLAND WC2R 3LF",NA,NA,NA,0028-0836,6543,762-765,MACMILLAN MAGAZINES LTD,376,1995,ISIA1995RR83600036,26,SCIENCE \& TECHNOLOGY - OTHER TOPICS,73,MULTIDISCIPLINARY SCIENCES,NA,RR836,"BRADSHAW, HD (REPRINT AUTHOR), UNIV WASHINGTON,CTR URBAN HORT,BOX 354115,SEATTLE,WA 98195, USA",ISI,none,UNIV WASHINGTON;UNIV WASHINGTON,UNIV WASHINGTON,NA,"BRADSHAW HD, 1995, NATURE","BRADSHAW HD, 1995, NATURE",NA,NA,NA,NA
RATSIRARSON J,RATSIRARSON J,"POLLINATION ECOLOGY OF ALOE-DIVARICATA, BERGER (LILIACEAE) - AN ENDEMIC PLANT-SPECIES OF SOUTH-WEST MADAGASCAR",SOUTH AFRICAN JOURNAL OF BOTANY-SUID-AFRIKAANSE TYDSKRIF VIR PLANTKUNDE,SOUTH AFR. J. BOT.-SUID-AFR. TYDSKR. PLANTKUNDE,"THE REPRODUCTIVE BIOLOGY AND POLLINATION ECOLOGY OF AN ENDEMIC PLANT SPECIES (ALOE DIVARICATA) OF MADAGASCAR WAS STUDIED IN ORDER TO UNDERSTAND THE RELATIVE SIGNIFICANCE OF VARIOUS FLOWER VISITORS TO FRUIT SET SUCCESS. THE FLOWERS WERE HERMAPHRODITE AND PROTANDROUS, AND WERE PRIMARILY VISITED BY SOUIMANGA SUNBIRDS (NECTARINIA SOUIMANGA) AND STINGLESS BEES (TRIGONA SP.). FLOWER DEVELOPMENT AND PHENOLOGY WERE EXAMINED. FRUIT SET SUCCESS OF FLOWERS FROM WHICH SUNBIRDS WERE EXCLUDED WAS SIGNIFICANTLY LOWER THAN THAT OF FLOWERS VISITED BY BOTH BEES AND SUNBIRDS. SUNBIRDS (NECTARINIA SOUIMANGA) APPEARED TO BE THE MOST EFFECTIVE POLLINATORS OF ALOE DIVARICATA, ALTHOUGH NUMEROUS STINGLESS BEES (TRIGONA SP.) ALSO VISITED THE FLOWERS. THE LATTER VISITORS DID NOT SEEM TO PLAY ANY ROLE IN ALOE DIVARICATA POLLINATION.",ALOE; BEES; MADAGASCAR; POLLINATION; SUNBIRDS,NA,ENGLISH,ARTICLE,ARTICLE,17,"RATSIRARSON, J (REPRINT AUTHOR), YALE UNIV,SCH FORESTRY \& ENVIRONM STUDIES,205 PROSPECT ST,NEW HAVEN,CT 06520, USA.",10.1016/S0254-6299(15)30531-7,"P O BOX 1758, PRETORIA 0001, SOUTH AFRICA",NA,NA,NA,0254-6299,5,249-252,BUREAU SCIENTIFIC PUBL,61,1995,ISIA1995TA87400004,0,PLANT SCIENCES,11,PLANT SCIENCES,NA,TA874,"RATSIRARSON, J (REPRINT AUTHOR), YALE UNIV,SCH FORESTRY \& ENVIRONM STUDIES,205 PROSPECT ST,NEW HAVEN,CT 06520, USA",ISI,none,NA,YALE UNIV,NA,"RATSIRARSON J, 1995, SOUTH AFR J BOT -SUID-AFR TYDSKR PLANTKUNDE","RATSIRARSON J, 1995, SOUTH AFR J BOT -SUID-AFR TYDSKR PLANTKUNDE",NA,NA,NA,NA
