AU,first_author,TI,SO,JI,AB,DE,ID,LA,DT,DT2,TC,C1,DI,PA,AR,FU,FX,SN,PN,PP,PU,VL,PY,UT,NR,SC,U2,WC,EM,GA,RP,DB,CR,AU_UN,AU1_UN,AU_UN_NR,SR_FULL,SR,SE,BO,BE,BN
LECOCQ T;GERARD M;MAEBE K;BRASERO N;DEHON L;SMAGGHE G;VALTEROVA I;DE MEULEMEESTER T;RASMONT P;MICHEZ D,LECOCQ T,CHEMICAL REPRODUCTIVE TRAITS OF DIPLOID BOMBUS TERRESTRIS MALES: CONSEQUENCES ON BUMBLEBEE CONSERVATION,INSECT SCIENCE,INSECT SCI.,"THE CURRENT BUMBLEBEE DECLINE LEADS TO INBREEDING IN POPULATIONS THAT FOSTERS A LOSS OF ALLELIC DIVERSITY AND DIPLOID MALE PRODUCTION. AS DIPLOID MALES ARE VIABLE AND THEIR OFFSPRING ARE STERILE, BUMBLEBEE POPULATIONS CAN QUICKLY FALL IN A VORTEX OF EXTINCTION. IN THIS ARTICLE, WE INVESTIGATE FOR THE FIRST TIME A POTENTIAL PREMATING MECHANISM THROUGH A MAJOR CHEMICAL REPRODUCTIVE TRAIT (MALE CEPHALIC LABIAL GLAND SECRETIONS) THAT COULD PREVENT MONANDROUS VIRGIN QUEENS FROM MATING WITH DIPLOID MALES. WE FOCUS OUR STUDY ON THE CEPHALIC LABIAL GLAND SECRETIONS OF DIPLOID AND HAPLOID MALES OF BOMBUS TERRESTRIS (L.). CONTRARY TO INITIAL EXPECTATIONS, OUR RESULTS DO NOT SHOW ANY SIGNIFICANT DIFFERENTIATION OF CEPHALIC LABIAL GLAND SECRETIONS BETWEEN DIPLOID AND HAPLOID SPECIMENS. QUEENS SEEM THEREFORE TO BE UNABLE TO AVOID MATING WITH DIPLOID MALES BASED ON THEIR COMPOSITIONS OF CEPHALIC LABIAL GLAND SECRETIONS. THIS SUGGESTS THAT THE VORTEX OF EXTINCTION OF DIPLOID MALES COULD NOT BE STOPPED THROUGH PREMATING AVOIDANCE BASED ON THE CEPHALIC LABIAL GLAND SECRETIONS BUT OTHER MECHANISMS COULD AVOID MATING BETWEEN DIPLOID MALES AND QUEENS.",BEE DECLINE; BUMBLEBEES; CONSERVATION; DIPLOID MALES; PREMATING RECOGNITION; REPRODUCTIVE TRAITS,LABIAL GLAND SECRETIONS; DOUBLE-BOND POSITION; SEX DETERMINATION; EUROPEAN POLLINATORS; MICROSATELLITE DNA; SPECIES STATUS; HYMENOPTERA; APIDAE; LANDSCAPES; GENETICS,ENGLISH,ARTICLE,ARTICLE,2,"LECOCQ, T (REPRINT AUTHOR), UNIV MONS, RES INST BIOSCI, ZOOL LAB, PL PARC 20, F-7000 MONS, BELGIUM.;LECOCQ, THOMAS, GERARD, MAXENCE, BRASERO, NICOLAS, DEHON, LAUREN, RASMONT, PIERRE, MICHEZ, DENIS, UNIV MONS, RES INST BIOSCI, ZOOL LAB, PL PARC 20, F-7000 MONS, BELGIUM.;LECOCQ, THOMAS, UNIV LORRAINE, INRA, RES UNIT ANIM \& FUNCT ANIM PROD URAFPA, 2 AVE FORET HAYE,BP 172, F-54505 VANDOEUVRE LES NANCY, FRANCE.;MAEBE, KEVIN, SMAGGHE, GUY, UNIV GHENT, FAC BIOSCI ENGN, DEPT CROP PROTECT, COUPURE LINKS 653, B-9000 GHENT, BELGIUM.;VALTEROVA, IRENA, ACAD SCI CZECH REPUBL, INST ORGAN CHEM \& BIOCHEM, FLAMINGOVO NAM 2, CZ-16610 PRAGUE, CZECH REPUBLIC.;DE MEULEMEESTER, THIBAUT, NAT BIODIVERS CTR, DARWINWEG 2,POSTBUS 9517, NL-2300 RA LEIDEN, NETHERLANDS.",10.1111/1744-7917.12332,"111 RIVER ST, HOBOKEN 07030-5774, NJ USA",NA,BELGIAN SCIENCE POLICYBELGIAN FEDERAL SCIENCE POLICY OFFICE [BR/132/A1/BELBEES]; INSTITUTE OF ORGANIC CHEMISTRY AND BIOCHEMISTRY OF THE ACADEMY OF SCIENCES OF THE CZECH REPUBLIC [RVO61388963],"THIS RESEARCH WAS SUPPORTED BY THE BELGIAN SCIENCE POLICY (PROJECT BR/132/A1/BELBEES) AND THE INSTITUTE OF ORGANIC CHEMISTRY AND BIOCHEMISTRY OF THE ACADEMY OF SCIENCES OF THE CZECH REPUBLIC (RVO61388963). TL WAS GRANT HOLDERS OF THE FONDS POUR LA RECHERCHE DANS L'INDUSTRIE ET L'AGRICULTURE. AUTHORS ACKNOWLEDGE DAVID NOTTON (THE NATURAL HISTORY MUSEUM, LONDON, UK) FOR CORRECTING THE ENGLISH.",1672-9609,4,623-630,WILEY,24,2017,ISI000406477400008,66,ENTOMOLOGY,31,ENTOMOLOGY,THOMAS.LECOCQUMONS.AC.BE,FB9RT,"LECOCQ, T (REPRINT AUTHOR), UNIV MONS, RES INST BIOSCI, ZOOL LAB, PL PARC 20, F-7000 MONS, BELGIUM",ISI,none,UNIV MONS;UNIV LORRAINE;UNIV GHENT;INST ORGAN CHEM AND BIOCHEM;NAT BIODIVERS CTR,UNIV MONS,NA,"LECOCQ T, 2017, INSECT SCI","LECOCQ T, 2017, INSECT SCI",NA,NA,NA,NA
PADYSAKOVA E;OKROUHLIK J;BROWN M;BARTOS M;JANECEK S,PADYSAKOVA E,ASYMMETRIC COMPETITION FOR NECTAR BETWEEN A LARGE NECTAR THIEF AND A SMALL POLLINATOR: AN ENERGETIC POINT OF VIEW,OECOLOGIA,OECOLOGIA,"THERE ARE TWO ALTERNATIVE HYPOTHESES RELATED TO BODY SIZE AND COMPETITION FOR RESTRICTED FOOD SOURCES. THE FIRST ONE SUPPOSES THAT LARGER ANIMALS ARE SUPERIOR COMPETITORS BECAUSE OF THEIR INCREASED FEEDING ABILITIES, WHEREAS THE SECOND ONE ASSUMES SUPERIORITY OF SMALLER ANIMALS BECAUSE OF THEIR LOWER FOOD REQUIREMENTS. WE EXAMINED THE RELATIONSHIP BETWEEN TWO UNRELATED SPECIES OF DIFFERENT SIZE, DRINKING TECHNIQUE, ENERGY REQUIREMENTS AND ROLES IN PLANT POLLINATION SYSTEM, TO REVEAL THE FEATURES OF THEIR COMPETITIVE INTERACTION AND MECHANISMS ENABLING THEIR CO-EXISTENCE WHILE UTILISING THE SAME NECTAR SOURCE. WE OBSERVED DIURNAL FEEDING BEHAVIOUR OF THE MAIN POLLINATOR, THE CARPENTER BEE XYLOCOPA CAFFRA AND A NECTAR THIEF, THE NORTHERN DOUBLE-COLLARED SUNBIRD CINNYRIS REICHENOWI ON 19 CLUMPS OF HYPOESTES ARISTATA (ACANTHACEAE) IN BAMENDA HIGHLANDS, CAMEROON. FOR COMPARATIVE PURPOSE, WE ESTABLISHED A SIMPLISTIC MODEL OF DAILY ENERGY EXPENDITURE AND DAILY ENERGY INTAKE BY BOTH VISITOR SPECIES ASSUMING THAT THEY SPEND ALL AVAILABLE DAYTIME FEEDING ON H. ARISTATA. WE REVEALED THE ENERGETIC GAIN-EXPENDITURE BALANCE OF THE STUDIED VISITOR SPECIES IN RELATION TO DIURNAL CHANGES IN NECTAR QUALITY AND QUANTITY. IN GENERAL, SMALLER ENERGY REQUIREMENTS AND RELATED ABILITY TO UTILISE SMALLER RESOURCES MADE THE MAIN POLLINATOR X. CAFFRA COMPETITIVELY SUPERIOR TO THE LARGER NECTAR THIEF C. REICHENOWI. NEVERTHELESS, SUNBIRDS ARE ENDOWED WITH SEVERAL MECHANISMS TO REDUCE ASYMMETRY IN EXPLOITATIVE COMPETITION, SUCH AS THE USE OF NECTAR RESOURCES IN TIMES OF THE DAY WHEN RIVALS ARE INACTIVE, AGGRESSIVE ATTACKS ON CARPENTER BEES WHILE DEFENDING THE NECTAR PLANTS, AND HIGHER SPEED OF NECTAR CONSUMPTION.",AFRICA; CARPENTER BEE; CINNYRIS; HYPOESTES; SUNBIRD; XYLOCOPA,ROBBING BUMBLE BEES; INTERSPECIFIC COMPETITION; IPOMOPSIS-AGGREGATA; BAMENDA HIGHLANDS; SEXUAL-DIMORPHISM; CARPENTER BEES; FOOD SELECTION; HUMMINGBIRDS; MECHANISMS; EVOLUTION,ENGLISH,ARTICLE,ARTICLE,2,"PADYSAKOVA, E (REPRINT AUTHOR), ACAD SCI CZECH REPUBL, INST ENTOMOL, BRANISOVSKA 31, CR-37005 CESKE BUDEJOVICE, CZECH REPUBLIC.;PADYSAKOVA, E (REPRINT AUTHOR), UNIV SOUTH BOHEMIA, DEPT ZOOL, FAC SCI, BRANISOVSKA 31, CESKE BUDEJOVICE 37005, CZECH REPUBLIC.;PADYSAKOVA, E (REPRINT AUTHOR), CHARLES UNIV PRAGUE, FAC SCI, DEPT ECOL, VINICNA 7, CR-12844 PRAGUE 2, CZECH REPUBLIC.;PADYSAKOVA, ELISKA, ACAD SCI CZECH REPUBL, INST ENTOMOL, BRANISOVSKA 31, CR-37005 CESKE BUDEJOVICE, CZECH REPUBLIC.;PADYSAKOVA, ELISKA, OKROUHLIK, JAN, UNIV SOUTH BOHEMIA, DEPT ZOOL, FAC SCI, BRANISOVSKA 31, CESKE BUDEJOVICE 37005, CZECH REPUBLIC.;PADYSAKOVA, ELISKA, BARTOS, MICHAEL, JANECEK, STEPAN, CHARLES UNIV PRAGUE, FAC SCI, DEPT ECOL, VINICNA 7, CR-12844 PRAGUE 2, CZECH REPUBLIC.;BROWN, MARK, UNIV KWAZULU NATAL, SCH LIFE SCI, DURBAN, SOUTH AFRICA.;BARTOS, MICHAEL, JANECEK, STEPAN, ACAD SCI CZECH REPUBL, INST BOT, DUKELSKA 135, CS-37982 TREBON, CZECH REPUBLIC.",10.1007/S00442-017-3817-4,"233 SPRING ST, NEW YORK, NY 10013 USA",NA,"PROJECTS OF CZECH SCIENCE FOUNDATION [16-11164Y]; GRANT AGENCY OF THE UNIVERSITY OF SOUTH BOHEMIA [136/2010/P, 156/2013/P]; PROGRAMME OF SUPPORT OF PROMISING HUMAN RESOURCES [L200961552]; CZECH ACADEMY OF SCIENCESCZECH ACADEMY OF SCIENCES; [RVO: 60077344]; [67985939]","WE THANK TO ERNEST VUNAN AMOHLON FOR HIS HELP AND KIND RECEPTION IN BIG BABANKI VILLAGE, AND TO BENJAMIN VUBANGSI, THE LOCAL CHIEF OF KEDJOM-KEKU COMMUNITY, FOR PROVIDING US THE PERMISSION AND ACCESS TO STUDY AREA. THIS WORK WAS SUPPORTED BY THE PROJECTS OF CZECH SCIENCE FOUNDATION 16-11164Y, GRANT AGENCY OF THE UNIVERSITY OF SOUTH BOHEMIA 136/2010/P AND 156/2013/P, INSTITUTIONAL SUPPORT RVO: 60077344 AND THE LONG-TERM RESEARCH DEVELOPMENT PROJECT NO. 67985939. EP ACKNOWLEDGES FELLOWSHIP REG. NO. L200961552 FROM THE PROGRAMME OF SUPPORT OF PROMISING HUMAN RESOURCES, AWARDED BY THE CZECH ACADEMY OF SCIENCES.",0029-8549,4,1111-1120,SPRINGER,183,2017,ISI000398563100018,88,ENVIRONMENTAL SCIENCES \& ECOLOGY,42,ECOLOGY,PADDYSEKGMAIL.COM,ER1OY,"PADYSAKOVA, E (REPRINT AUTHOR), ACAD SCI CZECH REPUBL, INST ENTOMOL, BRANISOVSKA 31, CR-37005 CESKE BUDEJOVICE, CZECH REPUBLIC",ISI,none,INST ENTOMOL;UNIV SOUTH BOHEMIA;CHARLES UNIV PRAGUE;UNIV KWAZULU NATAL;INST BOT,INST ENTOMOL,NA,"PADYSAKOVA E, 2017, OECOLOGIA","PADYSAKOVA E, 2017, OECOLOGIA",NA,NA,NA,NA
KUPPLER J;HOEFERS MK;TRUTSCHNIG W;BATHKE AC;EIBEN JA;DAEHLER CC;JUNKER RR,KUPPLER J,EXOTIC FLOWER VISITORS EXPLOIT LARGE FLORAL TRAIT SPACES RESULTING IN ASYMMETRIC RESOURCE PARTITIONING WITH NATIVE VISITORS,FUNCTIONAL ECOLOGY,FUNCT. ECOL.,"EXOTIC SPECIES OFTEN CAUSE SEVERE ALTERATIONS IN NATIVE COMMUNITIES DUE TO THEIR ABILITY TO RAPIDLY AND EFFICIENTLY UTILIZE A BROAD SPECTRUM OF RESOURCES. IN FLOWER-VISITOR INTERACTIONS, THE BREADTH OF RESOURCE USE BY NATIVE AND EXOTIC ANIMALS AS WELL AS THE PARTITIONING OF RESOURCES AMONG THEM IS OFTEN ESTIMATED BASED ON THE NUMBER OF (SHARED) PLANT SPECIES USED AS RESOURCES. HOWEVER, WHETHER A FLOWER VISITOR IS ABLE TO EXPLOIT PLANT RESOURCES HAS BEEN SHOWN TO BE DELIMITED BY FUNCTIONAL FLORAL TRAITS SUCH AS MORPHOLOGICAL BARRIERS OR ATTRACTIVE OR REPELLENT CHEMICAL CUES. EACH OF THE ECOLOGICALLY RELEVANT TRAITS CAN BE VIEWED AS A DIMENSION OF A HUTCHINSONIAN N-DIMENSIONAL HYPERVOLUME, WHICH CHARACTERIZES THE RANGE OF PHENOTYPES EXPLOITABLE BY A SPECIES. IN THIS STUDY, WE QUANTIFIED THE SIZES AND OVERLAPS OF N-DIMENSIONAL HYPERVOLUMES DEFINED BY FLORAL TRAITS THAT ARE EXPLOITED BY NATIVE AND EXOTIC FLOWER VISITORS (AFTERWARDS REFERRED TO AS EXPLOITED SPACE, ES). IN THE HEAVILY INVADED HAWAII VOLCANOES NATIONAL PARK, USA, WE PHENOTYPED 40 NATIVE AND EXOTIC PLANT SPECIES AND RECORDED FLOWER-VISITOR INTERACTIONS. TO QUANTIFY THE SIZE AND OVERLAP OF ES, WE APPLIED DYNAMIC RANGE BOXES. ON AVERAGE, EXOTIC FLOWER VISITORS WERE MORE GENERALIZED IN RESOURCE USE (LARGER ES) THAN NATIVES ONES, WHICH IS ADDITIONALLY INDICATED BY THE ABSENCE OF NATIVE FLOWER VISITORS ON EXOTIC FLOWERING PLANT SPECIES. IN PARTICULAR, ES BASED ON FLORAL SCENT EMISSION WAS LARGER FOR EXOTIC FLOWER VISITORS COMPARED TO NATIVE ONES. THE UNEVENLY EXPANDED ES OF NATIVE AND EXOTIC ANIMALS LED TO AN ASYMMETRIC OVERLAP OF FLORAL ES WHERE EXOTIC FLOWER VISITORS SHARED ONLY A SMALL PROPORTION OF THEIR ES WITH NATIVES BUT OCCUPIED A LARGE PROPORTION OF THE ES OF NATIVES. THE ASYMMETRY IN RESOURCE USE OF NATIVE AND EXOTIC FLOWER VISITORS SUGGESTS A POTENTIAL ADVANTAGE IN RESOURCE EXPLOITATION OF THE LATTER, POTENTIALLY EXPLAINING THEIR SUCCESS IN HAWAIIAN ECOSYSTEMS. PREDICTED RANGE EXPANSION OF EXOTIC PLANT AND ANIMAL SPECIES MAY FURTHER INCREASE THE COMPETITION FOR AND REDUCE THE AVAILABILITY OF RESOURCES FOR NATIVE ANIMALS. THIS MAY LEAD TO FURTHER DECLINES OF NATIVE SPECIES AND INCREASING THREATS FOR HAWAIIAN ECOSYSTEMS. A IS AVAILABLE FOR THIS ARTICLE.",FLORAL SCENT; FUNCTIONAL TRAITS; HAWAII; INVASIVE SPECIES; N-DIMENSIONAL HYPERVOLUME; NICHE SIZE AND OVERLAP; POLLINATION; RESOURCE PARTITIONING,BIOLOGICAL INVASIONS; POLLINATION SYNDROMES; PLANT; BEES; IMPACTS; ECOLOGY; HAWAII; CONSERVATION; COMMUNITIES; COMPETITION,ENGLISH,ARTICLE,ARTICLE,11,"JUNKER, RR (REPRINT AUTHOR), UNIV SALZBURG, DEPT ECOL \& EVOLUT, SALZBURG, AUSTRIA.;KUPPLER, JONAS, HOEFERS, MAREN K., JUNKER, ROBERT R., UNIV SALZBURG, DEPT ECOL \& EVOLUT, SALZBURG, AUSTRIA.;TRUTSCHNIG, WOLFGANG, BATHKE, ARNE C., UNIV SALZBURG, DEPT MATH, SALZBURG, AUSTRIA.;EIBEN, JESSE A., UNIV HAWAII, COLL AGR FORESTRY \& NAT RESOURCE MANAGEMENT, HILO, HI 96720 USA.;DAEHLER, CURTIS C., UNIV HAWAII MANOA, DEPT BOT, HONOLULU, HI 96822 USA.;KUPPLER, JONAS, UNIV ULM, INST EVOLUTIONARY ECOL \& CONSERVAT GENOM, ULM, GERMANY.",10.1111/1365-2435.12932,"111 RIVER ST, HOBOKEN 07030-5774, NJ USA",NA,"GRADUATE SCHOOL ``EVOLUTIONARY NETWORKS: ORGANISMS, REACTIONS, MOLECULES (E-NORM), HEINRICH-HEINE-UNIVERSITY, DUSSELDORF, GERMANY; DEUTSCHE FORSCHUNGSGEMEINSCHAFTGERMAN RESEARCH FOUNDATION (DFG) [JU 2856/2-2]","GRADUATE SCHOOL ``EVOLUTIONARY NETWORKS: ORGANISMS, REACTIONS, MOLECULES (E-NORM), HEINRICH-HEINE-UNIVERSITY, DUSSELDORF, GERMANY; DEUTSCHE FORSCHUNGSGEMEINSCHAFT, GRANT/AWARD NUMBER: JU 2856/2-2",0269-8463,12,2244-2254,WILEY,31,2017,ISI000416896700005,75,ENVIRONMENTAL SCIENCES \& ECOLOGY,26,ECOLOGY,ROBERT.JUNKERSBG.AC.AT,FO5KS,"JUNKER, RR (REPRINT AUTHOR), UNIV SALZBURG, DEPT ECOL \& EVOLUT, SALZBURG, AUSTRIA",ISI,none,UNIV SALZBURG;UNIV SALZBURG;UNIV HAWAII;UNIV HAWAII MANOA;UNIV ULM,UNIV SALZBURG,NA,"KUPPLER J, 2017, FUNCT ECOL","KUPPLER J, 2017, FUNCT ECOL",NA,NA,NA,NA
NUNES CEP;WOLOWSKI M;PANSARIN ER;GERLACH G;AXIMOFF I;VEREECKEN NJ;SALVADOR MJ;SAZIMA M,NUNES CEP,MORE THAN EUGLOSSINES: THE DIVERSE POLLINATORS AND FLORAL SCENTS OF ZYGOPETALINAE ORCHIDS,SCIENCE OF NATURE,SCI. NAT.,"FLORAL VOLATILE ORGANIC COMPOUNDS (VOCS) PLAY IMPORTANT ROLES IN PLANT-POLLINATOR INTERACTIONS. WE INVESTIGATED THE REPRODUCTIVE ECOLOGY AND FLORAL VOCS OF ZYGOPETALINAE ORCHIDS TO UNDERSTAND THE RELATIONSHIP BETWEEN FLORAL SCENTS AND POLLINATORS. WE PERFORMED FOCAL OBSERVATIONS, PHENOLOGICAL CENSUSES AND BREEDING SYSTEM EXPERIMENTS IN EIGHT SPECIES IN SOUTHEAST BRAZIL. FLORAL SCENTS WERE COLLECTED AND ANALYSED USING SPME/GC-MS. WE PERFORMED MULTIVARIATE ANALYSES TO GROUP SPECIES ACCORDING TO AFFINITIES OF THEIR VOCS AND DEFINE COMPOUNDS ASSOCIATED TO EACH PLANT. DICHAEA COGNIAUXIANA WAS POLLINATED BY WEEVILS WHICH USE THEIR DEVELOPING OVULES, WHILE D. PENDULA WAS POLLINATED BY THE SAME WEEVILS AND PERFUME-COLLECTING MALE EUGLOSSINE BEES. THE OTHER SPECIES WERE DECEIT-POLLINATED BY BEES. ZYGOPETALUM CRINITUM WAS POLLINATED BY CARPENTER BEES, WHILE W. WARREANA, Z. MACKAYI AND Z. MAXILLARE WERE BUMBLEBEE-POLLINATED. THE LATTER WAS ALSO POLLINATED BY CENTRIS CONFUSA. BREEDING SYSTEM VARIED WIDELY WITH NO ASSOCIATION TO ANY POLLINATOR GROUP. MOST VOCS ARE COMMON TO OTHER FLORAL SCENTS. ZYGOPETALUM CRINITUM PRESENTED AN EXCLUSIVE BLEND OF VOCS, MAINLY COMPOSED OF BENZENOIDS. THE SCENTS OF PABSTIA JUGOSA, PROMENAEA XANTHINA AND THE ZYGOPETALUM SPP. WERE SIMILAR. THE BUMBLEBEE-POLLINATED SPECIES HAVE FLOWERING PERIODS PARTIALLY OVERLAPPED, THUS NEITHER PHENOLOGY NOR POLLINATORS CONSTITUTE HYBRIDIZATION BARRIERS AMONG THESE SPECIES. EUGLOSSINES ARE NOT THE ONLY POLLINATORS OF ZYGOPETALINAE. DIFFERENT VOCS, SIZE AND LIFESPAN OF FLOWERS ARE ASSOCIATED WITH DISTINCT POLLINATORS. A DISTINCTIVE VOC BOUQUET MAY DETERMINE SPECIALISATION IN CARPENTER BEES OR MALE EUGLOSSINES WITHIN BEE-POLLINATED FLOWERS. FINALLY, VISITATION OF DECEIT-POLLINATED FLOWERS BY PERFUME-COLLECTING EUGLOSSINES ALLOWS US TO HYPOTHESISE HOW POLLINATION BY THIS GROUP OF BEES HAD EVOLVED.",APIDAE; ATLANTICFOREST; BEE; CHEMICAL ECOLOGY; DECEIT-POLLINATION; ORCHIDACEAE,SPECIALIZED POLLINATION; BEE POLLINATION; MYRMECOPHILA-CHRISTINAE; TROPICAL ORCHID; COSTA-RICA; FLOWERS; SYSTEM; COMPETITION; EVOLUTION; CONSEQUENCES,ENGLISH,ARTICLE,ARTICLE,1,"NUNES, CEP (REPRINT AUTHOR), UNIV ESTADUAL CAMPINAS, INST BIOL, PROGRAMA POSGRAD BIOL VEGETAL, CP 6109, BR-13083970 CAMPINAS, SP, BRAZIL.;NUNES, CARLOS E. P., UNIV ESTADUAL CAMPINAS, INST BIOL, PROGRAMA POSGRAD BIOL VEGETAL, CP 6109, BR-13083970 CAMPINAS, SP, BRAZIL.;WOLOWSKI, MARINA, UNIV FED ALFENAS, INST CIENCIAS NAT, BR-37130001 ALFENAS, MG, BRAZIL.;PANSARIN, EMERSON RICARDO, UNIV SAO PAULO, DEPT BIOL, FAC FILOSOFIA CIENCIAS \& LETRAS, BR-14040901 RIBEIRAO PRETO, SP, BRAZIL.;GERLACH, GUNTER, BOT GARDEN MUNCHEN NYMPHENBURG, MENZINGER STR,65, D-80638 MUNICH, GERMANY.;AXIMOFF, IZAR, INST PESQUISAS JARDIM BOT RIO DE JANEIRO, RUA PACHECO LEAO 915, BR-22460030 RIO DE JANEIRO, RG, BRAZIL.;VEREECKEN, NICOLAS J., FREE UNIV BRUSSELS, AGROECOL \& POLLINAT GRP, LANDSCAPE ECOL \& PLANT PROD SYST UNIT, BLVD TRIOMPHE CP 264-2, B-1050 BRUSSELS, BELGIUM.;SALVADOR, MARCOS JOSE, SAZIMA, MARLIES, UNIV ESTADUAL CAMPINAS, INST BIOL, DEPT BIOL VEGETAL, CP 6109, BR-13083970 CAMPINAS, SP, BRAZIL.",10.1007/S00114-017-1511-3,"TIERGARTENSTRASSE 17, D-69121 HEIDELBERG, GERMANY",92,THEMATIC PROJECT FUNCTIONAL GRADIENT WITHIN BIOTA/FAPESP - THE BIODIVERSITY VIRTUAL INSTITUTE [03/12595-7]; NATIONAL COUNSEL OF TECHNOLOGICAL AND SCIENTIFIC DEVELOPMENT (CNPQ)NATIONAL COUNCIL FOR SCIENTIFIC AND TECHNOLOGICAL DEVELOPMENT (CNPQ) [148221/2012-2]; FAPESPFUNDACAO DE AMPARO A PESQUISA DO ESTADO DE SAO PAULO (FAPESP) [2013/15129-9]; CNPQNATIONAL COUNCIL FOR SCIENTIFIC AND TECHNOLOGICAL DEVELOPMENT (CNPQ) [303084/2011-1],"WE THANK THE SAO PAULO RESEARCH FOUNDATION (FAPESP) AND THE THEMATIC PROJECT FUNCTIONAL GRADIENT (PROCESS NUMBER 03/12595-7) WITHIN THE BIOTA/FAPESP PROGRAM - THE BIODIVERSITY VIRTUAL INSTITUTE (HTTP://WWW.BIOTA.ORG.BR/). WE THANK THE SERRA DO MAR STATE PARK (NUCLEO SANTA VIRGINIA) FOR PERMITS (COTEC/IF 41.065/2005 AND IBAMA/CGEN 093/2005) AND LOGISTIC ASSISTANCE DURING FIELDWORK. WE THANK MSC. DANIELA DE CASSIA BENA AND PROF. DR. SERGIO VANIN FOR IDENTIFYING THE MONTELLA SPEC. NOV. WEEVILS. WE THANK MARIA E. P. MARTUCCI AND LEONARDO GOBBO-NETO FOR ADDITIONAL FRAGRANCE HEADSPACE ANALYSES OF Z. CRINITUM, IVAN SAZIMA FOR THE FOCAL OBSERVATIONS AND POLLINATOR IMAGES OF Z. MAXILLARE IN ITATIAIA NATIONAL PARK AND H. HEIDER FOR ADDITIONAL OBSERVATIONS AND IMAGES OF A EUGLOSSINE FLORAL VISITOR IN W. WARREANA IN BOLIVIA. C.E.P.N. THANKS THE NATIONAL COUNSEL OF TECHNOLOGICAL AND SCIENTIFIC DEVELOPMENT (CNPQ) FOR THE PHD SCHOLARSHIP (148221/2012-2). M.W. THANKS FAPESP FOR THE POST-DOCTORAL FELLOWSHIP (2013/15129-9). M.S. THANKS CNPQ FOR THE RESEARCH GRANT (303084/2011-1).",0028-1042,1112,NA,SPRINGER HEIDELBERG,104,2017,ISI000414065800007,85,SCIENCE \& TECHNOLOGY - OTHER TOPICS,36,MULTIDISCIPLINARY SCIENCES,CEPNUNESGMAIL.COM,FL2RG,"NUNES, CEP (REPRINT AUTHOR), UNIV ESTADUAL CAMPINAS, INST BIOL, PROGRAMA POSGRAD BIOL VEGETAL, CP 6109, BR-13083970 CAMPINAS, SP, BRAZIL",ISI,none,UNIV ESTADUAL CAMPINAS;UNIV FED ALFENAS;UNIV SAO PAULO;INST PESQUISAS JARDIM BOT RIO DE JANEIRO;FREE UNIV BRUSSELS;UNIV ESTADUAL CAMPINAS,UNIV ESTADUAL CAMPINAS,NA,"NUNES CEP, 2017, SCI NAT","NUNES CEP, 2017, SCI NAT",NA,NA,NA,NA
VICKRUCK JL;RICHARDS MH,VICKRUCK JL,NESTING HABITS INFLUENCE POPULATION GENETIC STRUCTURE OF A BEE LIVING IN ANTHROPOGENIC DISTURBANCE,MOLECULAR ECOLOGY,MOL. ECOL.,"WHILE MOST ORGANISMS ARE NEGATIVELY AFFECTED BY ANTHROPOGENIC DISTURBANCE, A FEW SPECIES THRIVE IN LANDSCAPES ALTERED BY HUMANS. TYPICALLY, NATIVE BEES ARE NEGATIVELY IMPACTED BY ANTHROPOGENIC ENVIRONMENTAL CHANGE, INCLUDING HABITAT ALTERATION AND CLIMATE CHANGE. HERE, WE INVESTIGATE THE POPULATION STRUCTURE OF THE EASTERN CARPENTER BEE XYLOCOPA VIRGINICA, A GENERALIST POLLINATOR WITH A BROAD GEOGRAPHIC RANGE SPANNING EASTERN NORTH AMERICA. EASTERN CARPENTER BEES NOW NEST ALMOST EXCLUSIVELY IN ARTIFICIAL WOODEN STRUCTURES, LINKING THEIR GEOGRAPHIC DISTRIBUTION AND POPULATION STRUCTURE TO HUMAN ACTIVITIES AND DISTURBANCE. TO INVESTIGATE THE POPULATION STRUCTURE OF THESE BEES, WE SAMPLED FEMALES FROM 16 DIFFERENT POPULATIONS FROM ACROSS THEIR RANGE. NINE SPECIES-SPECIFIC MICROSATELLITE LOCI SHOWED THAT ALMOST ALL POPULATIONS ARE GENETICALLY DISTINCT, BUT WITH HIGH LEVELS OF GENETIC DIVERSITY AND LOW LEVELS OF INBREEDING OVERALL. BROADLY SPEAKING, POPULATIONS CLUSTERED INTO THREE DISTINCT GENETIC GROUPS: A NORTHERN GROUP, A WESTERN GROUP AND A CORE GROUP. THE NORTHERN GROUP HAD LOW EFFECTIVE POPULATION SIZES, DECREASED GENETIC VARIABILITY AND THE HIGHEST LEVELS OF INBREEDING IN THE DATA SET, SUGGESTING THAT CARPENTER BEES MAY BE EXPANDING THEIR RANGE NORTHWARD. THE WESTERN GROUP WAS GENETICALLY DISTINCT, BUT LACKED SIGNALS OF A RECENT RANGE EXPANSION. CLIMATIC DATA SHOWED THAT SUMMER AND WINTER TEMPERATURES EXPLAINED A SIGNIFICANT AMOUNT OF THE GENETIC DIFFERENTIATION SEEN AMONG POPULATIONS, WHILE PRECIPITATION DID NOT. OUR RESULTS INDICATE THAT X.VIRGINICA MAY BE ONE OF THE RARE ANTHROPHILIC' SPECIES THAT THRIVE IN THE FACE OF ANTHROPOGENIC DISTURBANCE.",DBRDA; DISTURBANCE; NEST SUBSTRATE; PHILOPATRY; RANGE EXPANSION; XYLOCOPA VIRGINICA,RAPID RANGE EXPANSION; CARPENTER BEE; HYMENOPTERA-MEGACHILIDAE; COMPUTER-PROGRAM; SOLITARY BEE; SWEAT BEE; SPECIALIST; DIFFERENTIATION; FRAGMENTATION; DIVERSITY,ENGLISH,ARTICLE,ARTICLE,3,"VICKRUCK, JL (REPRINT AUTHOR), BROCK UNIV, DEPT BIOL SCI, 1812 SIR ISAAC BROCK WAY, ST CATHARINES, ON L2S 3A1, CANADA.;VICKRUCK, J. L., RICHARDS, M. H., BROCK UNIV, DEPT BIOL SCI, 1812 SIR ISAAC BROCK WAY, ST CATHARINES, ON L2S 3A1, CANADA.",10.1111/MEC.14064,"111 RIVER ST, HOBOKEN 07030-5774, NJ USA",NA,NATURAL SCIENCES AND ENGINEERING RESEARCH COUNCIL (NSERC)NATURAL SCIENCES AND ENGINEERING RESEARCH COUNCIL OF CANADA; ONTARIO GRADUATE SCHOLARSHIPSONTARIO GRADUATE SCHOLARSHIP; NSERC DISCOVERY GRANTNATURAL SCIENCES AND ENGINEERING RESEARCH COUNCIL OF CANADA,"WE WOULD LIKE TO THANK THE MANY PEOPLE WHO HELPED COLLECT SPECIMENS OR ALLOWED US TO COLLECT BEES ON THEIR PROPERTY, SPECIFICALLY MICHAEL HUTCHINSON, DR. RUSSELL MISELL, MONI HAYNE, DR. AMBER TRIPODI, MORRIS BROWN AND DWIGHT WILLIAMS, ALONG WITH FIELD ASSISTANTS CONNIE VICKRUCK AND WES LESCO. BROCK HARPUR AND SEVERAL ANONYMOUS REVIEWERS PROVIDED VALUABLE COMMENTS ON EARLIER VERSIONS OF THE MANUSCRIPT. THIS RESEARCH WAS SUPPORTED BY NATURAL SCIENCES AND ENGINEERING RESEARCH COUNCIL (NSERC) AND ONTARIO GRADUATE SCHOLARSHIPS TO JLV AND AN NSERC DISCOVERY GRANT TO MHR.",0962-1083,10,2674-2686,WILEY,26,2017,ISI000400994400007,79,"BIOCHEMISTRY \& MOLECULAR BIOLOGY, ENVIRONMENTAL SCIENCES \& ECOLOGY, EVOLUTIONARY BIOLOGY",41,"BIOCHEMISTRY \& MOLECULAR BIOLOGY, ECOLOGY, EVOLUTIONARY BIOLOGY",JVICKRUCKGMAIL.COM,EU4JA,"VICKRUCK, JL (REPRINT AUTHOR), BROCK UNIV, DEPT BIOL SCI, 1812 SIR ISAAC BROCK WAY, ST CATHARINES, ON L2S 3A1, CANADA",ISI,none,BROCK UNIV,BROCK UNIV,NA,"VICKRUCK JL, 2017, MOL ECOL","VICKRUCK JL, 2017, MOL ECOL",NA,NA,NA,NA
ANDERSON NO;ASCHER PD;FRITZ V;ROHWER C;POPPE S;YAO S;JOHNSON P;KLOSSNER L;EASH NS;LIEDL BE;REITH-ROZELLE J,ANDERSON NO,CHRYSANTHEMUM XHYBRIDUM MN 98-89-7 SHRUB GARDEN CHRYSANTHEMUM,HORTSCIENCE,HORTSCIENCE,"A NEW GARDEN CHRYSANTHEMUM WITH A SHRUB PLANT HABIT IS RELEASED AS A DESCENDENT OF A CROSS INVOLVING TWO HEXAPLOID SPECIES: CHRYSANTHEMUM WEYRICHII (MAXIM.) TZVELV. (FEMALE) X C. XGRANDIFLORUM TZVELV. (MALE). CHRYSANTHEMUM XHYBRIDUM ANDERSON MN 98-89-7 [U.S. PLANT PATENT (PP) 14,495] IS A VIGOROUSLY GROWING SHRUB CHRYSANTHEMUM FOR GARDEN CULTURE, EXHIBITING EXTREME HYBRID VIGOR. SINGLE DAISY REDDISH-PURPLE FLOWERS COVER THE FOLIAGE IN THE FALL, NUMBERING > 3000 ON SECOND-YEAR PLANTS. THIS SELECTION DISPLAYS EXCELLENT WINTERHARDINESS IN U.S. DEPARTMENT OF AGRICULTURE (USDA) Z3B+ (-34.4 TO -37.2 DEGREES C) AS WELL AS FROST-TOLERANT FLOWERS. IN ITS SECOND AND SUBSEQUENT YEARS OF GROWTH AFTER PLANTING, MN 98-89-7 GROWS INTO A FALL FLOWERING (AUGUST-OCTOBER), HERBACEOUS SHRUB RANGING IN PLANT HEIGHT FROM 61.0 TO 91.4 CM WITH A DIAMETER OF 76.2 TO 152.4 CM. ITS SPHERICAL PLANT SHAPE IS ACHIEVED NATURALLY WITH SELF-PINCHING, CREATING A HIGHLY MANICURED APPEARANCE, IT ALSO ATTRACTS HONEY BEES AND BUTTERFLIES AS POLLINATORS. MN 98-89-7 IS A VEGETATIVE PRODUCT AND THIS UNNAMED SELECTION IS BEING RELEASED FOR GERMPLASM PURPOSES AS WELL AS FOR POTENTIAL LICENSING AND NAMING.",ASTERACEAE; CHRYSANTHEMUM BREEDING; DENDRANTHEMA; HERBACEOUS PERENNIALS; HONEY BEES; WINTERHARDINESS,X GRANDIFLORA TZVELV.; DAISY,ENGLISH,ARTICLE,ARTICLE,0,"ANDERSON, NO (REPRINT AUTHOR), UNIV MINNESOTA, DEPT HORT SCI, ST PAUL, MN 55108 USA.;ANDERSON, NEIL O., ASCHER, PETER D., UNIV MINNESOTA, DEPT HORT SCI, ST PAUL, MN 55108 USA.;FRITZ, VINCENT, ROHWER, CHARLIE, UNIV MINNESOTA, SOUTHERN RES \& OUTREACH CTR, WASECA, MN 56093 USA.;POPPE, STEVEN, UNIV MINNESOTA, WEST CENT RES \& OUTREACH CTR, MORRIS, MN 56267 USA.;YAO, SHENGRUI, JOHNSON, PATRICIA, UNIV MINNESOTA, NORTH CENT RES \& OUTREACH CTR, GRAND RAPIDS, MN 55744 USA.;KLOSSNER, LEE, EASH, NEAL S., UNIV MINNESOTA, SOUTHWEST RES \& OUTREACH CTR, LAMBERTON, MN 56162 USA.;LIEDL, BARBARA E., WEST VIRGINIA STATE UNIV, DEPT BIOL, AGR \& ENVIRONM RES STN, INSTITUTE, WV 25112 USA.;REITH-ROZELLE, JUDITH, WEST MADISON AGR RES STN, VERONA, WI 53593 USA.;YAO, SHENGRUI, NEW MEXICO STATE UNIV, SUSTAINABLE AGR SCI CTR, ALCALDE, NM USA.;EASH, NEAL S., UNIV TENNESSEE, KNOXVILLE, TN USA.",10.21273/HORTSCI11203-16,"113 S WEST ST, STE 200, ALEXANDRIA, VA 22314-2851 USA",NA,"MINNESOTA AGRICULTURAL EXPERIMENT STATION; BALL HORTICULTURAL COMPANY, WEST CHICAGO, IL","THIS RESEARCH HAS BEEN SUPPORTED BY THE MINNESOTA AGRICULTURAL EXPERIMENT STATION AND A GRANT FROM THE BALL HORTICULTURAL COMPANY, WEST CHICAGO, IL.",0018-5345,2,306-309,AMER SOC HORTICULTURAL SCIENCE,52,2017,ISI000397202100016,18,AGRICULTURE,5,HORTICULTURE,ANDER044UMN.EDU,EP2GT,"ANDERSON, NO (REPRINT AUTHOR), UNIV MINNESOTA, DEPT HORT SCI, ST PAUL, MN 55108 USA",ISI,none,UNIV MINNESOTA;UNIV MINNESOTA;UNIV MINNESOTA;UNIV MINNESOTA;UNIV MINNESOTA;WEST VIRGINIA STATE UNIV;WEST MADISON AGR RES STN;NEW MEXICO STATE UNIV;UNIV TENNESSEE,UNIV MINNESOTA,NA,"ANDERSON NO, 2017, HORTSCIENCE","ANDERSON NO, 2017, HORTSCIENCE",NA,NA,NA,NA
