AU,first_author,TI,SO,JI,AB,DE,ID,LA,DT,DT2,TC,C1,DI,PA,AR,FU,FX,SN,PN,PP,PU,VL,PY,UT,NR,SC,U2,WC,EM,GA,RP,DB,CR,AU_UN,AU1_UN,AU_UN_NR,SR_FULL,SR,SE,BO,BE,BN
HEGLAND SJ,HEGLAND SJ,FLORAL NEIGHBOURHOOD EFFECTS ON POLLINATION SUCCESS IN RED CLOVER ARE SCALE-DEPENDENT,FUNCTIONAL ECOLOGY,FUNCT. ECOL.,"PLANT-POLLINATOR INTERACTIONS ARE HIGHLY IMPORTANT BECAUSE OF ITS DIRECT LINK TO PLANT FITNESS AND BECAUSE SUCH INTERACTIONS INVOLVE SPECIES AT DIFFERENT TROPHIC LEVELS. OUR UNDERSTANDING OF COMPETITIVE AND FACILITATIVE INTERACTIONS AMONG PLANTS FOR POLLINATION IS OF LARGE IMPORTANCE TO GOVERN CONSERVATION OF SPECIES AND MANAGEMENT OF CROP PRODUCTION. STILL WE KNOW LITTLE ABOUT THE SCALE DEPENDENCY OF PLANT-PLANT INTERACTIONS FOR POLLINATOR VISITATION WHICH IS CENTRAL TO BOTH BASIC AND APPLIED ECOLOGY. HERE, I TESTED WHETHER PLANT-PLANT INTERACTIONS FOR BUMBLEBEE VISITATION AND SUBSEQUENT REPRODUCTION WERE SCALE-DEPENDENT BY STUDYING THE ECOLOGICALLY AND ECONOMICALLY IMPORTANT RED CLOVER (TRIFOLIUM PRATENSE) AND ITS FLORAL NEIGHBOURHOOD. I EXPECTED THAT HIGH FLORAL DENSITIES AT SMALL SCALE COULD TRIGGER FACILITATIVE INTERACTIONS DUE TO CONCENTRATION EFFECTS OF POLLINATORS. THIS WAS EXPECTED TO CHANGE INTO COMPETITIVE INTERACTIONS WHEN FLORAL DENSITIES BECAME HIGHER AT COARSER SCALES BECAUSE OF DILUTION EFFECTS. I ALSO EXPECTED THAT INCREASED BUMBLEBEE VISITATION WOULD INCREASE FRUIT PRODUCTION IN RED CLOVER. THE INTERACTION FOR POLLINATION SUCCESS IN RED CLOVER APPEARED TO BE SCALE-DEPENDENT IN THE LANDSCAPE UNDER STUDY. AT PLOT SCALE, THE BUMBLEBEE VISITATION RATE TO RED CLOVER INFLORESCENCES INCREASED WITH BOTH INTRA- AND INTERSPECIFIC FLORAL DENSITY, INDICATING FACILITATIVE INTERACTION FOR POLLINATOR VISITATION AMONG RED CLOVER FLOWERS AND ITS NEAREST FLORAL NEIGHBOURHOOD. INCREASED VISITATION OF BUMBLEBEES LED TO SUBSEQUENT INCREASED FRUIT SET, BUT THERE WAS A SATURATING EFFECT AS FRUIT SET DID NOT INCREASE WHEN VISITATION RATES EXCEEDED A CERTAIN LEVEL. AS THE FLORAL NEIGHBOURHOOD BECAME DENSER AT A COARSER SCALE, THE INTERACTIONS FOR POLLINATOR VISITATION CHANGED TOWARDS COMPETITION. THIS STUDY SHOWS THAT KEY ECOLOGICAL PROCESSES SUCH AS PLANT-POLLINATOR INTERACTIONS MAY INDEED BE SCALE-DEPENDENT AND THAT THE RELATIVE IMPORTANCE OF COMPETITION AND FACILITATION AMONG PLANTS FOR ATTRACTING POLLINATORS MAY CHANGE WITH SCALE. THE DENSITY OF THE FLORAL NEIGHBOURHOOD OF A FOCAL SPECIES (E.G. KEY-, RARE-, CROP SPECIES) MAY THUS BE OF LARGE IMPORTANCE FOR ITS POLLINATION AND FRUIT PRODUCTION. MY FINDINGS SUGGEST THAT INCREASING FLORAL DENSITIES AT FINE SCALES MAY HAVE FACILITATIVE EFFECTS ON POLLINATOR VISITATION TO RED CLOVER, WHEREAS POLLINATORS MAY BE DRAWN AWAY WHEN FLORAL RESOURCES BECOME DENSER AT COARSER SCALE.",LANDSCAPE; REPRODUCTION; FRUIT SET; POLLEN LIMITATION; VISITATION RATE; TRIFOLIUM PRATENSE; CROP; MAGNET SPECIES; POLLINATION; BUMBLEBEES,WILD BEE POLLINATORS; SEED-SET; PLANT COMMUNITY; FRUIT-SET; INTERSPECIFIC COMPETITION; POPULATION-DENSITY; BUMBLE BEES; DIVERSITY; FACILITATION; VISITATION,ENGLISH,ARTICLE,ARTICLE,28,"HEGLAND, SJ (REPRINT AUTHOR), NORWEGIAN RED DEER CTR, N-6914 SVANOYBUKT, NORWAY.;HEGLAND, STEIN J., NORWEGIAN RED DEER CTR, N-6914 SVANOYBUKT, NORWAY.;HEGLAND, STEIN J., UNIV COLL SOGN \& FJORDANE, FAC SCI, N-5801 SOGNDAL, NORWAY.",10.1111/1365-2435.12223,"111 RIVER ST, HOBOKEN 07030-5774, NJ USA",NA,NA,NA,0269-8463,3,561-568,WILEY,28,2014,ISI000335954900003,50,ENVIRONMENTAL SCIENCES \& ECOLOGY,139,ECOLOGY,STEIN.JOAR.HEGLANDHISF.NO,AH2MF,"HEGLAND, SJ (REPRINT AUTHOR), NORWEGIAN RED DEER CTR, N-6914 SVANOYBUKT, NORWAY",ISI,none,NORWEGIAN RED DEER CTR;UNIV COLL SOGN AND FJORDANE,NORWEGIAN RED DEER CTR,NA,"HEGLAND SJ, 2014, FUNCT ECOL","HEGLAND SJ, 2014, FUNCT ECOL",NA,NA,NA,NA
BOHMAN B;PHILLIPS RD;MENZ MHM;BERNTSSON BW;FLEMATTI GR;BARROW RA;DIXON KW;PEAKALL R,BOHMAN B,DISCOVERY OF PYRAZINES AS POLLINATOR SEX PHEROMONES AND ORCHID SEMIOCHEMICALS: IMPLICATIONS FOR THE EVOLUTION OF SEXUAL DECEPTION,NEW PHYTOLOGIST,NEW PHYTOL.,"SEXUALLY DECEPTIVE ORCHIDS EMPLOY FLORAL VOLATILES TO SEXUALLY LURE THEIR SPECIFIC POLLINATORS. HOW AND WHY THIS POLLINATION SYSTEM HAS EVOLVED INDEPENDENTLY ON MULTIPLE CONTINENTS REMAINS UNKNOWN, ALTHOUGH PREADAPTATION IS CONSIDERED TO HAVE BEEN IMPORTANT. UNDERSTANDING THE CHEMISTRY OF SEXUAL DECEPTION IS A CRUCIAL FIRST STEP TOWARDS SOLVING THIS MYSTERY. THE COMBINATION OF GAS CHROMATOGRAPHY-ELECTROANTENNOGRAPHIC DETECTION (GC-EAD), GC-MS, SYNTHESIS AND FIELD BIOASSAYS ALLOWED US TO IDENTIFY THE VOLATILES INVOLVED IN THE INTERACTION BETWEEN THE ORCHID DRAKAEA GLYPTODON AND ITS SEXUALLY ATTRACTED MALE THYNNINE WASP POLLINATOR, ZASPILOTHYNNUS TRILOBATUS. THREE ALKYLPYRAZINES AND ONE NOVEL HYDROXYMETHYL PYRAZINE WERE IDENTIFIED AS THE SEX PHEROMONE OF Z. TRILOBATUS AND ARE ALSO USED BY D. GLYPTODON FOR POLLINATOR ATTRACTION. GIVEN THAT OUR FINDINGS REVEALED A NEW CHEMICAL SYSTEM FOR PLANTS, WE SURVEYED WIDELY ACROSS REPRESENTATIVE ORCHID TAXA FOR THE PRESENCE OF THESE COMPOUNDS. WITH ONE EXCEPTION, OUR CHEMICAL SURVEY FAILED TO DETECT PYRAZINES IN RELATED GENERA. COLLECTIVELY, NO EVIDENCE FOR PREADAPTATION WAS FOUND. THE CHEMISTRY OF SEXUAL DECEPTION IS MORE DIVERSE THAN PREVIOUSLY KNOWN. OUR RESULTS SUGGEST THAT EVOLUTIONARY NOVELTY MAY HAVE PLAYED A KEY ROLE IN THE EVOLUTION OF SEXUAL DECEPTION AND HIGHLIGHT THE VALUE OF INVESTIGATING UNUSUAL POLLINATION SYSTEMS FOR ADVANCING OUR UNDERSTANDING OF THE ROLE OF CHEMISTRY IN EVOLUTION.",DRAKAEA; FLORAL VOLATILE; ORCHIDACEAE; POLLINATION; PYRAZINE; SEMIOCHEMICAL; SEX PHEROMONE; SEXUAL DECEPTION,FLORAL ODOR CHEMISTRY; CHEMICAL COMMUNICATION; PLANT VOLATILES; ANASTREPHA-SERPENTINA; DRIVEN SPECIATION; WASPS HYMENOPTERA; GENETIC-ANALYSIS; MARINE-BACTERIA; PRIVATE CHANNEL; BEE POLLINATOR,ENGLISH,ARTICLE,ARTICLE,58,"PEAKALL, R (REPRINT AUTHOR), AUSTRALIAN NATL UNIV, RES SCH BIOL, GPO BOX 4, CANBERRA, ACT 0200, AUSTRALIA.;BOHMAN, BJOERN, PHILLIPS, RYAN D., PEAKALL, ROD, AUSTRALIAN NATL UNIV, RES SCH BIOL, CANBERRA, ACT 0200, AUSTRALIA.;BOHMAN, BJOERN, BERNTSSON, BEN W., BARROW, RUSSELL A., AUSTRALIAN NATL UNIV, RES SCH CHEM, CANBERRA, ACT 0200, AUSTRALIA.;BOHMAN, BJOERN, FLEMATTI, GAVIN R., PEAKALL, ROD, UNIV WESTERN AUSTRALIA, SCH CHEM \& BIOCHEM, CRAWLEY, WA 6009, AUSTRALIA.;PHILLIPS, RYAN D., MENZ, MYLES H. M., DIXON, KINGSLEY W., BOT GARDEN \& PARKS AUTHOR, KINGS PK \& BOT GARDEN, PERTH, WA 6005, AUSTRALIA.;PHILLIPS, RYAN D., MENZ, MYLES H. M., DIXON, KINGSLEY W., UNIV WESTERN AUSTRALIA, SCH PLANT BIOL, CRAWLEY, WA 6009, AUSTRALIA.;MENZ, MYLES H. M., UNIV BERN, INST ECOL \& EVOLUT, CH-3012 BERN, SWITZERLAND.",10.1111/NPH.12800,"111 RIVER ST, HOBOKEN 07030-5774, NJ USA",NA,"AUSTRALIAN RESEARCH COUNCILAUSTRALIAN RESEARCH COUNCIL [LP0989338, LP110100408]; ARC FUTURE FELLOWSHIPAUSTRALIAN RESEARCH COUNCIL [FT110100304]","WE THANK L. JEFFARES FOR TECHNICAL ASSISTANCE IN THE LABORATORY AND L. BYRNE FROM THE CENTRE FOR MICROSCOPY CHARACTERISATION AND ANALYSIS (UWA) FOR ASSISTANCE WITH NMR. B. B. AND R. P. CONDUCTED PART OF THIS WORK WHILE BEING HOSTED AS VISITING FELLOWS AT THE UNIVERSITY OF WESTERN AUSTRALIA. WE ALSO THANK STEFAN DOTTERL AND TWO ADDITIONAL REFEREES FOR THEIR INSIGHTFUL COMMENTS, WHICH IMPROVED THE MANUSCRIPT. THIS STUDY WAS SUPPORTED BY AUSTRALIAN RESEARCH COUNCIL GRANTS TO R. P., K. W. D. AND R. A. B. (LP0989338 AND LP110100408) AND AN ARC FUTURE FELLOWSHIP TO G.R.F. (FT110100304).",0028-646X,3,939-952,WILEY,203,2014,ISI000339556300022,108,PLANT SCIENCES,102,PLANT SCIENCES,ROD.PEAKALLANU.EDU.AU,AM0SF,"PEAKALL, R (REPRINT AUTHOR), AUSTRALIAN NATL UNIV, RES SCH BIOL, GPO BOX 4, CANBERRA, ACT 0200, AUSTRALIA",ISI,none,AUSTRALIAN NATL UNIV;AUSTRALIAN NATL UNIV;UNIV WESTERN AUSTRALIA;UNIV WESTERN AUSTRALIA;UNIV BERN,AUSTRALIAN NATL UNIV,NA,"BOHMAN B, 2014, NEW PHYTOL","BOHMAN B, 2014, NEW PHYTOL",NA,NA,NA,NA
DE LUCA PA;COX DA;VALLEJO-MARIN M,DE LUCA PA,COMPARISON OF POLLINATION AND DEFENSIVE BUZZES IN BUMBLEBEES INDICATES SPECIES-SPECIFIC AND CONTEXT-DEPENDENT VIBRATIONS,NATURWISSENSCHAFTEN,NATURWISSENSCHAFTEN,"BEES PRODUCE VIBRATIONS IN MANY CONTEXTS, INCLUDING FOR DEFENSE AND WHILE FORAGING. BUZZ POLLINATION IS A UNIQUE FORAGING BEHAVIOR IN WHICH BEES VIBRATE THE ANTHERS OF FLOWERS TO EJECT POLLEN WHICH IS THEN COLLECTED AND USED AS FOOD. THE RELATIONSHIPS BETWEEN BUZZING PROPERTIES AND POLLEN RELEASE ARE WELL UNDERSTOOD, BUT IT IS LESS CLEAR TO WHAT EXTENT BUZZING VIBRATIONS VARY AMONG SPECIES, EVEN THOUGH SUCH INFORMATION IS CRUCIAL TO UNDERSTANDING THE FUNCTIONAL RELATIONSHIPS BETWEEN BEES AND BUZZ-POLLINATED PLANTS. OUR GOALS IN THIS STUDY WERE (1) TO EXAMINE WHETHER POLLINATION BUZZES DIFFER FROM THOSE PRODUCED DURING DEFENSE, (2) TO EVALUATE THE SIMILARITY OF BUZZES BETWEEN DIFFERENT SPECIES OF BUMBLEBEES (BOMBUS SPP.), AND (3) TO DETERMINE IF BODY SIZE AFFECTS THE EXPRESSION OF BUZZING PROPERTIES. WE FOUND THAT RELATIVE PEAK AMPLITUDE, PEAK FREQUENCY, AND DURATION WERE SIGNIFICANTLY DIFFERENT BETWEEN SPECIES, BUT ONLY RELATIVE PEAK AMPLITUDE DIFFERED BETWEEN POLLINATION AND DEFENSIVE BUZZES. THERE WERE SIGNIFICANT INTERACTIONS BETWEEN SPECIES AND BUZZ TYPE FOR PEAK FREQUENCY AND DURATION, REVEALING THAT SPECIES DIFFERED IN THEIR PATTERNS OF EXPRESSION IN THESE BUZZ PROPERTIES DEPENDING ON THE CONTEXT. THE ONLY PARAMETER AFFECTED BY BODY SIZE WAS DURATION, WITH LARGER BEES PRODUCING SHORTER BUZZES. OUR FINDINGS SUGGEST THAT ALTHOUGH POLLINATION AND DEFENSIVE BUZZES DIFFER IN SOME PROPERTIES, VARIABILITY IN BUZZ STRUCTURE ALSO EXHIBITS A MARKED SPECIES-SPECIFIC COMPONENT. SPECIES DIFFERENCES IN POLLINATION BUZZES MAY HAVE IMPORTANT IMPLICATIONS FOR FORAGING PREFERENCES IN BUMBLEBEES, ESPECIALLY IF BEES SELECT FLOWERS BEST MATCHED TO RELEASE POLLEN FOR THEIR SPECIFIC BUZZING CHARACTERISTICS.",BODYSIZE; BOMBUS; BUZZPOLLINATION; DEFENSIVE BUZZES; POLLEN FORAGING; SONICATION,DIVISION-OF-LABOR; FUNCTIONAL-SIGNIFICANCE; PORICIDAL ANTHERS; POLLEN; FLOWERS; BOMBUS; BEES; HYMENOPTERA; SONICATION; BEHAVIOR,ENGLISH,ARTICLE,ARTICLE,18,"DE LUCA, PA (REPRINT AUTHOR), ITHACA COLL, DEPT BIOL, ITHACA, NY 14850 USA.;DE LUCA, PAUL A., ITHACA COLL, DEPT BIOL, ITHACA, NY 14850 USA.;COX, DARRYL A., VALLEJO-MARIN, MARIO, UNIV STIRLING, STIRLING FK9 4LA, SCOTLAND.",10.1007/S00114-014-1161-7,"233 SPRING ST, NEW YORK, NY 10013 USA",NA,ROYAL SOCIETY OF LONDONROYAL SOCIETY OF LONDON [RG2010R1]; SCOTTISH PLANT HEALTH LICENSE [PH/29/2012],WE THANK K. BROCHU AND G. LYE FOR THE HELPFUL COMMENTS ON EARLIER DRAFTS OF THIS MANUSCRIPT AND FOR PROVIDING BUMBLEBEE ADVICE. THIS RESEARCH WAS SUPPORTED BY A ROYAL SOCIETY OF LONDON RESEARCH GRANT (RG2010R1) AND A SCOTTISH PLANT HEALTH LICENSE (PH/29/2012) TO MVM.,0028-1042,4,331-338,SPRINGER,101,2014,ISI000334069400008,40,SCIENCE \& TECHNOLOGY - OTHER TOPICS,51,MULTIDISCIPLINARY SCIENCES,PDELUCAITHACA.EDU,AE6AB,"DE LUCA, PA (REPRINT AUTHOR), ITHACA COLL, DEPT BIOL, ITHACA, NY 14850 USA",ISI,none,ITHACA COLL;UNIV STIRLING,ITHACA COLL,NA,"DE LUCA PA, 2014, NATURWISSENSCHAFTEN","DE LUCA PA, 2014, NATURWISSENSCHAFTEN",NA,NA,NA,NA
O'HANLON JC,O'HANLON JC,THE ROLES OF COLOUR AND SHAPE IN POLLINATOR DECEPTION IN THE ORCHID MANTIS HYMENOPUS CORONATUS,ETHOLOGY,ETHOLOGY,"THE ORCHID MANTIS HYMENOPUS CORONATUS (INSECTA: MANTODEA) IS A DECEPTIVE PREDATOR THAT ATTRACTS POLLINATORS AS PREY. THEIR RESEMBLANCE TO A FLOWER HAS GIVEN RISE TO THE HYPOTHESIS THAT THEY ARE FLOWER MIMICS. HOWEVER, FLORAL MIMICRY AS A PREDATORY STRATEGY, AND IN PARTICULAR, HOW PREDATORY FLORAL MIMICRY FUNCTIONS AT A MECHANISTIC LEVEL IS POORLY UNDERSTOOD. TWO MAIN MORPHOLOGICAL CHARACTERISTICS ARE THOUGHT TO MAKE ORCHID MANTISES APPEAR SIMILAR TO FLOWERS AND THUS ATTRACTIVE TO POLLINATORS: (1) THEIR FLOWER-LIKE' WHITE COLOURATION AND (2) THEIR PETAL-SHAPED' EXPANSIONS OF EXOSKELETON ON THEIR MID-FEMUR AND HIND FEMUR (FEMORAL LOBES). I INVESTIGATED THE CONTRIBUTION OF THESE COLOUR AND SHAPE CHARACTERISTICS TO POLLINATOR ATTRACTION USING ARTIFICIAL ORCHID MANTIS MODELS. MODELS WITH THE FLOWER-LIKE' WHITE COLOURATION OF THE ORCHID MANTIS HAD HIGHER RATES OF POLLINATOR INSPECTION THAN BROWN MODELS. MANIPULATING OVERALL BODY SHAPE BY REMOVING OR CHANGING THE ORIENTATION OF THE PETAL-SHAPED' FEMORAL LOBES DID NOT AFFECT THE ATTRACTIVENESS OF MODELS. AS CERTAIN FLOWER-LIKE CHARACTERISTICS (SYMMETRY AND PETALS) DID NOT AFFECT THE ATTRACTIVENESS OF MODELS, POLLINATORS MAY NOT NECESSARILY COGNITIVELY MISCLASSIFY ORCHID MANTISES AS FLOWERS. RATHER, MANTISES MAY BE EXPLOITING SENSORY BIASES OF THEIR POLLINATOR PREY, AND THEIR UV-ABSORBING WHITE COLOURATION MAY BE SUFFICIENT TO LURE POLLINATORS. THE EFFECTIVENESS OF USING ARTIFICIAL MODELS ESTABLISHED HERE PROVIDES A BASIS FOR FUTURE RESEARCH INTO ORCHID MANTIS MORPHOLOGY AND THE FINE-SCALE INTERACTIONS BETWEEN ORCHID MANTISES AND POLLINATORS.",MIMICRY; PECKHAMIAN; SENSORY EXPLOITATION; HYMENOPODIDAE,BUMBLEBEES BOMBUS-TERRESTRIS; AGGRESSIVE MIMICRY; INNATE PREFERENCE; FLOWER CONSTANCY; VISION; PERCEPTION; EVOLUTION; PATTERNS; SYMMETRY; BEHAVIOR,ENGLISH,ARTICLE,ARTICLE,10,"O'HANLON, JC (REPRINT AUTHOR), MACQUARIE UNIV, DEPT BIOL SCI, N RYDE, NSW 2109, AUSTRALIA.;MACQUARIE UNIV, DEPT BIOL SCI, N RYDE, NSW 2109, AUSTRALIA.",10.1111/ETH.12238,"111 RIVER ST, HOBOKEN 07030-5774, NJ USA",NA,MACQUARIE UNIVERSITY; NATIONAL GEOGRAPHIC COMMITTEE FOR RESEARCH AND EXPLORATIONNATIONAL GEOGRAPHIC SOCIETY,"I AM INDEBTED TO Y. NORMA-RASHID, G. I. HOLWELL, K. D. L. UMBERS AND F. SOLEY FOR ASSISTANCE WITH FIELD OBSERVATIONS. M. E. HERBERSTEIN AND G. I. HOLWELL PROVIDED CONSTRUCTIVE FEEDBACK ON THE ANALYSES AND MANUSCRIPT. FUNDING WAS PROVIDED BY MACQUARIE UNIVERSITY AND THE NATIONAL GEOGRAPHIC COMMITTEE FOR RESEARCH AND EXPLORATION. THE AUTHOR DECLARES NO CONFLICT OF INTEREST.",0179-1613,7,652-661,WILEY,120,2014,ISI000337584600004,55,"PSYCHOLOGY, BEHAVIORAL SCIENCES, ZOOLOGY",149,"PSYCHOLOGY, BIOLOGICAL, BEHAVIORAL SCIENCES, ZOOLOGY",JAMES.OHANLONMQ.EDU.AU,AJ3RJ,"O'HANLON, JC (REPRINT AUTHOR), MACQUARIE UNIV, DEPT BIOL SCI, N RYDE, NSW 2109, AUSTRALIA",ISI,none,MACQUARIE UNIV,MACQUARIE UNIV,NA,"O'HANLON JC, 2014, ETHOLOGY","O'HANLON JC, 2014, ETHOLOGY",NA,NA,NA,NA
GILL KA;COX R;O'NEAL ME,GILL KA,QUALITY OVER QUANTITY: BUFFER STRIPS CAN BE IMPROVED WITH SELECT NATIVE PLANT SPECIES,ENVIRONMENTAL ENTOMOLOGY,ENVIRON. ENTOMOL.,"NATIVE PLANTS ATTRACTIVE TO BENEFICIAL INSECTS MAY IMPROVE THE VALUE OF BUFFER STRIPS BY INCREASING BIODIVERSITY AND ENHANCING THE DELIVERY OF INSECT-DERIVED ECOSYSTEM SERVICES. IN A 2-YR FIELD EXPERIMENT, WE MEASURED THE RESPONSE OF INSECT COMMUNITIES ACROSS NINE BUFFERS THAT VARIED IN PLANT DIVERSITY. WE CONSTRUCTED BUFFERS WITH PLANTS COMMONLY FOUND IN BUFFERS OF USDA-CERTIFIED ORGANIC FARMS IN IOWA (TYPICALLY A SINGLE SPECIES), RECOMMENDED FOR PRAIRIE RECONSTRUCTION, OR RECOMMENDED FOR ATTRACTING BENEFICIAL INSECTS. WE HYPOTHESIZED THAT THE DIVERSITY AND ABUNDANCE OF BENEFICIAL INSECTS WILL BE 1) GREATEST IN BUFFERS COMPOSED OF DIVERSE PLANT COMMUNITIES WITH CONTINUOUS AVAILABILITY OF FLORAL RESOURCES, 2) INTERMEDIATE IN BUFFERS WITH REDUCED SPECIES RICHNESS AND AVAILABILITY OF FLORAL RESOURCES, AND 3) LOWEST IN BUFFERS COMPOSED OF A SINGLE SPECIES. WE OBSERVED A SIGNIFICANT POSITIVE RELATIONSHIP BETWEEN THE DIVERSITY AND ABUNDANCE OF BENEFICIAL INSECTS WITH PLANT COMMUNITY DIVERSITY AND THE NUMBER OF FLOWERS. MORE BENEFICIAL INSECTS WERE COLLECTED IN BUFFERS COMPOSED OF SPECIES SELECTED FOR THEIR ATTRACTIVENESS TO BENEFICIAL INSECTS THAN A COMMUNITY RECOMMENDED FOR PRAIRIE RESTORATION. THESE DIFFERENCES SUGGEST 1) PLANT COMMUNITIES THAT DOMINATE EXISTING BUFFERS ARE NOT OPTIMAL FOR ATTRACTING BENEFICIAL INSECTS, 2) ADDING FLOWERING PERENNIAL SPECIES COULD IMPROVE BUFFERS AS HABITAT FOR BENEFICIAL INSECTS, 3) BUFFERS CAN BE OPTIMIZED BY INTENTIONALLY COMBINING THE MOST ATTRACTIVE NATIVE SPECIES EVEN AT MODEST LEVELS OF PLANT DIVERSITY, AND 4) PLANT COMMUNITIES RECOMMENDED FOR PRAIRIE RECONSTRUCTION MAY NOT CONTAIN THE OPTIMAL SPECIES OR DENSITY OF THE MOST ATTRACTIVE SPECIES NECESSARY TO SUPPORT BENEFICIAL INSECTS FROM MULTIPLE GUILDS.",HABITAT MANAGEMENT; FLORAL PROVISIONING; BIODIVERSITY-ECOSYSTEM FUNCTION; POLLINATION; BIOLOGICAL CONTROL,CONSERVATION BIOLOGICAL-CONTROL; AGRICULTURAL LANDSCAPES; NATURAL ENEMIES; BENEFICIAL ARTHROPODS; HABITAT MANAGEMENT; ECOSYSTEM SERVICES; BEES HYMENOPTERA; PEST-MANAGEMENT; SOYBEAN APHID; ABUNDANCE,ENGLISH,ARTICLE,ARTICLE,13,"O'NEAL, ME (REPRINT AUTHOR), IOWA STATE UNIV, DEPT ENTOMOL, AMES, IA 50011 USA.;GILL, K. A., O'NEAL, M. E., IOWA STATE UNIV, DEPT ENTOMOL, AMES, IA 50011 USA.;COX, R., CIMMYT, TEXCOCO, EDO DE MEXICO, MEXICO.",10.1603/EN13027,"3 PARK PLACE, STE 307, ANNAPOLIS, MD 21401-3722 USA",NA,LEOPOLD CENTER FOR SUSTAINABLE AGRICULTURE,"WE THANK BRENT PRINGNITZ FOR ASSISTANCE WITH FIELD MAINTENANCE AND RESEARCH DEMONSTRATIONS, NICHOLAS SCHMIDT FOR ASSISTANCE WITH PLOT CONSTRUCTION, ION EXCHANGE INC. FOR ASSISTANCE WITH SEEDLINGS AND PLANTING ADVICE, AND RICK AND STACEY HARTMANN FOR PROPAGATING AND PROVIDING WILLOW CUTTINGS. WE ACKNOWLEDGE THE EFFORT OF MANY INDIVIDUALS WHO HELPED WITH PLANTING, WEEDING, DATA COLLECTION, AND ASSISTED IN ALL ASPECTS OF THIS STUDY. WE THANK DRS. LISA SCHULTE MOORE AND MARY HARRIS FOR REVIEWING AN EARLIER VERSION OF THIS MANUSCRIPT, AS WELL AS THE ANONYMOUS REVIEWERS WHOSE SUGGESTIONS GREATLY IMPROVED THIS MANUSCRIPT. THIS RESEARCH WAS FUNDED BY THE LEOPOLD CENTER FOR SUSTAINABLE AGRICULTURE.",0046-225X,2,298-311,ENTOMOLOGICAL SOC AMER,43,2014,ISI000337694500006,57,ENTOMOLOGY,71,ENTOMOLOGY,ONEALIASTATE.EDU,AJ5BC,"O'NEAL, ME (REPRINT AUTHOR), IOWA STATE UNIV, DEPT ENTOMOL, AMES, IA 50011 USA",ISI,none,IOWA STATE UNIV,IOWA STATE UNIV,NA,"GILL KA, 2014, ENVIRON ENTOMOL","GILL KA, 2014, ENVIRON ENTOMOL",NA,NA,NA,NA
SYDENHAM MAK;MOE SR;TOTLAND O;ELDEGARD K,SYDENHAM MAK,DOES MULTI-LEVEL ENVIRONMENTAL FILTERING DETERMINE THE FUNCTIONAL AND PHYLOGENETIC COMPOSITION OF WILD BEE SPECIES ASSEMBLAGES?,ECOGRAPHY,ECOGRAPHY,"A CENTRAL GOAL IN ECOLOGY IS TO DEVELOP THEORIES THAT EXPLAIN THE DIVERSITY AND DISTRIBUTION OF SPECIES. THE EVOLUTIONARY HISTORY OF SPECIES AND THEIR FUNCTIONAL TRAITS MAY PROVIDE MECHANISTIC LINKS BETWEEN COMMUNITY ASSEMBLY AND THE ENVIRONMENT. SUCH LINKS MAY BE HIERARCHICALLY STRUCTURED SUCH THAT THE STRENGTH OF ENVIRONMENTAL FILTERING DECREASES IN A STEP-WISE MANNER FROM REGIONAL CONDITIONS THROUGH LANDSCAPE HETEROGENEITY TO LOCAL HABITAT CONDITIONS. WE SAMPLED THE WILD BEE SPECIES ASSEMBLAGES IN POWER-LINE STRIPS TRANSECTING FORESTS IN SOUTH-EASTERN NORWAY. WE USED ALTITUDE, LANDSCAPE DIVERSITY SURROUNDING SITES AND PLANT SPECIES COMPOSITION, TOGETHER WITH TOTAL PLANT COVER AS PROXIES FOR REGIONAL, LANDSCAPE AND LOCAL ENVIRONMENTAL FILTERS, RESPECTIVELY. THE SPECIES RICHNESS AND ABUNDANCE OF WILD BEES DECREASED WITH ALTITUDE. THE REDUCTION IN SPECIES RICHNESS AND ABUNDANCE WAS ACCOMPANIED BY A PHYLOGENETIC CLUSTERING OF WILD BEE INDIVIDUALS. FURTHERMORE, REGIONAL FILTERS FOLLOWED BY LOCAL FILTERS BEST EXPLAINED THE STRUCTURE OF THE FUNCTIONAL SPECIES COMPOSITION. SITES AT HIGH ALTITUDES AND SITES WITH ERICACEAE-DOMINATED PLANT COMMUNITIES TENDED TO HAVE LARGER BEES AND A HIGHER PROPORTION OF SOCIAL AND SPRING-EMERGING BEES. WHEN BOMBUS SPECIES WERE EXCLUDED FROM THE ANALYSIS, THE PROPORTION OF POLLEN SPECIALISTS INCREASED WITH THE DOMINANCE OF ERICACEAE. FURTHERMORE, WE ALSO FOUND THAT THE TAXONOMIC, PHYLOGENETIC AND FUNCTIONAL COMPOSITIONAL TURNOVER BETWEEN SITES WAS HIGHER IN THE NORTHERN REGION THAN IN THE SOUTHERN PART OF THE STUDY REGION. ALTOGETHER, THESE RESULTS SUGGEST THAT REGIONAL FILTERS DRIVE THE SPECIES RICHNESS AND ABUNDANCE IN TRAIT-GROUPS WHEREAS LOCAL FILTERS HAVE MORE DESCRETE SORTING EFFECTS. WE CONCLUDE THAT THE MODEL OF MULTI-LEVEL ENVIRONMENTAL FILTERS PROVIDES A GOOD CONCEPTUAL MODEL FOR COMMUNITY ECOLOGY. WE SUGGEST THAT FUTURE STUDIES SHOULD FOCUS ON THE RELATIONSHIP BETWEEN THE BIOGEOGRAPHICAL HISTORY OF SPECIES AND THEIR CURRENT DISTRIBUTION, AND ON THE ASSUMPTION THAT CLOSELY RELATED SPECIES DO INDEED COMPETE MORE INTENSELY THAN DISTANTLY RELATED SPECIES.",NA,COMMUNITY ECOLOGY; POLLINATOR COMMUNITIES; FORAGING RANGES; SOLITARY BEES; DIVERSITY; TRAITS; EVOLUTION; HYMENOPTERA; SCALE; DIVERSIFICATION,ENGLISH,ARTICLE,ARTICLE,15,"SYDENHAM, MAK (REPRINT AUTHOR), NORWEGIAN UNIV LIFE SCI, DEPT ECOL \& NAT RESOURCE MANAGEMENT, POB 5003, NO-1432 AS, NORWAY.;SYDENHAM, MARKUS ARNE KJAER, MOE, STEIN R., TOTLAND, ORJAN, ELDEGARD, KATRINE, NORWEGIAN UNIV LIFE SCI, DEPT ECOL \& NAT RESOURCE MANAGEMENT, NO-1432 AS, NORWAY.",10.1111/ECOG.00938,"111 RIVER ST, HOBOKEN 07030-5774, NJ USA",NA,STATNETT,"WE WISH TO THANK DAG SLETTEBO, ARE ENDAL ROGNES, ADRIAN RASMUSSEN, HAKON CELIUS, LISBETH NORDTILLER, TORBJORN KORNSTAD, MORTEN MELAND, MARTE LILLEENG, RONNY STEEN AND JOHN GUNNAR DOKK FOR FIELD AND LABORATORY ASSISTANCE. AGNES KAMMERHOFER PREPARED THE GIS MAPS. KJELL MAGNE OLSEN IDENTIFIED ALL BOMBUS SPECIES. DATA COLLECTION AND SPECIES IDENTIFICATION WAS FUNDED BY STATNETT.",0906-7590,2,140-153,WILEY-BLACKWELL,38,2015,ISI000349463400005,65,"BIODIVERSITY \& CONSERVATION, ENVIRONMENTAL SCIENCES \& ECOLOGY",81,"BIODIVERSITY CONSERVATION, ECOLOGY",MARKUS.SYDENHAMNMBU.NO,CB2NC,"SYDENHAM, MAK (REPRINT AUTHOR), NORWEGIAN UNIV LIFE SCI, DEPT ECOL \& NAT RESOURCE MANAGEMENT, POB 5003, NO-1432 AS, NORWAY",ISI,none,NORWEGIAN UNIV LIFE SCI,NORWEGIAN UNIV LIFE SCI,NA,"SYDENHAM MAK, 2015, ECOGRAPHY","SYDENHAM MAK, 2015, ECOGRAPHY",NA,NA,NA,NA
TOME HVV;BARBOSA WF;CORREA AS;GONTIJO LM;MARTINS GF;GUEDES RNC,TOME HVV,REDUCED-RISK INSECTICIDES IN NEOTROPICAL STINGLESS BEE SPECIES: IMPACT ON SURVIVAL AND ACTIVITY,ANNALS OF APPLIED BIOLOGY,ANN. APPL. BIOL.,"AS HONEYBEES ARE THE MAIN POLLINATOR SUBJECT TO AN INTENSE RESEARCH REGARDING EFFECTS OF PESTICIDES, OTHER ECOLOGICALLY IMPORTANT NATIVE BEE POLLINATORS HAVE RECEIVED LITTLE ATTENTION IN ECOTOXICOLOGY AND RISK ASSESSMENT OF PESTICIDES IN GENERAL, AND INSECTICIDES IN PARTICULAR, SOME OF WHICH ARE PERCEIVED AS REDUCED-RISK COMPOUNDS. HERE, THE IMPACT OF THREE REDUCED-RISK INSECTICIDES - AZADIRACHTIN, SPINOSAD AND CHLORANTRANILIPROLE - WAS ASSESSED IN TWO SPECIES OF STINGLESS BEES, PARTAMONA HELLERI AND SCAPTOTRIGONA XANTHOTRICA, WHICH ARE IMPORTANT NATIVE POLLINATORS IN NEOTROPICAL AMERICA. THE NEONICOTINOID IMIDACLOPRID WAS USED AS A POSITIVE CONTROL. SPINOSAD EXHIBITED HIGH ORAL AND CONTACT TOXICITIES IN ADULT WORKERS OF BOTH SPECIES AT THE RECOMMENDED LABEL RATES, WITH MEDIAN SURVIVAL TIMES (LT(50)S) RANGING FROM 1 TO 4 H, WHEREAS THESE ESTIMATES WERE BELOW 15 MIN FOR IMIDACLOPRID. AZADIRACHTIN AND CHLORANTRANILIPROLE EXHIBITED LOW TOXICITY AT THE RECOMMENDED LABEL RATES, WITH NEGLIGIBLE MORTALITY THAT DID NOT ALLOW LT50 ESTIMATION. SUBLETHAL BEHAVIOURAL ASSESSMENTS OF THESE TWO INSECTICIDES INDICATED THAT NEITHER ONE OF THEM AFFECTED THE OVERALL GROUP ACTIVITY OF WORKERS OF THE TWO SPECIES. HOWEVER, BOTH AZADIRACHTIN AND CHLORANTRANILIPROLE IMPAIRED INDIVIDUAL FLIGHT TAKE-OFF OF P. HELLERI AND S. XANTHOTRICA WORKER BEES, WHICH MAY COMPROMISE FORAGING ACTIVITY, POTENTIALLY LEADING TO REDUCED COLONY SURVIVAL. THESE FINDINGS CHALLENGE THE COMMON PERCEPTION OF NON-TARGET SAFETY OF REDUCED-RISK INSECTICIDES AND BIOINSECTICIDES, PARTICULARLY REGARDING NATIVE POLLINATOR SPECIES.",BEHAVIOURAL IMPACT; BIOPESTICIDES; COLONY AND INDIVIDUAL LEVEL EFFECTS; NATIVE BEE POLLINATORS; SUBLETHAL EFFECTS,BOMBUS-IMPATIENS HYMENOPTERA; MELIPONA-QUADRIFASCIATA; FORAGING BEHAVIOR; BOTANICAL INSECTICIDE; NATURAL-PRODUCTS; HONEY-BEES; PESTICIDES; TOXICITY; SPINOSAD; NEONICOTINOIDS,ENGLISH,ARTICLE,ARTICLE,18,"GUEDES, RNC (REPRINT AUTHOR), UNIV FED VICOSA, DEPT ENTOMOL, BR-36570900 VICOSA, MG, BRAZIL.;TOME, H. V. V., BARBOSA, W. F., GUEDES, R. N. C., UNIV FED VICOSA, DEPT ENTOMOL, BR-36570900 VICOSA, MG, BRAZIL.;BARBOSA, W. F., UNIV GHENT, FAC BIOSCI ENGN, DEPT CROP PROTECT, B-9000 GHENT, BELGIUM.;CORREA, A. S., UNIV SAO PAULO, DEPT ENTOMOL \& ACAROL, ESCOLA SUPER AGR LUIZ DE QUEIROZ, PIRACICABA, BRAZIL.;GONTIJO, L. M., UNIV FED VICOSA, INST CIENCIAS AGR, FLORESTAL, BRAZIL.;MARTINS, G. F., UNIV FED VICOSA, DEPT BIOL GERAL, BR-36570900 VICOSA, MG, BRAZIL.",10.1111/AAB.12217,"111 RIVER ST, HOBOKEN 07030-5774, NJ USA",NA,ARTHUR BERNARDES FOUNDATION (FUNARBE); MINAS GERAIS STATE FOUNDATION FOR RESEARCH AID (FAPEMIG)MINAS GERAIS STATE RESEARCH FOUNDATION (FAPEMIG); NATIONAL COUNCIL OF SCIENTIFIC AND TECHNOLOGICAL DEVELOPMENT (CNPQ)NATIONAL COUNCIL FOR SCIENTIFIC AND TECHNOLOGICAL DEVELOPMENT (CNPQ); CAPES FOUNDATIONCAPES,"THANKS TO THE ARTHUR BERNARDES FOUNDATION (FUNARBE), THE MINAS GERAIS STATE FOUNDATION FOR RESEARCH AID (FAPEMIG), THE NATIONAL COUNCIL OF SCIENTIFIC AND TECHNOLOGICAL DEVELOPMENT (CNPQ) AND THE CAPES FOUNDATION FOR THE FINANCIAL SUPPORT PROVIDED. THE COMMENTS AND SUGGESTIONS PROVIDED BY THE EDITOR AND TWO ANONYMOUS REVIEWERS WERE ALSO GREATLY APPRECIATED.",0003-4746,2,186-196,WILEY,167,2015,ISI000359062900003,68,AGRICULTURE,83,"AGRICULTURE, MULTIDISCIPLINARY",GUEDESUFV.BR,CO3MV,"GUEDES, RNC (REPRINT AUTHOR), UNIV FED VICOSA, DEPT ENTOMOL, BR-36570900 VICOSA, MG, BRAZIL",ISI,none,UNIV FED VICOSA;UNIV GHENT;UNIV SAO PAULO;UNIV FED VICOSA;UNIV FED VICOSA,UNIV FED VICOSA,NA,"TOME HVV, 2015, ANN APPL BIOL","TOME HVV, 2015, ANN APPL BIOL",NA,NA,NA,NA
