AU,first_author,TI,SO,JI,AB,DE,ID,LA,DT,DT2,TC,C1,DI,PA,AR,FU,FX,SN,PN,PP,PU,VL,PY,UT,NR,SC,U2,WC,EM,GA,RP,DB,CR,AU_UN,AU1_UN,AU_UN_NR,SR_FULL,SR,SE,BO,BE,BN
MATSUMOTO S;ABE A;MAEJIMA T,MATSUMOTO S,FORAGING BEHAVIOR OF OSMIA CORNIFRONS IN AN APPLE ORCHARD,SCIENTIA HORTICULTURAE,SCI. HORTIC.,"AN APPLE ORCHARD CONSISTING OF A SINGLE COMMERCIAL CULTIVAR AND OF POLLINIZERS SUCH AS CRAB APPLES UNDER THE CONDITION OF NATURAL POLLINATION NEEDS POLLINATORS FOR STABLE FRUIT PRODUCTION. WE INVESTIGATED THE FORAGING BEHAVIOR OF POLLINATORS, ESPECIALLY OSMIA CORNIFRONS RADOSZKOWSKI, IN ORDER TO EVALUATE THEIR USE INSTEAD OF HONEYBEES. O. CORNIFRONS SHOWED STRONG FLOWER CONSTANCY FOR 4-8 MIN DURING ONE POLLEN-NECTAR FORAGING TRIP, AS OBSERVED IN HONEYBEES. HOWEVER, THE BEES SEEMED TO FORAGE FOR DIFFERENT TYPES OF FLOWERS, E.G. FROM A RED TO A WHITE PETAL COLOR, DURING THEIR 16-22 POLLEN-NECTAR FORAGING TRIPS BASED ON THE S-RNASE ALLELE AND SIMPLE SEQUENCE REPEAT (SSR) ANALYSES OF POLLEN LOAVES MADE DURING THOSE TRIPS. AFTER ONE POLLEN-NECTAR FORAGING TRIP, THE BEES BRUSHED THEIR ABDOMEN WITH THEIR HIND LEGS AT A NESTER TUBE, BUT CA. 10\% OF POLLEN WAS NOT BRUSHED FROM THEIR BODIES. THE REMAINING POLLEN ON THE BODY RETAINED THE ABILITY FOR THE FERTILIZATION OF APPLE FOR 12 DAYS, SUGGESTING THAT THE POLLEN ON THE POLLINATOR'S BODY FROM A POLLINIZER COULD BE USED FOR THE FERTILIZATION OF A COMMERCIAL CULTIVAR VISITED ON THEIR NEXT FORAGING TRIP. O. CORNIFRONS SEEMS TO BE A USEFUL POLLINATOR IN APPLE ORCHARDS CONSISTING OF A SINGLE CULTIVAR, SUCH AS, `FUJI', AND OF POLLINIZERS OF DIFFERENT TYPES, SUCH AS THE RED PETAL COLOR TYPE, `MAYPOLE' OR `MAKAMIK'. MOREOVER, MOST POLLEN LOAVES INVESTIGATED CONTAINED S-28-RNASE ALLELE, WHICH WAS SPECIFIC FOR POLLEN OF `STARKING DELICIOUS' PLANTED AT A GREAT DISTANCE (55.2 M) FROM THE NESTINY SHELTER, SUGGESTING THAT O. CORNIFRONS IS A USEFUL POLLINATOR FOR `DELICIOUS', WHICH IS DIFFICULT FOR HONEYBEES TO USE AS A POLLINATOR FOR ITS SIDEWORKING BEHAVIOR. (C) 2009 ELSEVIER B.V. ALL RIGHTS RESERVED.",OSMIA CORNIFRONS; APPLE POLLINATORS; S-RNASE; SSR; `FUJI',S-RNASE ANALYSIS; IDENTIFICATION; CULTIVARS; ALLELE; CDNA; SEQUENCES; MARKERS; SET; PCR,ENGLISH,ARTICLE,ARTICLE,12,"MATSUMOTO, S (REPRINT AUTHOR), GIFU UNIV, FAC EDUC, DEPT BIOL, GIFU 5011193, JAPAN.;MATSUMOTO, SHOGO, ABE, AYUMI, GIFU UNIV, FAC EDUC, DEPT BIOL, GIFU 5011193, JAPAN.;MAEJIMA, TSUTOMU, NAGANO FRUIT TREE EXPT STN, NAGANO 3820072, JAPAN.;MATSUMOTO, SHOGO, NAGOYA UNIV, GRAD SCH BIOAGR SCI, CHIKUSA KU, NAGOYA, AICHI 4648601, JAPAN.",10.1016/J.SCIENTA.2009.01.003,"PO BOX 211, 1000 AE AMSTERDAM, NETHERLANDS",NA,RESEARCH PROJECT FOR UTILIZING ADVANCED TECHNOLOGIES,"THIS RESEARCH WAS SUPPORTED BY THE RESEARCH PROJECT FOR UTILIZING ADVANCED TECHNOLOGIES IN AGRICULTURE, FORESTRY AND FISHERIES.",0304-4238,1,73-79,ELSEVIER SCIENCE BV,121,2009,ISI000266149700012,20,AGRICULTURE,25,HORTICULTURE,SHMATSUMGIFU-U.AC.JP,446VN,"MATSUMOTO, S (REPRINT AUTHOR), GIFU UNIV, FAC EDUC, DEPT BIOL, GIFU 5011193, JAPAN",ISI,none,GIFU UNIV;NAGOYA UNIV,GIFU UNIV,NA,"MATSUMOTO S, 2009, SCI HORTIC","MATSUMOTO S, 2009, SCI HORTIC",NA,NA,NA,NA
WITJES S;ELTZ T,WITJES S,HYDROCARBON FOOTPRINTS AS A RECORD OF BUMBLEBEE FLOWER VISITATION,JOURNAL OF CHEMICAL ECOLOGY,J. CHEM. ECOL.,"BUMBLEBEES LEAVE TRACES OF CUTICULAR HYDROCARBONS ON FLOWERS THEY VISIT, WITH THE AMOUNT DEPOSITED BEING POSITIVELY RELATED TO THE NUMBER OF VISITS. WE ASKED WHETHER SUCH FOOTPRINT HYDROCARBONS ARE RETAINED ON FLOWERS FOR SUFFICIENTLY LONG PERIODS OF TIME SO AS TO REFLECT BEE VISITATION IN POLLINATION STUDIES. IN LABORATORY EXPERIMENTS, FLOWER COROLLAE (PRIMULA VERIS, DIGITALIS GRANDIFLORA) VISITED BY BOMBUS TERRESTRIS WORKERS RETAINED BEE-DERIVED NONACOSENES (C(29)H(58)) IN NEAR-UNCHANGED QUANTITIES FOR 24 HOURS, BOTH AT 15 AND 25A DEGREES C. ADDITIONALLY, SYNTHETIC (Z)-9-TRICOSENE APPLIED TO FLOWER COROLLAE OF THE DEADNETTLE LAMIUM MACULATUM WAS RETAINED FOR 48 HOURS IN AN UNCHANGED QUANTITY. IN A FIELD SURVEY, THE AMOUNT OF FOOTPRINT ALKENES ON FLOWERS OF COMFREY (SYMPHYTUM OFFICINALE) PLANTS WAS POSITIVELY CORRELATED WITH THE NUMBER OF BUMBLEBEE VISITS THAT THOSE PLANTS HAD RECEIVED DURING THE DAY. TOGETHER, THESE DATA SUGGEST THAT FLOWERS RETAIN A LONG-TERM QUANTITATIVE RECORD OF BUMBLEBEE VISITATION. THE ANALYSIS OF PETAL EXTRACTS BY GAS CHROMATOGRAPHY COULD PROVIDE A CHEAP AND RELIABLE WAY OF QUANTIFYING BUMBLEBEE VISITS IN LANDSCAPE SCALE STUDIES OF POLLINATION.",CUTICULAR HYDROCARBONS; CUTICULAR LIPIDS; FOOTPRINTS; BOMBUS; SCENT-MARKS; FLOWER VISIT; POLLINATION; POLLINATOR DECLINE,CUTICULAR HYDROCARBONS; SCENT MARKS; NESTMATE RECOGNITION; FORAGING BUMBLEBEES; POLISTES-DOMINULUS; CUES; WASP; BEE; ENTRANCE; SIGNALS,ENGLISH,ARTICLE,ARTICLE,22,"WITJES, S (REPRINT AUTHOR), UNIV DUSSELDORF, DEPT NEUROBIOL, SENSORY ECOL GRP, UNIV STR 1, D-40225 DUSSELDORF, GERMANY.;WITJES, SEBASTIAN, ELTZ, THOMAS, UNIV DUSSELDORF, DEPT NEUROBIOL, SENSORY ECOL GRP, D-40225 DUSSELDORF, GERMANY.",10.1007/S10886-009-9720-7,"VAN GODEWIJCKSTRAAT 30, 3311 GZ DORDRECHT, NETHERLANDS",NA,DFGGERMAN RESEARCH FOUNDATION (DFG) [EL249/3]; UNIVERSITY OF DUSSELDORF,"WE THANK KLAUS LUNAU AND THE MEMBERS OF THE SENSORY ECOLOGY GROUP FOR DISCUSSIONS AND COMMENTS ON THE MANUSCRIPT, AND THE PARTICIPANTS OF THE 2007 SENSORY ECOLOGY COURSE FOR THEIR HELP AND ENDURANCE DURING THE WILD COMFREY SURVEY. A SPECIAL THANKS TO ANDREAS FISCHBACH AND WILHELM ROGMANN OF THE BOTANICAL GARDEN OF THE UNIVERSITY OF DUSSELDORF FOR MAINTAINING THE PLANTS, AS WELL AS WALDEMAR SEIDEL OF THE FEINMECHANIKERWERKSTATT OF THE UNIVERSITY OF DUSSELDORF FOR THE PRODUCTION OF THE BUMBLEBEESNESTAND FEEDING BOXES. THIS STUDY WAS FUNDED BY THE DFG GRANT EL249/3 AND THE UNIVERSITY OF DUSSELDORF.",0098-0331,11,1320-1325,SPRINGER,35,2009,ISI000273086100006,32,"BIOCHEMISTRY \& MOLECULAR BIOLOGY, ENVIRONMENTAL SCIENCES \& ECOLOGY",29,"BIOCHEMISTRY \& MOLECULAR BIOLOGY, ECOLOGY",SEBASTIAN.WITJESUNI-DUESSELDORF.DE,537AV,"WITJES, S (REPRINT AUTHOR), UNIV DUSSELDORF, DEPT NEUROBIOL, SENSORY ECOL GRP, UNIV STR 1, D-40225 DUSSELDORF, GERMANY",ISI,none,UNIV DUSSELDORF,UNIV DUSSELDORF,NA,"WITJES S, 2009, J CHEM ECOL","WITJES S, 2009, J CHEM ECOL",NA,NA,NA,NA
GOMEZ JM;PERFECTTI F;BOSCH J;CAMACHO JPM,GOMEZ JM,A GEOGRAPHIC SELECTION MOSAIC IN A GENERALIZED PLANT-POLLINATOR-HERBIVORE SYSTEM,ECOLOGICAL MONOGRAPHS,ECOL. MONOGR.,"THE CONCEPT OF SELECTION MOSAIC IS CENTRAL TO THE GEOGRAPHIC MOSAIC THEORY OF COEVOLUTION. MOST INFORMATION ON COEVOLVING INTERACTIONS, HOWEVER, COMES FROM SPECIALIZED ORGANISMS. IN CONTRAST, AN ACCURATE UNDERSTANDING OF THE EFFECT OF GEOGRAPHICALLY VARYING EVOLUTIONARY DYNAMICS ON THE EVOLUTION OF GENERALIST ORGANISMS IS LACKING, ALTHOUGH THESE KINDS OF ORGANISMS ARE THE MOST FREQUENT IN NATURE. IN FLOWERING PLANTS, POLLINATORS AND HERBIVORES ARE IMPORTANT SELECTIVE AGENTS. IN THIS STUDY WE INVESTIGATE WHETHER A GEOGRAPHIC SELECTION MOSAIC FOR. ORAL TRAITS IN A GENERALIST PLANT, ERYSIMUM MEDIOHISPANICUM (BRASSICACEAE), CAN BE MEDIATED BY THE INTERPLAY OF MUTUALISTIC AND ANTAGONISTIC INTERACTING ORGANISMS. IN EIGHT POPULATIONS WE QUANTIFIED THE SELECTION EXERTED BY THESE ORGANISMS ON SEVERAL PLANT TRAITS. WE FOUND SIGNIFICANT SPATIAL VARIATION IN POLLINATOR ASSEMBLAGE. IN DIFFERENT POPULATIONS, THE MAIN POLLINATORS BELONGED TO DIFFERENT FUNCTIONAL GROUPS (BEEFLIES, LARGE BEES, SMALL BEES, AND BEETLES). DAMAGE BY UNGULATES ALSO VARIED AMONG POPULATIONS. CONSEQUENTLY, WE FOUND THAT DIFFERENT POPULATIONS WERE UNDER DIFFERENT SELECTIVE REGIMES, AND THE TRAITS AFFECTED BY SELECTION DEPENDED ON THE LOCAL INTERACTION INTENSITY WITH POLLINATORS AND MAMMAL HERBIVORES. SOME TRAITS, SUCH AS FLOWER NUMBER AND STALK HEIGHT, WERE SELECTED SIMILARLY IN MOST POPULATIONS. OTHER TRAITS, SUCH AS COROLLA DIAMETER AND TUBE LENGTH, WERE SELECTED ONLY IN SOME POPULATIONS. FINALLY, WE FOUND DIVERGENT SELECTION FOR SOME TRAITS, SUCH AS COROLLA TUBE WIDTH AND COROLLA SHAPE, WHICH WERE SELECTED IN CONTRASTING DIRECTIONS IN DIFFERENT LOCALITIES. THIS SPATIAL VARIATION IN SELECTIVE SCENARIOS RESULTS IN POPULATIONS WITH STRONG SELECTIVE REGIMES (HOT SPOTS) INTERMINGLED WITH POPULATIONS WITH WEAK SELECTIVE REGIMES (COLD SPOTS). FOUR IMPORTANT OUTCOMES EMERGE FROM THE E. MEDIOHISPANICUM SELECTION MOSAIC. (1) INTERACTIONS WITH GENERALIST ORGANISMS MAY PRODUCE STRONG SELECTION. (2) SPATIAL CHANGES IN MAIN POLLINATORS RESULT IN DIVERGENT SELECTION ACROSS POPULATIONS. (3) GEOGRAPHIC MOSAICS DEPEND ON A BALANCE BETWEEN MUTUALISTIC AND ANTAGONISTIC SELECTION. (4) SELECTION MOSAICS OPERATE AT FAIRLY SMALL SPATIAL SCALES. THESE FINDINGS WILL SURELY CONTRIBUTE TO EXPANDING THE CONCEPTUAL FRAMEWORK OF THE GEOGRAPHIC MOSAIC THEORY OF COEVOLUTION.",COROLLA SHAPE EVOLUTION; DIFFUSE SELECTION; DIVERGENT SELECTION; ERYSIMUM MEDIOHISPANICUM; GEOGRAPHIC MOSAIC THEORY OF COEVOLUTION; HERBIVORES; MULTISPECIFIC SYSTEMS; POLLINATORS; STRUCTURAL EQUATION MODELING,MEDIATED SELECTION; FLORAL TRAITS; ERYSIMUM-MEDIOHISPANICUM; SPATIAL VARIATION; REPRODUCTIVE SUCCESS; HOVERFLIES DIPTERA; NATURAL-SELECTION; LOCAL ADAPTATION; POPULATION-SIZE; SEED PREDATORS,ENGLISH,ARTICLE,ARTICLE,94,"GOMEZ, JM (REPRINT AUTHOR), UNIV GRANADA, DEPT ECOL, E-18071 GRANADA, SPAIN.;GOMEZ, J. M., UNIV GRANADA, DEPT ECOL, E-18071 GRANADA, SPAIN.;PERFECTTI, F., CAMACHO, J. P. M., UNIV GRANADA, DEPT GENET, E-18071 GRANADA, SPAIN.;BOSCH, J., UNIV AUTONOMA BARCELONA, ECOL CREAF, BELLATERRA 08193, SPAIN.",10.1890/08-0511.1,"111 RIVER ST, HOBOKEN 07030-5774, NJ USA",NA,"SPANISH MCYTSPANISH GOVERNMENT [GLB200604883/BOS]; JUNTA DE ANDALUCIA PAIJUNTA DE ANDALUCIA [RNM 220, CVI 165]","WE THANK SEVERAL SPECIALISTS WHO KINDLY IDENTIFIED POLLINATOR SPECIMENS: M. A. ALONSO ZARAZAGA, R. CONSTANTIN, S. FERNANDEZ GAYUBO, M. GOULA, F. GUSENLEITNER, J. HAVA, P. LEBLANC, M. A. MARCOS, J. C. OTERO, A. SANCHEZ RUIZ, A. SANCHEZ TERRON, M. SCHWARZ, A. TINAUT, F. VALLHONRAT, AND D. VENTURA. THE MINISTERIO DE MEDIO AMBIENTE AND CONSEJERI ` A DE MEDIO AMBIENTE OF THE JUNTA DE ANDALUCIA GRANTED PERMISSION TO WORK IN THE SIERRA NEVADA NATIONAL PARK. THIS STUDY WAS PARTIALLY SUPPORTED BY THE SPANISH MCYT (GLB200604883/BOS) AND JUNTA DE ANDALUCIA PAI (RNM 220 AND CVI 165).",0012-9615,2,245-263,WILEY,79,2009,ISI000265421200004,96,ENVIRONMENTAL SCIENCES \& ECOLOGY,91,ECOLOGY,JMGREYESUGR.ES,436NQ,"GOMEZ, JM (REPRINT AUTHOR), UNIV GRANADA, DEPT ECOL, E-18071 GRANADA, SPAIN",ISI,none,UNIV GRANADA;UNIV GRANADA;UNIV AUTONOMA BARCELONA,UNIV GRANADA,NA,"GOMEZ JM, 2009, ECOL MONOGR","GOMEZ JM, 2009, ECOL MONOGR",NA,NA,NA,NA
NERSON H,NERSON H,"EFFECTS OF POLLEN-LOAD ON FRUIT YIELD, SEED PRODUCTION AND GERMINATION IN MELONS, CUCUMBERS AND SQUASH",JOURNAL OF HORTICULTURAL SCIENCE \& BIOTECHNOLOGY,J. HORTICULT. SCI. BIOTECHNOL.,"FOUR CULTIVARS OF EACH OF THREE CUCURBIT SPECIES WERE USED TO EXAMINE THE EFFECTS OF POLLEN-LOAD (I.E., THE NUMBER OF POLLEN GRAINS DEPOSITED ON THE STIGMA OF PISTILLATE FLOWERS) ON FRUIT-SET, SEED-SET, AND GERMINABILITY (I.E., GERMINATION PERCENTAGE AND GERMINATION RATE) IN FOUR GREENHOUSE EXPERIMENTS. INCREASING POLLEN-LOAD INCREASED THE NUMBER OF FRUIT PER PLANT IN THE FOUR MELON CULTIVARS OVER TWO GROWING SEASONS, AND IN TWO NON-PARTHENOCARPIC CUCUMBERS, BUT HAD NO EFFECT ON ALL FOUR SQUASH CULTIVARS. IN MOST CASES, INCREASING POLLEN-LOAD INCREASED THE NUMBER OF FULLY-DEVELOPED SEEDS, DECREASED THE PERCENTAGE OF EMPTY SEEDS, AND TENDED TO DECREASE MEAN SEED WEIGHTS. ON AVERAGE, MELONS PRODUCED 2.2 FRUITS PER PLANT IN THE WINTER, AND ONLY 0.9 FRUITS PER PLANT IN THE AUTUMN. IN CONTRAST, MELONS PRODUCED 275 FULLY-DEVELOPED SEEDS PER FRUIT IN THE AUTUMN, BUT ONLY 57 SEEDS IN THE WINTER. MEAN MELON SEED WEIGHT WAS HIGHER IN AUTUMN, AND THE SUM OF ALL SEED YIELD COMPONENT EFFECTS RESULTED A SIGNIFICANTLY HIGHER SEED YIELD PER PLANT IN THE AUTUMN. GERMINABILITY OF MELON SEEDS FROM THE AUTUMN SEASON, AND OF SQUASH SEEDS FROM THE WINTER SEASON, WERE NOT SIGNIFICANTLY AFFECTED BY POLLEN-LOAD TREATMENT. THESE DATA ARE CONTRARY TO THE THEORY THAT MICROGAMETOPHYTE COMPETITION HAS A POSITIVE EFFECT ON THE VIGOUR OF THE PROGENY. THE LOWER GERMINABILITY OF MELON SEEDS OBTAINED BY PASSIVE POLLINATION (I.E., SELF-POLLINATION IN COVERED FLOWERS) MAY BE DUE TO THE FACT THAT POLLINATION WITHOUT INSECT OR HUMAN INTERFERENCE YIELDED ONLY A FEW SEEDS PER FRUIT, AND, UNDER SUCH CIRCUMSTANCES, THERE MAY BE A SURVIVAL ADVANTAGE FOR SLOW AND DISTRIBUTED GERMINATION.",NA,CUCURBITA-PEPO; POLLINATION INTENSITY; ZUCCHINI SQUASH; HONEY-BEE; SET; COMPETITION; PERFORMANCE; POPULATION; NUMBER; VIGOR,ENGLISH,ARTICLE,ARTICLE,3,"NERSON, H (REPRINT AUTHOR), AGR RES ORG, DEPT VEGETABLE CROPS, NEWE YAAR RES CTR, POB 1021, IL-30095 RAMAT YISHAY, ISRAEL.;AGR RES ORG, DEPT VEGETABLE CROPS, NEWE YAAR RES CTR, IL-30095 RAMAT YISHAY, ISRAEL.",10.1080/14620316.2009.11512566,"INVICTA PRESS, ASHFORD TN24 8HH, KENT, ENGLAND",NA,NA,NA,1462-0316,5,560-566,HEADLEY BROTHERS LTD,84,2009,ISI000272389600017,21,AGRICULTURE,27,HORTICULTURE,HNERSONVOLCANI.AGRI.GOV.IL,527TO,"NERSON, H (REPRINT AUTHOR), AGR RES ORG, DEPT VEGETABLE CROPS, NEWE YAAR RES CTR, POB 1021, IL-30095 RAMAT YISHAY, ISRAEL",ISI,none,NEWE YAAR RES CTR,NEWE YAAR RES CTR,NA,"NERSON H, 2009, J HORTICULT SCI BIOTECHNOL","NERSON H, 2009, J HORTICULT SCI BIOTECHNOL",NA,NA,NA,NA
LAZARO A;TOTLAND O,LAZARO A,LOCAL FLORAL COMPOSITION AND THE BEHAVIOUR OF POLLINATORS: ATTRACTION TO AND FORAGING WITHIN EXPERIMENTAL PATCHES,ECOLOGICAL ENTOMOLOGY,ECOL. ENTOMOL.,"1. UNDERSTANDING HOW FORAGING DECISIONS TAKE PLACE AT THE LOCAL SCALE IS RELEVANT BECAUSE THEY MAY DIRECTLY AFFECT THE FITNESS OF INDIVIDUAL PLANTS. HOWEVER, LITTLE IS KNOWN ABOUT HOW LOCAL DIVERSITY AND DENSITY AFFECT THE FORAGING BEHAVIOUR OF MOST POLLINATOR GROUPS. 2. BY INTRODUCING TWO POTTED PLANT SPECIES (SALVIA FARINACAE AND TAGETES BONANZA) INTO TWO POPULATIONS OF TARAXACUM OFFICINALE, WE INVESTIGATED HOW PLANT IDENTITY, THE MIXTURES OF THESE PLANT SPECIES, AND TOTAL PLANT DENSITY AFFECTED THE ATTRACTION TO AND THE FORAGING WITHIN A PATCH FOR SIX POLLINATOR GROUPS. 3. THE FORAGING BEHAVIOUR WAS MAINLY DRIVEN BY THE AVAILABILITY OF THE PREFERRED PLANT SPECIES, AND SECONDLY BY PATCH DIVERSITY AND DENSITY. IN GENERAL, DENSE PATCHES AND THOSE CONTAINING THE THREE-SPECIES MIXTURE WERE PREFERRED BY ALL INSECT GROUPS FOR ARRIVAL, ALTHOUGH MUSCOID AND HOVER FLIES RESPONDED LESS TO LOCAL FLORAL COMPOSITION THAN BEES. LOCAL DIVERSITY AND DENSITY HAD, HOWEVER, A WEAKER EFFECT ON FORAGING BEHAVIOUR WITHIN PATCHES. SITE DEPENDENCE IN RESPONSE TO FLORAL TREATMENTS COULD BE ATTRIBUTABLE TO DIFFERENCES BETWEEN SITES IN POLLINATOR ASSEMBLAGE AND TARAXACUM DENSITY. 4. STUDIES LIKE OURS WILL HELP TO UNDERSTAND HOW FORAGING DECISIONS OCCUR AT THE LOCAL SCALE AND HOW FORAGING PATTERNS MAY DIFFER BETWEEN POLLINATORS AND SITES.",APPROACHES TO A PATCH; FORAGING BEHAVIOUR; LOCAL PLANT DENSITY; LOCAL PLANT DIVERSITY; POLLINATOR GUILDS; SHIFTS BETWEEN SPECIES; VISITATION WITHIN A PATCH,BUMBLEBEE BOMBUS-TERRESTRIS; TEMPERATE GRASSLAND; COLOR PREFERENCES; FLOWER CONSTANCY; PLANT-DENSITY; BEES; COMMUNITIES; DIVERSITY; CONTEXT; HYBRIDIZATION,ENGLISH,ARTICLE,ARTICLE,24,"LAZARO, A (REPRINT AUTHOR), NORWEGIAN UNIV LIFE SCI, DEPT ECOL \& NAT RESOURCE MANAGEMENT, AS, NORWAY.;LAZARO, AMPARO, TOTLAND, ORJAN, NORWEGIAN UNIV LIFE SCI, DEPT ECOL \& NAT RESOURCE MANAGEMENT, AS, NORWAY.",10.1111/J.1365-2311.2010.01223.X,"COMMERCE PLACE, 350 MAIN ST, MALDEN 02148, MA USA",NA,NORWEGIAN RESEARCH COUNCILRESEARCH COUNCIL OF NORWAY [170532/V40],"WE THANK ALBERTO DIAZ, MANUEL HIDALGO, ANTON PEREZ, AND MARTIN PIAZZON FOR THEIR INVALUABLE HELP IN THE FIELD. THIS STUDY WAS SUPPORTED BY THE PROJECT 170532/V40, FINANCED BY THE NORWEGIAN RESEARCH COUNCIL.",0307-6946,5,652-661,WILEY-BLACKWELL,35,2010,ISI000281641900012,41,ENTOMOLOGY,86,ENTOMOLOGY,AMPARO.LAZAROUMB.NO,647TJ,"LAZARO, A (REPRINT AUTHOR), NORWEGIAN UNIV LIFE SCI, DEPT ECOL \& NAT RESOURCE MANAGEMENT, AS, NORWAY",ISI,none,NORWEGIAN UNIV LIFE SCI,NORWEGIAN UNIV LIFE SCI,NA,"LAZARO A, 2010, ECOL ENTOMOL","LAZARO A, 2010, ECOL ENTOMOL",NA,NA,NA,NA
PEISKER H;GORB SN,PEISKER H,ALWAYS ON THE BRIGHT SIDE OF LIFE: ANTI-ADHESIVE PROPERTIES OF INSECT OMMATIDIA GRATING,JOURNAL OF EXPERIMENTAL BIOLOGY,J. EXP. BIOL.,"THE SURFACE OF SOME INSECT EYES CONSISTS OF ARRAYS OF CUTICULAR PROTUBERANCES, WHICH ARE 50-300. NM IN DIAMETER, AND ARE TERMED CORNEAL NIPPLES OR OMMATIDIA GRATINGS. THEY WERE WIDELY REPORTED TO REDUCE THE REFLECTANCE FOR NORMALLY INCIDENT LIGHT, CONTRIBUTING TO CAMOUFLAGE BY REDUCING GLARE TO PREDATORS, WHILE FURTHERMORE ENHANCING THE INTAKE OF LIGHT, WHICH IS ESPECIALLY IMPORTANT FOR NOCTURNAL INSECTS. OUR PRELIMINARY OBSERVATIONS SUGGEST A THIRD FUNCTION: IN CONTRAST TO THE REST OF THE BODY, OMMATIDIA OF VARIOUS INSECTS REMAIN CLEAN, EVEN IN A HEAVY CONTAMINATED ENVIRONMENT. IN ORDER TO PROVE SUCH AN ANTI-CONTAMINATION HYPOTHESIS OF THESE STRUCTURES, WE MEASURED THE ADHESIVE PROPERTIES OF POLYMER MOULDS OF INSECT OMMATIDIA, AND COMPARED THESE DATA WITH CONTROL SURFACES HAVING THE SAME CURVATURE RADII BUT LACKING SUCH A NANOSTRUCTURE. A SCANNING ELECTRON MICROSCOPE (SEM) STUDY AND FORCE MEASUREMENTS USING AN ATOMIC FORCE MICROSCOPE (AFM) ON THE EYE SURFACES OF THREE DIFFERENT INSECT SPECIES, DRAGONFLY AESHNA MIXTA (ODONATA), MOTH LAOTHOE POPULI (LEPIDOPTERA) AND FLY VOLUCELLA PELLUCENS (DIPTERA), WERE UNDERTAKEN. WE REVEALED THAT ADHESION IS GREATLY REDUCED BY CORNEAL GRATING IN L. POPULI AND V. PELLUCENS WHEN COMPARED WITH THEIR SMOOTH CONTROLS. THE SMOOTH CORNEA OF A. MIXTA SHOWED NO STATISTICALLY SIGNIFICANT DIFFERENCE TO ITS CONTROL. WE ASSUME THAT THIS ANTI-ADHESIVE PHENOMENON IS DUE TO A DECREASE IN THE REAL CONTACT AREA BETWEEN CONTAMINATING PARTICLES AND THE EYE'S SURFACE. SUCH A COMBINATION OF THREE FUNCTIONS IN ONE NANOSTRUCTURE CAN BE INTERESTING FOR THE DEVELOPMENT OF INDUSTRIAL MULTIFUNCTIONAL SURFACES CAPABLE OF ENHANCING LIGHT HARVESTING WHILE REDUCING LIGHT REFLECTION AND ADHESION.",ANTI-ADHESION; ATOMIC FORCE MICROSCOPY (AFM); CONTACT AREA; OMMATIDIA GRATINGS; CORNEAL NIPPLES; INSECTS; JKR MODEL; SCANNING ELECTRON MICROSCOPE (SEM),SURFACE-ROUGHNESS; BEES APOIDEA; COMPOUND EYE; ADHESION; MOVEMENTS; CONTACT; ENERGY,ENGLISH,ARTICLE,ARTICLE,30,"PEISKER, H (REPRINT AUTHOR), CHRISTIAN ALBRECHT UNIV KIEL, DEPT FUNCT MORPHOL \& BIOMECH, BOT GARTEN 1-9, D-24098 KIEL, GERMANY.;PEISKER, HENRIK, CHRISTIAN ALBRECHT UNIV KIEL, DEPT FUNCT MORPHOL \& BIOMECH, D-24098 KIEL, GERMANY.;MAX PLANCK INST MET RES, EVOLUTIONARY BIOMAT GRP, D-70569 STUTTGART, GERMANY.",10.1242/JEB.043661,"BIDDER BUILDING, STATION RD, HISTON, CAMBRIDGE CB24 9LF, ENGLAND",NA,GERMAN SCIENCE FOUNDATION DFGGERMAN RESEARCH FOUNDATION (DFG) [GO 995/4-1]; ECEUROPEAN COMMISSION JOINT RESEARCH CENTREEUROPEAN COMMUNITY (EC) [ERAS-CT-2003-980409],"SINCERE THANKS TO CHRISTIAN LOBBE (JPK INSTRUMENTS, BERLIN, GERMANY) FOR HIS PERMANENT SUPPORT AND HELP IN THE EXPERIMENTAL SETUP. VALUABLE DISCUSSIONS WITH LARS HEEPE ON CONTACT MECHANICS ARE ACKNOWLEDGED. THIS WORK, AS PART OF THE EUROPEAN SCIENCE FOUNDATION EUROCORES PROGRAMME FANAS WAS SUPPORTED FROM FUNDS BY THE GERMAN SCIENCE FOUNDATION DFG (CONTRACT NO. GO 995/4-1) AND THE EC SIXT FRAMEWORK PROGRAMME (CONTRACT NO. ERAS-CT-2003-980409).",0022-0949,20,3457-3462,COMPANY BIOLOGISTS LTD,213,2010,ISI000282541800009,34,LIFE SCIENCES \& BIOMEDICINE - OTHER TOPICS,28,BIOLOGY,HPEISKERZOOLOGIE.UNI-KIEL.DE,659BK,"PEISKER, H (REPRINT AUTHOR), CHRISTIAN ALBRECHT UNIV KIEL, DEPT FUNCT MORPHOL \& BIOMECH, BOT GARTEN 1-9, D-24098 KIEL, GERMANY",ISI,none,CHRISTIAN ALBRECHT UNIV KIEL;MAX PLANCK INST MET RES,CHRISTIAN ALBRECHT UNIV KIEL,NA,"PEISKER H, 2010, J EXP BIOL","PEISKER H, 2010, J EXP BIOL",NA,NA,NA,NA
REN MX;TANG JY,REN MX,"ANTHER FUSION ENHANCES POLLEN REMOVAL IN CAMPSIS GRANDIFLORA, A HERMAPHRODITIC FLOWER WITH DIDYNAMOUS STAMENS",INTERNATIONAL JOURNAL OF PLANT SCIENCES,INT. J. PLANT SCI.,"IN MANY INSECT-POLLINATED ANGIOSPERMS, STAMENS ARE GROWN WITH ANTHERS COHERED, WHICH MIGHT AFFECT POLLINATION PROCESSES, BUT THE ECOLOGICAL SIGNIFICANCE OF THIS FUSION OF ANTHERS REMAINS UNEXPLORED. WE STUDIED THE BREEDING SYSTEM AND POLLINATION PROCESS OF DIDYNAMOUS CAMPSIS GRANDIFLORA (BIGNONIACEAE), WITH ANTHER FUSION IN PAIRS. POLLEN REMOVAL AND DEPOSITION WERE STUDIED IN THE FIELD FOR NATURALLY FUSED VERSUS EXPERIMENTALLY SEPARATED ANTHERS. CAMPSIS GRANDIFLORA FLOWERS WERE PROTANDROUS, WITH A LOW POLLEN : OVULE RATIO, WERE MOSTLY OUTCROSSED, AND WERE SELF-COMPATIBLE, WITH POLLINATORS NEEDED. THE MAIN POLLINATORS WERE POLLEN-COLLECTING HALICTID BEES AND NECTAR-FEEDING VESPID WASPS. HALICTID BEES SCOOPED POLLEN ON LONG ANTHERS FOR A SIGNIFICANTLY LONGER TIME PERIOD AND REMOVED TWICE AS MUCH POLLEN FROM FUSED ANTHERS THAN FROM SEPARATED ANTHERS. VESPID WASPS CONTACTED FUSED SHORT ANTHERS MORE FREQUENTLY AND MORE PRECISELY AND REMOVED NEARLY TWICE AS MUCH POLLEN THAN WHEN CONTACTING SEPARATED SHORT ANTHERS. POLLEN DEPOSITION ON STIGMAS WAS NOT AFFECTED BY MANIPULATION OF EITHER PAIR OF ANTHERS. OUR RESULTS SUGGEST THAT ANTHER FUSION CAN PROMOTE POLLEN REMOVAL EFFICIENCY BY AGGREGATING ANTHERS AT A SIMILAR POSITION, INCREASING THE POLLINATOR'S CONTACT PROBABILITY AND PRECISION WITH ANTHERS AND EXTENDING THE VISIT DURATION OF THE POLLINATOR. THE MAINTENANCE OF DIDYNAMOUS STAMENS MAY REFLECT FUNCTIONAL ADVANTAGES OF THE FUSED ANTHERS IN TWO DISTINCT HEIGHTS BECAUSE THEY CAN INTERACT WITH POLLINATORS OF DIFFERENT BEHAVIORS AND SIZES.",ANTHER FUSION; BREEDING SYSTEM; CAMPSIS GRANDIFLORA; DIDYNAMOUS STAMENS; POLLEN : OVULE RATIO; STIGMA CLOSURE,ANIMAL-POLLINATED PLANTS; FLORAL EVOLUTION; OVULE RATIOS; BIGNONIACEAE; DISPERSAL; MECHANISM; RADICANS; SUCCESS; SYSTEM,ENGLISH,ARTICLE,ARTICLE,7,"REN, MX (REPRINT AUTHOR), CHINESE ACAD SCI, WUHAN BOT GARDEN, KEY LAB AQUAT BOT \& WATERSHED ECOL, WUHAN 430074, PEOPLES R CHINA.;REN, MING-XUN, TANG, JING-YU, CHINESE ACAD SCI, WUHAN BOT GARDEN, KEY LAB AQUAT BOT \& WATERSHED ECOL, WUHAN 430074, PEOPLES R CHINA.;REN, MING-XUN, BEIJING NORMAL UNIV, MOE KEY LAB BIODIVERS SCI \& ECOL ENGN, BEIJING 100875, PEOPLES R CHINA.",10.1086/650157,"1427 E 60TH ST, CHICAGO, IL 60637-2954 USA",NA,"NATIONAL NATURAL SCIENCE FOUNDATION OF CHINANATIONAL NATURAL SCIENCE FOUNDATION OF CHINA [30700089, 30970459]; MOE KEY LABORATORY FOR BIODIVERSITY SCIENCE AND ECOLOGICAL ENGINEERING [K0801]","WE ARE GRATEFUL TO PROFESSOR HUAN-LI XU FOR INSECT IDENTIFICATION AND THANK PROFESSOR SPENCER C. H. BARRETT, DR. QUANGUO ZHANG, AND DR. JORDI LOPEZ-PUJOL FOR THEIR INSIGHTFUL COMMENTS. THIS STUDY WAS FUNDED JOINTLY BY THE NATIONAL NATURAL SCIENCE FOUNDATION OF CHINA (30700089, 30970459) AND THE MOE KEY LABORATORY FOR BIODIVERSITY SCIENCE AND ECOLOGICAL ENGINEERING (K0801).",1058-5893,3,275-282,UNIV CHICAGO PRESS,171,2010,ISI000274602500005,30,PLANT SCIENCES,12,PLANT SCIENCES,RENMINGXUNYAHOO.COM.CN,556PD,"REN, MX (REPRINT AUTHOR), CHINESE ACAD SCI, WUHAN BOT GARDEN, KEY LAB AQUAT BOT \& WATERSHED ECOL, WUHAN 430074, PEOPLES R CHINA",ISI,none,CHINESE ACAD SCI;BEIJING NORMAL UNIV,CHINESE ACAD SCI,NA,"REN MX, 2010, INT J PLANT SCI","REN MX, 2010, INT J PLANT SCI",NA,NA,NA,NA
